"","Reference","Left","KWIC","Right"
"324","PA719930,2019-11-15,Vallaud, Boris","1 milliard à Jersey , taxés à 0 %, on pourrait rattraper ce déficit fiscal à un taux pivot de 25 % ; le bénéfice irlandais de","PSA serait alors taxé","à 20 % et celui réalisé à Jersey , à 25 %. Songez que si les États-Unis avaient appliqué cette mesure pour l'' année 2016,"
"325","PA331481,2018-01-18,Le Maire, Bruno","enjeu aussi lourd et majeur pour la vie de l'' entreprise ? Tout simplement parce que, dans la mesure où les dispositions","correspondantes sont inscrites","dans le code civil, elles sont opposables devant les tribunaux. Ainsi, n'' importe quel actionnaire d'' une entreprise"
"326","PA721560,2017-11-08,Griveaux, Benjamin",". L'' État refusera de le valider si ces exigences ne sont pas respectées. Enfin, la loi prévoit que, si ces obligations","ne sont pas respectées",", l'' État et les collectivités locales peuvent demander à l'' entreprise le remboursement de certaines aides publiques"
"327","PA642764,2019-11-07,Aviragnet, Joël","comportements à risque sont cachés, donc insuffisamment repérés. Il faut lutter contre ce phénomène car la jeunesse","française est prise","dans ces questions. Vous savez aussi bien que moi que quand on va à la sortie d'' un collège du fin fond de la campagne"
"328","PA719372,2020-05-15,Kasbarian, Guillaume","prévu par la loi du 6 août 2019 de transformation de la fonction publique, qui allait jusqu'' au 16 juin prochain, ne","pourra être respecté",", il faut l'' aménager. Pour plus de détails, je vous renvoie aux pages 94 et 95 de mon rapport. Quel est l'' avis du"
"329","PA719914,2020-01-07,Darrieussecq, Geneviève",", pour apprécier la pertinence du plan famille. Cette consultation montre que le plan est "" bien né "", c''est-à-dire qu''","il est particulièrement apprécié","et bien mis en valeur dans toutes les unités, dans chaque armée, que les attentes sont réelles et qu'' il faut accélérer"
"330",",2020-06-22,","tout d'' abord rappeler quelques données factuelles : 262 personnes sont actuellement détenues en France après","avoir été condamnées","des chefs d'' infraction terroriste. Si le quantum de peine est élevé et si certaines sont condamnées à des peines"
"331","PA609590,2017-10-19,Rabault, Valérie","ne le sont pas. Mes chers collègues , le choix est simple. Par cet amendement, nous vous proposons que les intérêts du PEL","ne soit pas taxés",", comme c'' est le cas aujourd''hui, pendant les douze ans de sa détention. Je rappelle que 13 millions de Français"
"332","PA720746,2019-06-18,Waserman, Sylvain","ses partenaires sociaux. Actuellement, si l'' on change de boulangerie, on perd ses amis. La séance est suspendue. La","séance est reprise",". La parole est à Mme Martine Leguille-Balloy , pour exposer sa question, n° 766, relative à l'' emploi dans la filière"
"333","PA588884,2020-02-20,Autain, Clémentine","un régime dit universel ! Mais c'' est bel et bien ce vers quoi nous nous dirigeons ... Or la liste des métiers dangereux n","'' est pas encore arrêtée",": elle le sera par ordonnance. On voit bien encore une fois que ce texte à trous pose problème, qu'' on n'' y voit jamais"
"334","PA720268,2020-02-21,Damaisin, Olivier","et par les majorités précédentes. Ah non ! Il faut que vous regardiez ce qui a été fait par les majorités précédentes ! Ce","public est même oublié","dans certains contre-projets élaborés dans cette assemblée, le mot "" agriculteurs "" ne figurant même pas dans leurs"
"335","PA721836,2018-09-28,Barrot, Jean-Noël","n'' encourent aucune sanction et qu'' il convient d'' en introduire une ; ils disent que, dès lors que le délai prévu pour le","remboursement est dépassé",", alors des intérêts de retard sont facturés, ce qui est un peu différent. Il se trouve qu'' une autorité de supervision"
"336","PA721960,2017-10-25,Obono, Danièle","risques, à savoir les salariés qui produisent et les chefs d'' entreprise qui investissent. Ces petites entreprises n","'' étant finalement pas si bien représentées","par la majorité, dont les discussions ne portent que sur des propositions favorables au MEDEF et aux grandes"
"337","PA608416,2018-06-07,Hetzel, Patrick",", je suppose que ce sera le cas –, pourquoi de telles dispositions dans cette proposition de loi ? Tout cela mériterait d","'' être traité","de manière simple et cohérente lorsque nous débattrons de la place du numérique à l'' école. Plusieurs questions nous"
"338","PA721384,2018-04-17,Fontenel-Personne, Pascale","non dispensés. Cette absence de professeurs a créé un grave déficit d'' enseignement pour ces collégiens, qui ne pourra","pas être rattrapé","d'' ici à la fin de l'' année et creuse ainsi d'' importantes inégalités entre les élèves. Malheureusement, vous le savez,"
"339","PA337633,2020-05-08,Girardin, Annick","les outre-mer sans raison impérieuse, des périodes de quarantaine. Toute personne arrivant dans un territoire","ultramarin est invitée","à respecter une quarantaine de quatorze jours, à domicile ou dans une structure collective. Ce choix relève du préfet"
"340","PA719608,2018-07-03,Ménard, Emmanuelle","ne peut pas être de mauvaise foi et ne sera donc pas visé par cette loi. Pour résumer, un site d'' information en ligne","pourra être sanctionné",", mais pas un site journalistique. Qui les distinguera ? Qui dira que tel site est journalistique ou non ? Prenons l''"
"341","PA720278,2018-05-23,Orphelin, Matthieu","du consommateur, étiqueter la viande produite hors d'' Europe lorsque des antibiotiques ou des farines animales","qui sont tous deux interdits","en Europe sont utilisés ; faire cesser la concurrence déloyale que représentent les aliments importés en Europe et"
"342","PA759832,2020-07-01,Pannier-Runacher, Agnès","de l'' épargne jusqu'' au 31 décembre 2020. On a fixé l'' échéance au 15 novembre pour s'' assurer que toutes les demandes","pourront être traitées et les versements effectués","avant le 31 décembre 2020, pour que l'' exonération d'' impôt sur le revenu accordée pour l'' année 2020 s'' applique. Ce"
"343","PA720512,2020-01-07,Pietraszewski, Laurent","le président me regarde avec bienveillance, chaque fois que je dépasse les deux minutes de temps de parole. Quoi qu'' il","en soit, vous avez compris","– c'' est du moins ce que je me suis efforcé de vous démontrer – la volonté du Gouvernement de trouver un compromis et d''"
"344","PA720684,2020-05-15,Dumont, Pierre-Henri","une autorité nationale – et non binationale, comme le prévoient les traités – pour assurer la sécurité du tunnel, ne","peut être prise","que si aucune autre solution n'' a été trouvée. Cette disposition, qui assure un juste équilibre entre le respect des"
"345","PA718926,2018-07-25,Dharréville, Pierre","d'' assurance chômage. Aujourd''hui, il n'' existe aucune étude sur le sujet, alors même qu'' un peu plus d'' un chômeur sur","deux est indemnisé","à ce titre. Le non-recours peut aussi bien concerner le défaut d'' inscription sur les listes de demandeurs d'' emploi,"
"346","PA335532,2019-05-21,Pau-Langevin, George","qui doit être fait en matière de lutte contre les discriminations. Nous le savons, de nombreuses personnes issues de la","diversité sont admises","et présentes dans l'' administration, et c'' est heureux. Néanmoins, c'' est beaucoup moins le cas dans la haute fonction"
"347","PA722236,2019-09-11,Djebbari, Jean-Baptiste","qui ont été évoquées, je veux redire qu'' elles sont le fruit d'' un comité d'' experts en accidentologie, qu'' elles","ne seront pas inscrites","dans la loi et que l'' avis rendu par la commission départementale de la sécurité routière ne sera pas un avis"
"348","PA336175,2020-07-09,Pinel, Sylvia","du Gouvernement sur la période de référence. Pour obtenir un crédit égal à 20 % de la masse salariale, la période","retenue est comprise",", aux termes de l'' article, entre le 1er février et le 31 mai 2020. Or de nombreuses entreprises du secteur du tourisme n''"
"349","PA720846,2018-07-05,Lachaud, Bastien","exempte de morts par armes à feu. Si je prends le cas le plus récent porté à la connaissance du grand public, deux hommes","ont été tués","par balle lors d'' une fusillade dans une cité de Salon-de-Provence durant la nuit de lundi à mardi, a -t - on appris de"
"350","PA345619,2020-01-07,Philippe, Édouard","les réserves constituées par les régimes autonomes avaient vocation à servir la transition des régimes autonomes.","Ce sera inscrit","dans le projet de loi, et donc discuté ici même. Si nous voulions agir autrement, nous ne le pourrions d'' ailleurs sans"
"351","PA722202,2020-02-20,Jumel, Sébastien","difficile sa définition. Il faudra apparemment encore beaucoup de travail pour nous fournir quelque assurance qu''","elle sera prise","en considération. Les projections financières sont pour le moins lacunaires, le Conseil d'' État l'' a dit ; l'' étude d''"
"352","PA330357,2020-06-11,Dussopt, Olivier",", de la relance de l'' activité et de la réouverture des commerces. Toutefois, certains secteurs d'' activité doivent","encore être accompagnés",", notamment le tourisme, l'' hôtellerie, la restauration, l'' événementiel, le sport, la culture et le commerce de"
"353","PA607619,2018-10-31,Molac, Paul","affichée de votre ministère, mais nous savons qu'' elle prendra du temps, raison pour laquelle des actes significatifs","devront être pris","rapidement. La parole est à M. Yannick Kerlogot , pour le groupe La République en marche . En préambule et en qualité de"
"354","PA717153,2017-11-13,Buzyn, Agnès","un risque sanitaire à l'' ensemble de la population. Le rendement attendu sur le droit de timbre s'' avère très faible ;","il est largement dépassé","par le coût supplémentaire lié au non-recours aux soins, à l'' aggravation des pathologies, au report sur les coûts"
"355","PA721194,2019-07-02,Dumas, Frédérique","au Sénat et en CMP , seul le différentiel entre les dépenses de l'' année scolaire 2019-2020 et celles de l'' année","précédente sera pris","en compte. Cela signifie que les communes qui finançaient déjà tout ou partie des écoles maternelles privées cette"
"356","PA1874,2018-02-20,Le Fur, Marc","Que se passera -t - il pour ces cours d'' appel ? Je prends l'' exemple de la Bretagne : quarante et un parlementaires, ce qui n","'' est pas rien, ont appelé","votre attention sur cette question, madame la garde des sceaux. Actuellement le ressort de la cour d'' appel de Rennes"
"357","PA703535,2018-04-04,Lemoyne, Jean-Baptiste",", ce qui a permis de financer nombre d'' actions multilatérales essentielles. Le Président de la République s","'' est d'' ailleurs engagé","à porter le projet d'' une TTF européenne destinée à financer le développement. Afin de changer de point de vue et de"
"358","PA719608,2019-09-17,Ménard, Emmanuelle","ne s'' agit pas d'' innocenter à tout prix le binôme : lorsqu'' une fraude ou une volonté de fraude sont avérées, le suppléant","peut être condamné",", mais il est indispensable que la sanction soit mesurée. L'' inéligibilité du candidat et du suppléant doit s'' appuyer"
"359","PA606098,2020-03-31,Marleix, Olivier",". J '' ai en tête l'' exemple des restaurateurs, qui émettent des contrats de travail de 40 heures par semaine, mais qui ne","peuvent être indemnisés","que sur la base de 35 heures, ce qui leur pose évidemment un problème. Enfin, pour certains secteurs, la réponse de l''"
"360","PA607395,2018-05-24,Travert, Stéphane","fixer leur montant, nous avons retenu le principe de proportionnalité : s'' il enfreint la loi, un groupe comme Lactalis","pourra être condamné","à hauteur de 2 % de son chiffre d'' affaires, les peines infligées aux producteurs étant moins lourdes. Nous"
"361","PA720728,2019-12-19,Mattei, Jean-Paul",". Malgré les menaces qui pèsent sur la stabilité du monde, sur la croissance européenne et mondiale, comme nous nous","y sommes engagés","devant les Français , le projet de loi de finances présenté par le Gouvernement et enrichi par les débats"
"362","PA721836,2018-11-06,Barrot, Jean-Noël","d'' euros, en progression de 130 millions d'' euros en un an. Les heures de formation civique et d'' apprentissage du","français seront doublées",", et un module de formation spécifique de six cents heures sera créé à destination des étrangers ne sachant ni lire ni"
"363","PA720326,2017-10-27,Hammouche, Brahim","l'' amendement n° 499. L'' article 36 introduit des expérimentations en matière de télémédecine, dont les cahiers des","charges seront arrêtés","par les ministres en charge de la santé et de la Sécurité sociale . Afin de garantir la sécurité des patients, le présent"
"364","PA609590,2019-05-16,Rabault, Valérie",", vous dites aux fonctionnaires de certaines catégories qu'' ils n'' ont pas à s'' embêter à passer un concours puisqu'' ils","pourraient être recrutés","différemment, selon des règles que nous ne connaissons pas. Je vous rappelle, monsieur le secrétaire d'' État , que vous"
"365","PA759832,2020-05-20,Pannier-Runacher, Agnès","dans ce domaine, de nombreux dossiers de collectivités locales ou d'' entreprises nous ayant été transmis parce qu''","ils étaient bloqués",". Nous sommes intervenus pour près de 300 entreprises et 50 filières, à raison de conférences téléphoniques"
"366","PA267336,2019-12-17,Giraud, Joël","le rapporteur général, je comprends que vous reprenez l'' amendement n° 473 de M. Barrot . En effet. Cet amendement, qui","a été accepté","dans le cadre de l'' article 88, vise à rétablir, dans la mission "" Immigration, asile et intégration "", 200 000 euros de"
"367","PA906,2018-04-21,Collomb, Gérard","dont vous parlez commettent quelque exaction que ce soit contre des personnes qui tenteraient de venir en France ,","ils seront arrêtés et poursuivis",". Nous le faisons ici, nous le faisons là, et nous essayons d'' agir avec discernement. Vous avez vu ce qui s'' est passé à"
"368","PA719578,2018-05-24,Prud''homme, Loïc","de légiférer par ordonnances afin de rééquilibrer les contrats entre agriculteurs et distributeurs, de sorte que les","premiers soient mieux rémunérés",", et de mettre fin à la guerre des prix, destructrice de valeur pour tous, mais surtout pour les agriculteurs, en amont de"
"369","PA330357,2020-07-08,Dussopt, Olivier",", je ne sais pas vous dire si tous les éléments de la relance figureront dans le PLF ou s'' il faudra un texte spécifique qui","pourrait être examiné","dès la rentrée. Nous travaillons donc avec le souci d'' être complet et de tenir compte à la fois des délais fixés par la loi"
"370","PA721210,2020-05-08,Corbière, Alexis","de M. Stéphane Peu . Cet important sujet a déjà été abordé dans le cadre de précédentes discussions : dire que le","Parlement serait représenté par deux députés",", c'' est ne pas dire que le Parlement est représenté. Nous comptons aujourd''hui huit groupes parlementaires, demain"
"371","PA721314,2018-04-17,Schellenberger, Raphaël","que le droit international. Par ailleurs, nos collègues de la majorité invoquent régulièrement un argument qui ne","peut être accepté","dans ce débat : celui de l'' efficacité. Bien sûr, nous devons accélérer la procédure d'' instruction des demandes d''"
"372","PA722086,2017-10-27,Taquet, Adrien","d'' un VPH moins cher à l'' étranger ouvre bien droit à une prise en charge par l'' assurance maladie obligatoire, pourvu qu''","il soit inscrit","sur la liste des produits et prestations remboursables, la LPPR . L'' achat à l'' étranger n'' est pas le plus simple pour l''"
"373","PA607553,2017-10-12,Potier, Dominique",", de même que la loi contre le gaspillage alimentaire et bien d'' autres projets. Il s'' agit de belles réalisations, qui","vont être mises en scène, inscrites","dans un récit et, je l'' espère, amplifiées. Au nom de ma famille, la gauche, permettez - moi de rappeler que, lors du"
"374","PA721824,2017-12-08,Renson, Hugues","à M. Joël Giraud , pour soutenir l'' amendement n° 151. Je le retire, monsieur le président. La séance est suspendue. La","séance est reprise",". Je suis saisi de plusieurs amendements portant articles additionnels après l'' article 27. La parole est à Mme Sophie"
"375","PA405480,2019-02-19,Pupponi, François","que les insultes et les agressions constituent son lot quotidien, et que trop de drames surviennent en France , où des","juifs sont tués","parce qu'' ils sont juifs. Non, la France n'' est pas antisémite. Oui, la France a un problème avec l'' antisémitisme. Oui,"
"376","PA720546,2020-02-20,Bruneel, Alain","qu'' ils m'' ont rapporté, trois absences, même médicales, leur valent une convocation par l'' encadrement. Le droit à se","soigner est remis","en cause, le profit passe avant tout. Pourtant, à Douai , on compte plus de 700 salariés suivis par la maison"
"377","PA720074,2019-10-25,Janvier, Caroline","de favoriser l'' emploi des travailleurs handicapés et d'' inciter les entreprises à aller au-delà du seuil de 6 %, qui n","'' est pas respecté",", mais aussi de prendre en compte la réalité des surcoûts générés par le fait que ces travailleurs plus vulnérables"
"378",",2019-04-02,",", ce qui correspond à plus de 150 milliards d'' euros économisés par les consommateurs. Récemment, plusieurs décisions","ont été prises","pour accroître la dynamique de réalisation d'' économies d'' énergie, renforcer la lisibilité des incitations"
"379","PA720430,2017-09-26,Bernalicis, Ugo","de l'' intéressé. Cela va donc dans le sens des libertés. C '' est au contraire une mesure privative de liberté ! Le mensonge","devrait être interdit","dans l'' hémicycle ! Il ne vous resterait plus grand-chose à dire ! La parole est à Mme Emmanuelle Ménard , pour soutenir l''"
"380","PA718850,2020-05-12,Cordier, Pierre","assumer ses responsabilités et nous dire pourquoi les mesures à prendre ne l'' ont été que huit semaines plus tard. Les","députés sont élus","pour contrôler votre action. Comptez sur le groupe Les Républicains pour assumer cette responsabilité avec rigueur,"
"381","PA332614,2019-02-14,Juanico, Régis","notre pays d'' une grande liberté. Elles peuvent choisir leurs élèves, les renvoyer dans les écoles publiques lorsqu''","ils sont exclus",", limiter le nombre d'' élèves par classe et se dispenser de tout effort d'' inclusion scolaire ainsi que de l'' accueil d''"
"382",",2020-02-11,","n'' ont pas traduit cette conviction en actes. Un budget de 3 % du PIB était prévu, à l'' origine, pour 2010. L'' engagement a","ensuite été pris","de l'' atteindre au terme du programme européen 2020. Nous y sommes aujourd''hui et, malheureusement, l''"
"383","PA720830,2018-09-26,Thomas, Valérie","de l'' île et rompre sa trop grande dépendance vis-à-vis du Venezuela . Au cours des dernières années, le régime cubain s","'' est engagé","dans l'' ouverture de nouveaux partenariats, notamment avec la France . Il en est résulté la contribution de notre pays à"
"384","PA267318,2018-11-28,Grelier, Jean-Carles",", un peu plus d'' un million d'' enfants de moins de quinze ans ont été ainsi détectés et huit millions d'' adultes n'' ont","pas été dépistés ni traités","de manière suffisamment anticipée et satisfaisante. Par cette précision de vocabulaire, il s'' agit simplement de"
"385","PA722202,2020-02-21,Jumel, Sébastien","la part de Smarties entre les 230 milliards d'' euros capitalisés et les 5 000 milliards d'' épargne populaire ?","Quand seront exclus","de la solidarité les revenus du travail qui dépassent 120 000 euros, quand les pensions qui doivent offrir aux"
"386","PA721984,2018-11-22,Latombe, Philippe","substantielle des revenus de l'' un des deux parents, parce que son entreprise a fermé et qu'' il est au chômage, que ce","ne soit pas pris","en compte dans le cadre du barème et que la CAF ne demande à ce parent une contribution supérieure à celle fixée"
"387",",2018-05-16,","de la petite Louise , adolescente française assassinée en Belgique , dont j'' ai reçu la maman, Sabine Larose . La petite","Louise était harcelée","sexuellement par son voisin, qui suivait un traitement de castration chimique. Ce traitement inhibait sa libido et l''"
"388","PA334149,2020-03-24,Fasquelle, Daniel","vies. Il menace aussi gravement l'' existence de nos entreprises et des emplois qui en dépendent. Certes, des mesures","ont été prises","et je veux saluer ici la réactivité et la mobilisation du Gouvernement . Il existe encore cependant de trop nombreuses"
"389","PA345619,2020-04-29,Philippe, Édouard","et que nous appliquons. Dans ce cadre, avez -vous précisé, vous auriez souhaité que l'' ouverture des restaurants et des","cafés soit appréciée","département par département, peut-être par le préfet ou le maire. Or nous avons décidé que la réouverture des cafés et"
"390","PA332614,2020-02-27,Juanico, Régis",". C '' est faux ! Cela aussi, c'' est un héritage, peut-être ? Oui ! Mais le coup de l'' héritage, ça va bien six mois ou un an après","avoir été élu","– d'' autres l'' ont fait avant vous ! Non, il faut bien dix ans pour rattraper ce qui a été fait ! Vous avez été élus il y a trois"
"391","PA2150,2018-04-16,Mélenchon, Jean-Luc",", alors, on s'' étonnera que celle-ci ne nous ait pas conduits à secourir les malheureux Rohingyas , dont chacun sait qu''","ils sont persécutés",", ou, sur le même territoire, les malheureux Kurdes , dont chacun sait également qu'' ils sont abandonnés. Oui !"
"392","PA340343,2018-02-22,Saulignac, Hervé","ruinées, trois victimes se sont suicidées, trente-cinq personnes ont été mises en examen, des notaires ont","déjà été condamnés et sanctionnés","par leur ordre mais les juges d'' instruction se sont succédé et le dossier judiciaire semble au point mort. En outre, les"
"393","PA720430,2019-05-13,Bernalicis, Ugo",", on peut évoquer, à cet égard, cette invention qu'' est le détachement d'' office. Jusqu'' à présent, un fonctionnaire","pouvait être détaché","dans le privé. C '' est le cas, d'' ailleurs, d'' un certain nombre de collaborateurs parlementaires, qui, engagés sous"
"394","PA607846,2020-06-10,Darmanin, Gérald","2020 est une annus horribilis pour les finances publiques. Concernant 2019, le problème est que votre amendement ne","peut être accepté","au sein d'' un texte législatif tel qu'' une loi de règlement. Avis défavorable ou demande de retrait. Aucune demande d''"
"395","PA1960,2018-11-22,Leroy, Maurice",". J'' espère que j'' aurais été suivie par sa présidente et ses membres. Nous reprenons l'' amendement ! L'' amendement n°","432 est repris",". La parole est à Mme Danièle Obono . Nous reprenons cet amendement parce que, dans le cadre du projet de loi renforçant la"
"396","PA720278,2018-05-25,Orphelin, Matthieu","et j'' émets à leur endroit un avis favorable. La parole est à M. Matthieu Orphelin . Je retire mon amendement, n° 1634,","qui sera appelé prochainement et qui aurait pu","faire l'' objet de cette discussion commune. Je n'' avais pas d'' inquiétude, car les débats tenus en commission des"
"397","PA267233,2019-09-12,Bouillon, Christophe","auto-écoles en ligne. L'' actualité nous a donné de nombreux exemples d'' escroquerie en la matière. De nombreux jeunes","ont été trompés","par des publicités mensongères et les médias s'' en sont fait l'' écho. Un contrôle doit s'' exercer à l'' échelle du"
"398","PA721202,2018-06-03,Coquerel, Éric","donner des consignes aux préfets. L'' argument du laisser-faire ne tient donc pas. Ensuite, la loi SRU , non seulement n","'' est pas respectée","partout, mais toutes les garanties ne sont pas données pour qu'' elle le soit. J '' ai bien écouté mon collègue du groupe La"
"399","PA643127,2019-11-21,Questel, Bruno","une difficulté, dans la mesure où les faits incriminés restent constitutifs d'' une infraction pénale, et doivent","donc être sanctionnés","comme tels. À défaut d'' une demande de retrait, que je n'' ose formuler, mon avis est défavorable. Quel est l'' avis du"
"400","PA720908,2018-05-14,Moutchou, Naïma","rejettera évidemment la motion de renvoi en commission, et ce pour deux raisons. La première est de pure forme : ce texte","a été examiné la semaine passée","en commission des lois pendant plus de huit heures, au cours desquelles toutes les voix se sont exprimées – madame"
"401","PA718838,2018-09-27,Brun, Fabrice",", ce qui conduit les URSSAF d'' une part et la Direction du contrôle fiscal d'' autre part, à considérer que le seuil des 20","salariés est dépassé","et à prononcer des redressements cumulés qui pèsent lourdement sur les résultats. Le raisonnement de l''"
"402","PA721996,2020-01-09,Loiseau, Patrick","pour 1 200 habitants, elle s'' établit à 1 pour 1 600 en Vendée . Il faut compter trois mois d'' attente pour une IRM, et les","radios sont traitées","à distance par le CHU de Nantes à la suite du départ de plusieurs spécialistes. On m'' a même précisé qu'' il ne reste presque"
"403","PA717153,2019-01-30,Buzyn, Agnès","dans un établissement ou pour recevoir des soins. Ce travail est en cours, et un rapport nous sera remis le 15 mars. Des","mesures seront prises","dans une loi, cette année, pour répondre à l'' anxiété des Français , notamment des personnes âgées, face à la"
