"","Reference","Left","KWIC","Right"
"1",",2018-11-13,",", mais environ 90 000 personnes chargées de l'' accompagnement des personnes en situation de handicap, dont une partie","est en contrat aidé",". Nous souhaiterions qu'' il s'' agisse de 80 000 AESH, mais la situation est telle... Vous avez voulu que nous allions au"
"2","PA719338,2019-12-11,Melchior, Graziella","avec les associations d'' aide alimentaire. De nombreux commerces de plus petite taille, dont les artisans de bouche,","sont déjà engagés","dans une démarche de don alimentaire, mais uniquement sur la base du volontariat. L'' amendement vise donc à imposer la"
"3","PA722142,2018-02-01,Ruffin, François",", je vous vire. "" Ce management mortifère peut avancer tel un rouleau compresseur aveugle : il n'' est pas puni ; il n''","est pas sanctionné","; il ne paie pas le prix des hommes qu'' il écrase. Pire , il jouit de la complicité des pouvoirs publics, du moins de leur"
"4","PA331582,2018-01-18,Vigier, Philippe","cela s'' appelle un dépassement d'' honoraires. Les actes réalisés par un biologiste – je parle en connaissance de cause –","sont -ils remboursés","s'' ils ne sont pas accrédités ? La réponse est non. Cessons donc de brandir l'' argument du conventionnement partiel :"
"5","PA722366,2019-09-10,Fugit, Jean-Luc","aux nouvelles perspectives. C '' est enfin avoir conscience que les plus modestes de nos concitoyens auront besoin d''","être aidés","pour aller vers des mobilités plus propres et plus actives. Nous devons donc comprendre le réel, mais sans oublier l''"
"6","PA335054,2018-11-19,Karamanli, Marietta","l'' engagement de la procédure accélérée. Sous l'' actuelle législature, débutée en juin 2017, plus de 50 % des textes","sont examinés","selon cette procédure. Or, comme le disait l'' éminent Guy Carcassonne , "" pour faire de bonnes lois, on n'' a pas encore"
"7","PA759830,2019-11-26,Wargon, Emmanuelle",", monsieur le député. Les transports ont effectivement une forte responsabilité dans ce phénomène, et nous nous","sommes engagés","à accompagner la mise en place de zones à faibles émissions, notamment dans le territoire d'' Aix-Marseille . L'' un des"
"8","PA267785,2018-04-22,Larrivé, Guillaume","avec votre intention d'' examiner les demandes en six mois, monsieur le ministre d'' État . Si la demande d'' asile","est examinée","en six mois et que, par hypothèse, dans 70 % des cas elle aboutit à un rejet, cela veut dire que vous aurez, en réalité,"
"9","PA405480,2019-03-12,Pupponi, François","Pupponi , que je sache, vous n'' êtes pas élu en Corse . Vous allez donc laisser les élus de Corse décider de leur sort. Je","suis élu","de la nation ! Mais oui, bien sûr. Ce que je dis est clair : il faut laisser les deux préfets et les élus locaux décider de l''"
"10","PA721210,2018-02-01,Corbière, Alexis","le seul horizon de vie pour le patient est la mort dans la souffrance, on peut dire, d'' une certaine manière, que la vie s''","est arrêtée",", bien que le cœur n'' ait pas cessé de battre. Cette perception d'' une vie à l'' arrêt, seul le patient peut la ressentir, à l''"
"11","PA2150,2017-10-20,Mélenchon, Jean-Luc","politique. C '' est évidemment à l'' élu ou au ministre d'' assumer pleinement les décisions politiques qui","sont prises",". À condition, toutefois, de savoir. Or vous ne nous dites rien sur ce point, monsieur le ministre. Durant cinq ans, a -t -"
"12","PA720878,2019-10-30,Saint-Martin, Laurent","de leurs réseaux. Le projet de budget pour 2020 prolonge cette dynamique. Les grands projets de transformation","seront poursuivis","et amplifiés. La direction générale des finances publiques continuera la mise en œuvre de la réforme territoriale"
"13","PA720798,2020-05-26,Aliot, Louis","proposition de loi ne doit pas donner lieu à polémique et beaucoup ont été surpris et indignés de la manière dont avait","été traitée",", en première lecture, cette question particulièrement sensible, tant il est vrai qu'' on ne pouvait pas faire passer l''"
"14","PA610654,2019-10-24,Nilor, Jean-Philippe","100 % ? Les bénéfices restent importants, quand de telles marges sont taxées à 20 %. C '' est une question de fond, qui doit","être traitée",". Un règlement ou une législation doivent permettre de lutter contre la "" profitation "", c''est-à-dire la fixation de"
"15","PA720870,2017-07-26,Mbaye, Jean François","aux collègues situés à ma gauche et à ma droite à tous mes collègues, de bien vouloir respecter ce pourquoi nous avons","été élus",", ce pourquoi nous devons travailler. Cela fait des semaines, des jours et des nuits que nous passons dans cet hémicycle"
"16",",2017-07-13,",". Quel est l'' avis du Gouvernement ? Vous soulevez une vraie question. Nous avons besoin de médecins du travail – c''","est une spécialité reconnue","par la médecine et évaluée en fonction d'' un contexte, de conditions et de situations de travail. Tout le monde ne peut"
"17","PA337633,2019-01-15,Girardin, Annick",", nous avons aussi annoncé plusieurs mesures dans le cadre du Livre bleu . La ministre du travail, Muriel Pénicaud , s''","est engagée","à financer à hauteur de 253 millions d'' euros, à La Réunion , le programme d'' investissements dans les compétences. Il"
"18","PA718838,2019-09-10,Brun, Fabrice","de l'' environnement, de l'' aménagement et du logement – sur la route nationale 102, sans que ces signalements aient","été suivis","d'' aucune initiative politique. Comme souvent ! Je le rappelle, il s'' agit de la seule route nationale dans un"
"19","PA721202,2019-03-05,Coquerel, Éric","ne se comptent plus pour déloger les grévistes. Mais dans votre système c'' est toujours Gaël le coupable. C '' est lui qui","est poursuivi","au tribunal, c'' est lui qui est sous le coup d'' un licenciement malgré l'' avis inverse de l'' inspecteur du travail. Sans"
"20","PA719608,2019-10-29,Ménard, Emmanuelle","devant la justice en septembre. Pour la vice-procureure, il ne s'' agit pas d'' une agression gratuite. "" Ces hommes ont","été attaqués parce qu","'' ils portaient un uniforme "", a -t - elle déclaré. Au demeurant, elle s'' est quasiment excusée auprès des victimes de ne"
"21","PA643127,2017-07-28,Questel, Bruno","à M. Bruno Questel . Je suis un peu surpris que l'' on demande à Mme la ministre de s'' engager fermement sur des montants qui","seraient inscrits","au budget 2018 tout en lui reprochant de vouloir dépouiller le Parlement de ses prérogatives. J '' avais en effet compris"
"22","PA720512,2020-02-25,Pietraszewski, Laurent","des engagements pris, à cet âge, dans la vie professionnelle et la vie personnelle. Ces engagements méritent d''","être respectés",". Soustrayez 45 à 62, l'' âge légal que nous avons retenu, et vous obtenez 17. Nous avons donc choisi de fixer notre période"
"23","PA606712,2018-12-10,Lurton, Gilles","dans de nombreux autres ports bretons ou dans les ports normands, particulièrement concernés par les décisions qui","seront prises","dans le cadre du Brexit . Madame la ministre , après votre audition par la commission spéciale, vous avez répondu très"
"24","PA722142,2018-09-13,Ruffin, François","avez qu'' à voter les amendements ! La parole est à M. François Ruffin . D'' abord, je voudrais défendre Richard Ramos , qui a","été accusé","ou soupçonné de faire du spectacle. C '' est un expert qui parle ! Il faut comprendre la situation dans laquelle nous nous"
"25","PA722162,2019-12-18,Turquois, Nicolas","des difficultés techniques, j'' ai besoin d'' engagements plus précis à propos des délais dans lesquels le problème","sera traité",". Nous l'' avions déjà évoqué avec le précédent ministre de la transition écologique et solidaire, mais la décision"
"26","PA942,2019-10-17,de Courson, Charles","soutenir l'' amendement n° 502. D '' une simplicité biblique, il consiste à rappeler que les mesures fiscales doivent","être prises","dans le respect des conventions bilatérales. J '' ai en effet été troublé, en lisant l'' article 3, par l'' absence de"
"27","PA720438,2018-02-15,Di Pompeo, Christophe","de la CEDH sur nos hautes juridictions nationales, car les avis rendus ne seront que consultatifs et n'' auront pas à","être suivis","ipso facto. En revanche, les consultations a priori par les hautes juridictions nationales permettront, à n'' en point"
"28","PA268019,2018-07-10,Lagarde, Jean-Christophe",". En passant de 125 000 habitants à 240 000 habitants, les circonscriptions seront désincarnées. Leurs représentants","seront élus","uniquement selon qu'' ils se réclament de la volonté présidentielle ou de l'' opposition au Président de la République ,"
"29","PA720892,2019-05-07,Panot, Mathilde",", c'' est l'' impuissance de l'' État qui apparaît, son incapacité à prendre en charge des vies qui, pour trop d'' entre elles,","sont dévastées","par un dispositif supposé les protéger. Des auditions nous ont donné une vision encore plus concrète de la réalité"
"30","PA720892,2017-11-28,Panot, Mathilde","de cancers, combien d'' enfants malformés, combien de fausses couches faudra -t - il pour que des mesures concrètes","soient prises","? Combien de cours d'' eau pollués, d'' espèces menacées, de dégâts environnementaux de toutes sortes, avant que vous ne"
"31","PA608695,2019-01-29,Untermaier, Cécile","les casseurs ; nous non plus. Ils ne comprennent pas l'' impunité des fauteurs de troubles ; nous non plus. Tout délit doit","être condamné","et tout comportement mettant en danger la liberté de chacun de manifester doit être identifié et sanctionné. Mais les"
"32","PA335532,2020-01-21,Pau-Langevin, George",". En étudiant ce texte, nous pensons aussi à certains de nos jeunes qui sont amenés à commettre l'' irréparable pour avoir","été harcelés","ou diffamés sur les réseaux sociaux. Au sein du groupe Socialistes et apparentés, nous sommes tous fortement attachés"
"33","PA720430,2017-12-07,Bernalicis, Ugo",". Il faut que la loi prévoie explicitement que le cas de chaque étranger susceptible d'' être mis en rétention","soit examiné de manière plus détaillée","et bien plus sérieuse. Or , en facilitant ainsi les passerelles entre méconnaissance de l'' assignation à résidence et"
"34",",2017-12-13,","répondre à la question précédente, c'' est qu'' une chose au moins est certaine : d'' ici à fin janvier, une décision aura","été prise",". Laquelle ? Il en sera fini de ce dossier. Je serai d'' ailleurs honoré et fier d'' avoir la même passion sur d'' autres sujets"
"35","PA721262,2019-05-17,Vuilletet, Guillaume","indépendante puisse rendre un avis global. C '' est l'' ensemble des acteurs de la décision publique qui doit","être pris","en considération. Je ne vois donc pas pourquoi il y aurait des collèges ou des formations spéciales en fonction des"
"36","PA906,2017-09-25,Collomb, Gérard","de l'' article 78-2, alinéa 8. Il dit : "" L'' identité de toute personne, quel que soit son comportement, peut également","être contrôlée selon les modalités prévues","au premier alinéa – c'' est une référence aux OPJ – pour prévenir une atteinte à l'' ordre public, notamment à la sécurité"
"37","PA721314,2019-09-17,Schellenberger, Raphaël",": imaginons l'' organisation d'' un café-débat, le mandataire est absent et le commerçant est réticent à accepter de n''","être payé","que quinze jours plus tard, quand le mandataire pourra venir au fin fond de la circonscription. Il serait pratique pour"
"38","PA607090,2020-01-28,Vigier, Jean-Pierre","remercie, madame la secrétaire d'' État , de m'' avoir répondu précisément. Si j'' ai bien compris, les crédits d'' études","seront inscrits","jusqu'' en 2022, permettant la réalisation des études ; et, à partir de 2022, les travaux pourront enfin commencer. Je"
"39","PA721984,2018-11-22,Latombe, Philippe","-t - on contester devant le juge la décision de la CAF ? Une autre question porte sur la responsabilité de la CAF si elle s''","est trompée",". Si elle a fixé une pension alimentaire de 350 euros et que le JAF la ramène à 250 euros, comme la décision est assortie de l"
"40","PA330357,2020-07-08,Dussopt, Olivier",", mais il faut nous laisser le temps de le mesurer. S'' agissant plus précisément de l'' amendement, les avances","étaient initialement inscrites","au programme 823, qui correspond à des concours de trésorerie de courte durée pour faire face à des besoins de"
"41","PA721202,2020-02-27,Coquerel, Éric","l'' avis du Gouvernement ? Même avis. La parole est à M. Éric Coquerel . Je suis assez étonné de cette réponse. Certes, je me","suis servi","d'' un amendement, mais pour poser une question précise au sujet d'' un argument que vous avancez : la baisse de la CSG à"
"42","PA330240,2020-05-07,Ciotti, Éric","porteraient pas un masque dans les transports publics lundi prochain ? Souhaitez - vous que, dès lundi, des sanctions","soient prises","à l'' encontre de ceux qui ne porteraient pas de masques, et que, donc, des instructions soient données aux forces de l''"
"43","PA721584,2018-11-22,Terlier, Jean",". Il n'' y a pas de dématérialisation, rien ne change, à l'' exception du traitement de ces requêtes, sachant qu'' elles","sont déjà, aujourd''hui, examinées","par un juge tout seul dans son bureau. C '' est un texte qui change tout mais qui ne change rien ! La parole est à M. Ugo"
"44","PA720278,2017-12-19,Orphelin, Matthieu","pour avis, mes chers collègues, à la mi-février 2017, le candidat Macron prenait l'' engagement d'' arrêter, s'' il","était élu",", l'' exploration des hydrocarbures en France . Dix mois plus tard, la loi Hulot va concrétiser cette promesse. Nous n''"
"45","PA266797,2018-12-05,Gosselin, Philippe","une inadmissible rupture d'' égalité entre les justiciables, entre les citoyens. Une expérimentation qui pouvait","être admise",", difficilement certes, dans deux régions, n'' est plus acceptable dans cinq régions, lors même qu'' elle concerne la"
"46","PA608016,2017-12-15,Louwagie, Véronique","à l'' IFI pose une vraie question : certaines personnes qui disposent d'' un patrimoine supérieur à celles qui pourraient","être taxées","à l'' IFI ne seront pas privées d'' APL pour leurs enfants alors même que les personnes redevables de l'' IFI le seront. Cette"
"47","PA643210,2019-11-21,Lecornu, Sébastien",", de surmonter ces difficultés. Enfin, la question de l'' incomplétude ne se pose que pour les communes dont le conseil","est élu","suivant la règle du panachage, pas pour celles dont le conseil est élu au scrutin proportionnel. Dès lors que vous avez"
"48","PA722374,2019-03-21,Isaac-Sibille, Cyrille","avoir été conclus avec l'' accord du médecin traitant. Monsieur le rapporteur, vous venez de me dire que celui-ci","sera bien évidemment respecté","et que ce genre de précisions va de soi. Si c'' est le cas, je ne comprends pas pourquoi vous donnez un avis défavorable !"
"49","PA405480,2017-10-19,Pupponi, François","sont ces amateurs qui ont taxé à 3 % les dividendes des entreprises ? On sait que cette taxe, prélevée pendant cinq ans, a","été sèchement retoquée","par le Conseil Constitutionnel , ce qui a provoqué deux ou trois suicides par le feu dans l'' administration des finances"
"50",",2017-07-24,","'' examen de l'' article 9. Mais clairement, le Gouvernement estime qu'' il faut rompre avec cette pratique, et en cela, il a","été suivi","par votre commission des lois. Le dernier axe des réformes qui vous sont proposées renforce les contrôles sur les"
"51","PA721564,2018-04-16,Fajgeles, Élise","doit être à la hauteur de sa tradition historique d'' accueil. Son devoir, son histoire est d'' offrir l'' asile à ceux qui","sont persécutés",", à ceux dont la vie est menacée dans leur pays d'' origine, à ceux qui fuient les théâtres de guerre et qui demandent sa"
"52","PA719024,2019-11-20,Blanchet, Christophe","retire mon amendement. La parole est à M. Christophe Blanchet . Je souhaite partager ici mon expérience. En 2014, ayant","été élu","dans ma commune, j'' ai été chargé de rédiger le dossier de classement de notre station. Cela a demandé un an de travail,"
"53","PA606098,2018-07-17,Marleix, Olivier","est à M. Olivier Marleix , pour soutenir l'' amendement n° 2057. Je suis également surpris que ces trois amendements","soient inscrits","en discussion commune alors que leur objet diverge sensiblement. Bien sûr ! À force de "" plébiscites sondagiers "", on a"
"54","PA267289,2017-07-19,Door, Jean-Pierre","autres resteront de l'' ordre du décret et pourront donc être contestées devant le Conseil d'' État . Comme cela vient d''","être rappelé",", ces ordonnances ont été rédigées sans aucune concertation avec les intéressés et, selon ces derniers, elles sont"
"55","PA906,2018-06-27,Collomb, Gérard","et sanctionnés. Très bien ! Nous voulons que celles et ceux qui entendent commettre des actes contre des chrétiens","soient arrêtés et sanctionnés",". Bravo ! Oui, notre loi est celle de l'' ordre républicain, un ordre qui protège l'' ensemble de nos concitoyens, quelle"
"56","PA719286,2018-11-15,Colombani, Paul-André",", est conforme au règlement européen RGEC sur les aides d'' État , mais la production d'' énergie renouvelable","est, elle, exclue","par le règlement européen. Pour connaître les conditions dans lesquelles cette activité sectorielle peut"
"57","PA719858,2018-10-30,Limon, Monique",", chers collègues, "" il faut réapprendre à voir large et loin : ceux qui se laissent écraser par la tyrannie du court terme","sont condamnés","à toujours réagir au lieu d'' agir, à toujours saupoudrer au lieu de choisir, bref à toujours subir "". Je reprends ici les"
"58","PA720378,2018-06-01,Lioger, Richard","permises sont caractérisées par une densité significative, puisque les secteurs d'' urbanisation diffus","sont exclus","du dispositif. Avis défavorable. Je suis saisie de trois amendements identiques, n° 1324, 1497 et 1661. La parole est à"
"59","PA330357,2018-03-06,Dussopt, Olivier","le ministre de l'' économie et des finances, Bruno Le Maire , est très attentif à ces restructurations, que Vallourec s''","est engagé","à conduire de manière responsable. Pour les sites de Cosne-sur-Loire et de Tarbes , des acheteurs potentiels ont"
"60","PA610654,2019-01-17,Nilor, Jean-Philippe","sur l'' hypothèse extravagante selon laquelle le gardé à vue est parfaitement au fait de ses droits. Si de surcroît il n''","est pas assisté","d'' un conseil, comment voulez - vous qu'' il sache qu'' il peut demander à être présenté à un juge ? On sait que, dans la"
"61","PA720924,2020-03-03,Elimas, Nathalie","est conscient ici, les droits des femmes ne sauraient se manifester uniquement de manière symbolique. Notre groupe s''","était particulièrement engagé","sur la protection des femmes et sur les nouveaux droits familiaux, d'' abord pour des raisons de justice sociale,"
"62","PA588884,2018-05-16,Autain, Clémentine","recueil de telles plaintes ? D '' autant que les cas sont divers. Les situations de handicap qui ont été évoquées doivent","être prises","en considération. Je signale aussi un autre cas, dont nous n'' avons pas parlé : celui des prostituées victimes de viol,"
"63","PA720370,2020-07-21,Mendes, Ludovic","ou déjouées semble en baisse, la menace terroriste existe toujours en France , et plus de 1 000 personnes ont encore","été arrêtées","l'' an dernier en Europe pour faits de terrorisme, parmi lesquels le djihadisme demeure le danger principal. Nous"
"64","PA608292,2019-09-12,Dubié, Jeanine","! ...avec un climat spécifique et des risques tels que la neige, la pluie, les éboulements. Cette particularité doit","être prise","en considération. Je vous remercie, madame la rapporteure, d'' avoir accepté d'' inscrire une fois le mot "" montagne """
"65","PA719938,2018-07-12,Fesneau, Marc",". Je veux répondre à une autre question soulevée par ces amendements, celle des langues régionales. Celles-ci","sont reconnues","à l'' article 75-1 de la Constitution – M. Molac , que je vois sourire, le sait très bien. Certes, il y a un débat, et nous"
"66","PA718926,2019-02-19,Dharréville, Pierre","centres AFPA – Agence nationale pour la formation professionnelle des adultes –, au lieu de les fermer. Cette question","est en effet sortie","du grand débat national dans ma commune. Une mesure humiliante de plus n'' apportera pas de réponse à la misère, au"
"67","PA719660,2020-05-18,Dubos, Christelle","vous l'' avez souligné, nous avions commencé à travailler sur le sujet avant la crise ; un grand chantier avait notamment","été engagé","en vue de la revalorisation des métiers du grand âge, avec la création d'' une prime "" grand âge "" de 100 euros net par mois"
"68","PA721946,2017-11-07,Marilossian, Jacques","dans un environnement stratégique incertain et instable. Dans un monde multipolaire, en mutation, nos forces","sont engagées","dans des crises sans cesse plus dures, face à des adversaires toujours mieux armés. La revue stratégique a clairement"
"69","PA340853,2019-02-05,Leclerc, Sébastien","tous, un certain nombre d'' atteintes aux personnes. Pouvez - vous nous dire combien de policiers ou gendarmes ont","été blessés","lors des manifestations ? Plusieurs d'' entre nous avons eu connaissance de cas d'' équipements de protection"
"70","PA722374,2019-05-29,Isaac-Sibille, Cyrille","délai entre la mise à disposition du texte issu de la commission et son examen en séance, que la procédure accélérée ait","été engagée","ou non. L'' instauration d'' un délai suffisant entre l'' examen en commission et celui en séance est un prérequis"
"71","PA267233,2017-10-04,Bouillon, Christophe","ou encore de la Stratégie nationale bas-carbone . Faisons en sorte que, sur ce point, la représentation nationale ne","soit pas oubliée",". Quel est l'' avis de la commission ? Si l'' on peut partager les intentions qui ont présidé à la rédaction de votre"
"72","PA345619,2020-04-28,Philippe, Édouard","ce que le Gouvernement veut faire . Les principes sur lesquels s'' appuie la stratégie que j'' ai présentée doivent","être exposés clairement et compris","pour que cette stratégie ait une chance d'' être appliquée de manière efficace. Il fallait donc décrire les principes –"
"73","PA721314,2018-10-19,Schellenberger, Raphaël","et non pas, comme l'' amendement précédent, le bloc communal. J'' avais présenté en commission l'' amendement n° 1370 et m''","étais engagé","à le retravailler, ce qui a conduit à la rédaction de l'' amendement n° 1342. L'' amendement n° 1370, qui ne concerne que"
"74","PA722162,2020-02-22,Turquois, Nicolas","identiques, me limitant à rappeler que les interruptions de carrière que connaissent les aidants doivent","être prises","en compte lors de l'' attribution des droits pour la retraite. À l'' intention des auteurs des amendements qui viennent de"
"75","PA720002,2018-06-20,El Haïry, Sarah","de la France peut passer par deux axes : l'' augmentation des recettes ou la diminution des dépenses. Le premier axe","est exclu","puisque c'' est au contraire une diminution que nous visons, de manière assumée. Ainsi, c'' est vers le deuxième axe que"
"76",",2019-06-06,","la RATP a pu être confrontée avec certains utilisateurs qui pompaient massivement des données. Cette difficulté","est bien prise","en compte puisque nous prévoyons de rendre payantes les données, non seulement en fonction des volumes de chaque"
"77","PA719684,2018-11-22,Dubost, Coralie","plainte en ligne. Vous le savez, l'' un des principaux droits des victimes, au cours d'' une procédure pénale, est bien d''","être aidées",", par un service spécialisé ou une association d'' aide aux victimes, par exemple. Parmi les bonnes pratiques qui"
"78","PA610667,2017-10-03,Serville, Gabriel","Monsieur le ministre d'' État , chers collègues, les Guyanais ont dit au monde entier qu'' ils n'' admettront plus de ne plus","être écoutés",", de ne plus être entendus et, somme toute, d'' être méprisés par des décideurs enfermés dans des tours d'' ivoire à 7 000"
"79","PA405480,2019-02-12,Pupponi, François",", comme je l'' ai fait encore tout à l'' heure. Or , sur de nombreux territoires, ce sont des mères de famille voilées qui","sont élues","dans les conseils d'' école sur les listes de parents d'' élèves et qui font ainsi l'' effort d'' aider l'' école en participant"
"80","PA720512,2020-06-16,Pietraszewski, Laurent",". J '' ai encore récemment échangé avec les députés Lionel Causse et Sandra Marsaud à propos de l'' agilité des sociétés qui","sont engagées","dans l'' insertion – certaines d'' entre elles ont redéployé leur activité en se lançant dans la fabrication de masques ou"
"81","PA718978,2019-11-14,Laqhila, Mohamed","des entreprises en permettant d'' éteindre l'' imposition des plus-values reportées lorsque l'' activité reprise","est poursuivie","cinq ans après la date de sa transmission initiale. Il s'' agit d'' étendre la disposition de l'' article 41 du code général"
"82","PA720386,2018-04-05,Di Filippo, Fabien","pas souscrit. Gonflé ! C'' était notre programme ! Cette proposition avait été déposée avant que votre président ne","soit élu","! "" Nous rétablirons les exonérations de cotisations sociales sur les heures supplémentaires "" : le programme du"
