"","Reference","Left","KWIC","Right"
"494","PA721202,2018-04-21,Coquerel, Éric","l'' Angleterre . Cela fait des années que nous empêchons ces gens d'' aller en Angleterre . Aujourd''hui, alors qu'' elle","est sortie","de l'' Union européenne , je ne vois pas pourquoi nous continuons à jouer les gardes-barrières. Il a raison ! La parole est"
"495","PA721880,2020-03-21,Guévenoux, Marie","seraient définitifs. Dans les communes où, au contraire, un second tour serait nécessaire pour déterminer qui","est élu",", il serait reporté au mois de juin. Un rapport scientifique serait remis au Parlement le 10 mai pour lui permettre de"
"496","PA719202,2019-06-25,Paris, Didier","Ormuz , commanditée, selon Washington , par l'' Iran , a très sérieusement ravivé les tensions entre les deux pays. Elle a","été suivie","de la destruction d'' un drone de surveillance américain et de cyberattaques contre les systèmes de missiles iraniens."
"497","PA340357,2018-11-29,Victory, Michèle","et, surtout, informer encore et toujours, afin que la lutte contre la violence faite aux enfants et leur souffrance ne","soient plus acceptées",". Il ne s'' agit en aucun cas de stigmatiser les adultes qui ont recours à ces pratiques, sans quelquefois en comprendre la"
"498","PA721210,2018-06-07,Corbière, Alexis","comme Génération identitaire , violents, racistes, qui diffusent sur les réseaux sociaux des propos inacceptables,","soient sanctionnés","par la République : nous ne sommes pas d'' accord avec vous sur ce sujet ! Vous n'' avez qu'' à les poursuivre ! Ce n'' est pas le"
"499",",2019-02-14,","– comme un treizième élève dans les CP à douze. Peut-être y aura -t - il donc une ou quelques exceptions, mais le principe","sera respecté",". Tel est le cadre dans lequel travaille l'' ensemble des personnels de l'' éducation nationale dès maintenant. Avis"
"500","PA718720,2018-10-22,Dufrègne, Jean-Paul",". Le CNDS a fait ses preuves en accompagnant le développement territorial du sport et l'' effet de levier qu'' il exerce","est reconnu","par toutes les collectivités territoriales. Or , le positionnement de l'' agence sera différent. Le risque que les"
"501","PA719032,2019-03-22,Bouyx, Bertrand","à conforter les maires dans leur rôle de stratège dans leur territoire. Nous l'' avons évoqué tout à l'' heure, ils doivent","être représentés","au sein du conseil stratégique du GHT . En réalité, les décisions se prennent au niveau de ce conseil stratégique, qui"
"502","PA720996,2018-06-12,El Guerrab, M''jid","du compte personnel de formation, consacrée à la transition professionnelle. Dans ce cadre, la personne","est accompagnée","dans son projet professionnel et une prise en charge de la rémunération, au-delà des frais pédagogiques, est possible"
"503","PA227076,2018-01-30,Gourault, Jacqueline","évalué aujourd''hui à 5 milliards d'' euros : ce sont aujourd''hui environ 103 millions de litres d'' eau qui","sont traités","dans nos usines sans jamais arriver au robinet. Des investissements considérables sont et seront encore nécessaires"
"504","PA720242,2017-10-04,Abba, Bérangère","et à la consommer en direct, en fonction des besoins personnellement ressentis. L'' autoconsommation a tout récemment","été traitée","par la cour d'' appel de Paris . Celle-ci a jugé que la création de réseaux fermés d'' électricité, donc d''"
"505","PA721202,2019-02-14,Coquerel, Éric","sur le plan fiscal. Tout à fait légalement, une entreprise est en droit de demander à l'' avance comment sa situation","sera traitée","par l'' administration fiscale d'' un pays afin d'' obtenir certaines garanties juridiques – ce principe est appelé "" tax"
"506","PA267306,2019-11-18,Chassaigne, André","des lois et je prie sa présidente, son rapporteur et tous ses membres de m'' en excuser. J'' émets le vœu qu'' elles","soient cependant prises","en compte ici dans un esprit d'' ouverture. Faisons en sorte que ce projet de loi ne soit pas une simple voiture-balai"
"507","PA2150,2019-05-13,Mélenchon, Jean-Luc","seront élus, point final ! Les autres ayant choisi de partir – c'' est leur droit, qui doit être respecté –, les nôtres","sont élus",". La parole est à M. Stéphane Peu. Le groupe communiste votera en faveur de cette motion de rejet préalable. Je souscris à"
"508","PA335612,2018-06-21,Lecoq, Jean-Paul","et déterminer la date à laquelle la loi sera mise en œuvre. Parfois, on est même surpris de la rapidité avec laquelle","sont pris","certains décrets : pour la vitesse par exemple, c'' est fixé au 1er juillet alors que tout n'' a pas encore été débattu ici !"
"509","PA606712,2018-06-03,Lurton, Gilles","une nouvelle fois dans cet hémicycle qu'' il est normal que les députés débattent ! Parfois, quand nos positions","sont mal comprises",", comme cela a été le cas un peu plus tôt dans la journée, il est normal de pouvoir éclaircir ce qui a pu sembler obscur."
"510","PA608172,2018-10-10,Pires Beaune, Christine","fallu adopter des critères plus restrictifs, afin que ces paradis fiscaux situés au sein même de l'' Union européenne","soient réellement inscrits","sur la liste. Vous souhaitez probablement ne pas froisser des pays amis membres de l'' Union , mais vous faites là un bien"
"511",",2018-05-15,","le code pénal pour mieux protéger les enfants, pour lutter contre le fait que les agresseurs et les violeurs ne","sont pas suffisamment condamnés",". Je voudrais vous lire la disposition que nous proposons, parce que, sincèrement, quand j'' entends les commentaires"
"512","PA267260,2017-07-27,Poletti, Bérengère","article 6. Je voudrais très rapidement évoquer le cas très particulier de certains assistants qui seront, au moment d''","être licenciés",", très proches de l'' âge de la retraite. Il n'' est pas prévu pour eux de dispositif de préretraite semblable à ceux qui"
"513","PA332747,2018-07-12,de Rugy, François","une communication du 5 juillet 2018, le ministre d'' État , ministre de l'' intérieur m'' a informé que M. Stéphane Le Foll","est remplacé",", jusqu'' au renouvellement de l'' Assemblée nationale , par Mme Sylvie Tolmont , élue en même temps que lui à cet effet. L''"
"514","PA719608,2019-02-13,Ménard, Emmanuelle","à l'' apprentissage des langues étrangères, jamais ! J '' ai évoqué les langues arabes, parce que des engagements avaient","été pris","par vous-même, monsieur le ministre, dans cet hémicycle, il y a un peu plus d'' un an. Après des questions sur les ELCO de M."
"515","PA340343,2018-07-17,Saulignac, Hervé","l'' affaiblissement du Parlement – lorsque je parle de l'' affaiblissement du Parlement , je parle de ceux qui","sont représentés","ici, c''est-à-dire de l'' affaiblissement de la voix du peuple. Et face à cela, alors que, depuis trois heures, nous"
"516","PA267330,2018-07-25,Zumkeller, Michel","et de notre tradition historique d'' accueil des étrangers en vertu de la protection internationale. Le deuxième, ce","sont les objectifs poursuivis","par ce projet de loi pour améliorer cette situation. Si nous pouvons – et si nous devons – débattre des moyens d''"
"517","PA721210,2018-06-26,Corbière, Alexis",". Donc, dans le cas des sanctions infligées par les services des douanes, la bonne foi de l'' usager peut d'' ores et déjà","être prise","en compte par l'' administration. Ainsi, le présent texte vise davantage à introduire un certain laxisme qu'' à"
"518","PA335054,2018-11-19,Karamanli, Marietta","de façon quasi perpétuelle, à peine leur encre séchée et leur application commencée. Tout cela se fait sans que ne","soit engagée","aucune évaluation sérieuse des réformes récentes. Lors de son discours de juillet 2017 devant le Congrès , le"
"519","PA336439,2019-03-05,Clément, Jean-Michel","? Le mot m'' inquiète. Ces termes sont manifestement hors sujet dans la mesure où jamais un militant ne saurait","être accusé","de crime quand il agit dans le cadre militant, sauf à ce qu'' il commette un crime, détachable de toute action militante :"
"520","PA1695,2018-04-21,Jacob, Christian","proposition – la présidence indiquera tout à l'' heure, à l'' ouverture de la séance de vingt et une heures trente, si elle","est acceptée . Compte tenu","du nombre d'' amendements restant à examiner, je pense qu'' il n'' est pas envisageable de terminer la discussion du projet"
"521",",2018-02-15,","des établissements doit être pris en compte. Les besoins académiques et scientifiques propres qu'' il porte doivent","être reconnus",". La mention du projet de formation et de recherche figure clairement dans le projet de loi. Enfin et surtout, le"
"522",",2017-10-25,","a une double dimension. La première est le suivi médical des enfants. Comme vous le savez, ces derniers doivent","être examinés","à l'' âge de six ans. En réalité, ce n'' est pas le cas, faute d'' un nombre de médecins scolaires suffisant en France . Ce"
"523","PA719710,2018-11-26,David, Dominique","changé de méthode. Avez - vous remarqué... Ah oui ! On n'' a jamais vu aussi entêtés ! ...qu'' aucun décret d'' avance n'' a","été pris","par le Gouvernement pour réaliser les ajustements budgétaires en cours ou en fin de gestion. C '' est dommage ! Il aura"
"524","PA720772,2018-05-14,Bru, Vincent","la mention dans le présent projet de loi, ... Nous, non ! C '' est anticonstitutionnel ! Ce sera censuré ! ...ce qui a","été accepté",", à la majorité, par la commission mixte paritaire, à la demande de M. le rapporteur. Dès lors, c'' est avec enthousiasme"
"525","PA719616,2020-06-30,Euzet, Christophe","post, on concevra que les députés du groupe Agir ensemble considèrent que l'' équilibre qu'' ils appelaient de leurs vœux","est respecté",". C '' est pourquoi ils voteront le texte. La parole est à M. Hubert Wulfranc . Le Gouvernement a donc décidé de ne pas"
"526","PA720430,2020-06-22,Bernalicis, Ugo","la récidive. Il n'' est même pas question de la poursuite des personnes qui voudraient passer à l'' acte et n'' ont jamais","été condamnées","– c'' est un autre sujet. De nombreuses analyses scientifiques et criminologiques démontrent que les mesures de sûreté"
"527","PA720968,2018-06-14,Benin, Justine","de loi envisage une dynamisation de l'' apprentissage, il ne faudrait pas que les personnes en situation de handicap","soient oubliées",". Or , aujourd''hui, seulement 1 % de celles-ci bénéficient de formations en apprentissage. Pourtant, la législation"
"528","PA720210,2018-05-15,Beauvais, Valérie",". C '' est la raison pour laquelle la présomption de non-consentement doit être intégrée à ce texte, comme vous vous y","étiez engagée",", madame la secrétaire d'' État , surtout devant les médias. Les mots ont un sens : "" atteinte sexuelle avec pénétration """
"529","PA720960,2019-11-06,Serva, Olivier","vous annoncer : les crédits alloués au fonctionnement des observatoires des prix, des marges et des revenus – OPMR – ont","été doublés",", passant de 300 000 euros à 600 000 euros. Votre amendement étant satisfait, j'' en demande le retrait. Quel est l'' avis du"
"530","PA605036,2018-10-11,Abad, Damien","avait vainement tenté de mettre fin. Aux termes de la loi de modernisation de notre système de santé, nul ne peut","être exclu","en raison de son orientation sexuelle. Pourtant, un arrêté du 5 avril 2016 prescrit, en son annexe II , une abstinence de"
"531","PA720092,2019-05-09,Ramos, Richard","est défavorable, pour la simple raison que le mot "" écotouristique "", n'' ayant pas de définition juridique, ne pourrait","être inscrit","dans le texte, quelle que soit la justesse de l'' amendement. Quel est l'' avis du Gouvernement ? Pour les mêmes raisons qu''"
"532","PA717167,2018-01-31,Mahjoubi, Mounir","ayant émergé au cours des débats, tant au Sénat qu'' à l'' Assemblée nationale . Enfin, vous le savez, bien qu'' ayant","été élu","dans cette assemblée, je n'' ai pas pu siéger parmi vous. À titre plus personnel, je suis donc très heureux de vous"
"533","PA721960,2018-11-06,Obono, Danièle","'' État , en particulier la révision générale des politiques publiques, la RGPP, lancée par Nicolas Sarkozy en 2007, ont","été poursuivies","par les gouvernements qui ont suivi, notamment sous le septennat de François Hollande . Elles ont durement touché et"
"534","PA721880,2017-12-07,Guévenoux, Marie",". C '' est le sens de la convention de Genève , qui vise à s'' assurer que nul ne sera renvoyé là où il risque à nouveau d''","être persécuté",". Comme dans le nord de l'' Irak ! Cette convention, à laquelle nous sommes tout aussi attachés que vous, ... Ça , ce n'' est"
"535","PA642724,2019-06-14,Barbier, Frédéric",". Enfin, l'' amélioration du pouvoir d'' achat qui résulterait de cette mesure est un leurre : 95 % des pièces de rechange","sont prises","en charge par les assurances, qui ne répercuteront pas l'' économie réalisée en achetant une pièce fabriquée à 10 000"
"536","PA722202,2019-10-31,Jumel, Sébastien","cette présumée prise de conscience et les actions décidées par le Gouvernement est grand. Aucune décision fiscale ne","sera prise","avant le PLF pour 2021. Le budget alloué à l'' industrie dans le PLF pour 2020 est décevant. J '' ai concentré mon attention"
"537","PA719938,2018-07-19,Fesneau, Marc","de 10 000 ou 5 000 euros de DGF – puisque tel était le montant chez moi. Cela, nous le savons ! Nous avons donc aussi besoin d''","être accompagnés",". J '' ai vu peu d'' accompagnements ! Il ne faut pas se focaliser sur la seule DGF ! Nous devons aussi travailler à l''"
"538","PA330684,2019-10-10,Boyer, Valérie","la mère et contre l'' enfant – cumul idéal de qualifications. C '' est un mécanisme juridique qui permet que le même fait ne","soit pas poursuivi","deux fois sous des incriminations différentes, lorsqu'' il y a pluralité d'' intérêts sociaux atteints et pluralité de"
"539","PA721924,2019-10-04,de Vaucouleurs, Michèle","particulières, dans lesquelles il y a déjà matière à rechercher la présence d'' aneuploïdies. Le choix des parents doit","être entendu et respecté",", et eux-mêmes doivent être considérés comme des adultes, capables de prendre leur décision en conscience, qu'' elle"
"540","PA719632,2017-12-13,Panonacle, Sophie","d'' État , je ne vous demande pas d'' exposer en quelques minutes les engagements français et internationaux qui ont","été pris","lors de ce sommet, mais pouvez - vous faire partager à la représentation nationale votre confiance en l'' avenir ? La"
"541","PA719608,2018-11-29,Ménard, Emmanuelle","normal, car les choix du Gouvernement posent question. Parallèlement à ces crédits trop faibles, et comme cela avait","été rappelé","ici même par notre collègue Olivier Faure , M. Blanquer , ministre de l'' éducation nationale, réservait 20 millions d''"
"542","PA719194,2019-05-15,de Courson, Yolaine","avec des voix consultatives au conseil d'' administration, tandis que la Caisse des dépôts et consignations","sera représentée","avec voix délibérative. Avis défavorable aux trois amendements. La parole est à Mme la ministre de la cohésion des"
"543",",2019-06-05,","collectivités, de les accompagner, et c'' est précisément ce que nous sommes en train de faire. Deux appels à projets ont","été accompagnés","par l'' ADEME afin d'' aider les collectivités à définir leur stratégie pour le vélo. Ce sont ainsi 200 collectivités qui"
"544","PA2449,2018-05-15,Pont, Jean-Pierre","dernier tronçon entre Amiens et Boulogne-sur-Mer fait partie des priorités de Mme la ministre , sachant que l'' État s'' y","était précédemment engagé","? La parole est à M. le secrétaire d'' État auprès du ministre d'' État , ministre de la transition écologique et solidaire."
"545","PA759832,2020-03-24,Pannier-Runacher, Agnès","des secteurs de l'' événementiel et du tourisme –, soit vous faites partie de la liste des commerçants et artisans qui ont","été fermés par l'' arrêté","du 15 mars, auquel cas vous n'' avez pas besoin d'' établir votre perte de chiffre d'' affaires. Enfin, pour ce qui est des"
"546","PA718926,2019-10-09,Dharréville, Pierre",", mais simplement une difficulté technique. Le projet de loi de financement de la sécurité sociale a","été examiné","ce matin en conseil des ministres, aux alentours de dix heures. Or, aux termes de la Constitution : "" Les projets de loi"
"547","PA720552,2019-02-14,Rauch, Isabelle","conventions fiscales signées entre la France et la Belgique , la Suisse et les Pays-Bas qui, comme le Luxembourg , ont","été accusés","d'' être peu coopératifs en matière fiscale. À juste titre ! J'' insisterai particulièrement sur cet important dossier"
"548","PA721896,2017-10-11,Faucillon, Elsa","ou de quatre semaines à compter de sa transmission. Ces délais ne s'' appliquent pas [...] si la procédure accélérée a","été engagée",". "" Le présent amendement vise à supprimer l'' exception, qui est aujourd''hui finalement devenue la règle. Il s'' agit"
"549","PA748954,2020-05-14,Savignat, Antoine",". Ce qui justifie l'' existence même de notre système judiciaire, c'' est le fait qu'' il y a des erreurs, que des décisions","sont mal prises",", que des décisions sont trop sévères, que des acquittements sont injustifiés, qu'' il y a des erreurs judiciaires."
"550","PA759834,2019-02-05,Nuñez, Laurent","de s'' en prendre aux manifestants, car c'' est faux. Totalement faux. La police intervient chaque fois qu'' elle","est prise","à partie, qu'' il y a des exactions ou des violences, et c'' est bien son rôle que de maintenir l'' ordre public et de protéger"
"551","PA720568,2020-07-30,Thill, Agnès","tous, le projet de loi relatif à la bioéthique accroît le nombre de situations dans lesquelles les droits de l'' enfant","seront objectivement violés",". Puis, au chapitre II , il console les enfants nés d'' une PMA en leur disant qu'' ils auront peut-être accès à l'' identité de"
"552","PA720430,2018-07-16,Bernalicis, Ugo",", avec le concours des acteurs privés, veille au respect des principes posés à l'' article 1er de la Constitution . "" Il","serait suivi","d'' un article 4-2 disposant que l'' État protège les biens communs, car nous pensons que l'' eau, l'' air, le vivant et l''"
"553","PA722202,2018-04-03,Jumel, Sébastien","en ressource halieutique de toute la Manche Est , une zone qui avait été rejetée lors du précédent appel d'' offres. On s'' y","est aussi mal pris","vis-à-vis du parc marin, qui s'' est vu retirer sa compétence d'' avis conforme au cours de l'' année 2017 ; résultat : le parc"
"554","PA721984,2019-03-05,Latombe, Philippe","soutenable, l'' efficacité économique et l'' équité sociale. "" Pourtant, si les critères sociaux et environnementaux","sont admis","en marché public, il n'' en va pas de même pour ceux relatifs à la RSE . Tel est en effet le sens de la décision du 25 mai 2018 du"
"555","PA607846,2018-11-26,Darmanin, Gérald","aussi les forces de l'' ordre ou encore le SAMU , lors de leurs interventions. Les pompiers volontaires peuvent ainsi","être blessés","alors qu'' ils vont au feu, du fait d'' agissements tout à fait scandaleux. Ils sont caillassés ! C '' est une honte ! Ce qu'' ils"
"556","PA267204,2019-01-24,Sermier, Jean-Marie","leurs regroupements, et pour le quatrième collège, qui représente le personnel. Une dizaine de secteurs d'' activité","seront représentés","par quinze personnes. Il semble difficile de demander à ces acteurs, par exemple à la fédération nationale des"
"557",",2019-09-10,","Avant de répondre sur le fond à votre question, madame la députée, je voudrais remercier tous les parlementaires qui se","sont engagés","dans le cadre du Grenelle des violences conjugales. Nous l'' avons dit, nous ne pourrons mobiliser toute la société que"
"558","PA330357,2019-05-21,Dussopt, Olivier","que je ne connais pas et dont je ne sais pas s'' il existe encore ou s'' il a été mis au pilon. Vous savez, madame Sage , que je me","suis engagé","à plusieurs reprises à travailler avec l'' ensemble des parlementaires et avec le ministère des outre-mer – j'' ai eu l''"
"559","PA721852,2018-10-02,Lebec, Marie","? Je vous remercie, monsieur Mbaye , pour ces amendements. Vous proposez que la responsabilité civile du conducteur ne","soit pas engagée",". Cependant, dans le cadre de ces expérimentations, nous ne voulons pas modifier toutes les règles en matière de"
"560",",2019-09-24,","aux femmes, qu'' elles vivent ou non en couple : celui de recourir à l'' assistance médicale à la procréation – l'' AMP – et d''","être reconnues","pleinement mères de l'' enfant à naître. Dès lors, le projet proposé tire, en droit civil, les conséquences absolument"
"561","PA330240,2018-07-26,Ciotti, Éric","l'' État ont été diffamés, comparés à la police de Vichy par ces personnes. Ces personnes en qui vous voyez des héros, ont","été condamnées",", y compris en appel. Relativisons et replaçons - nous dans le contexte de pression migratoire. S '' il y a des morts en"
"562","PA332614,2019-03-27,Juanico, Régis","quant à la sincérité de la démarche des dirigeants de Loire Offset Titoulet . Alors qu'' une réduction du personnel a","été opérée","ces dernières années, aboutissant à plus de quarante suppressions de postes, l'' entreprise a perçu près de 1,4 million"
"563","PA340343,2019-10-08,Saulignac, Hervé","question est devenue légitime depuis le fiasco de la commission d'' enquête sur l'' affaire Benalla . Notre assemblée en","est sortie affaiblie",", discréditée et même moquée. Il aura fallu le Sénat pour sauver l'' honneur de la République . Eh oui ! Une commission d''"
"564","PA610667,2019-06-19,Serville, Gabriel","le revenu, avec une distribution par décile de revenu du nombre de contribuables concernés. Cet article n'' ayant pas","été respecté",", nous avons écrit au ministre pour recevoir des explications. Évaluer, oui, mais pour quelle finalité ? Est - ce une fin"
"565","PA722086,2019-05-07,Taquet, Adrien","l'' État en raison de l'' obligation alimentaire. Or nous ne voulions pas plus que vous que les pupilles de l'' État puissent","être exclues","de ce dispositif que nous instaurons et auquel nous croyons, car il s'' agit d'' une réelle avancée pour les jeunes. Par"
"566","PA609726,2018-06-07,Aubert, Julien","du rôle du juge. En effet, mes chers collègues, le juge des référés est un juge de l'' évidence : la question du fond","est traitée","ultérieurement. Vous voulez demander à un juge de déterminer, en quelques minutes ou quelques heures, dans la"
"567","PA2150,2020-06-29,Mélenchon, Jean-Luc","de disposer d'' eau froide pour refroidir les centrales, quand tout se réchauffe, à commencer par les fleuves où","sont opérés","les prélèvements à cet effet. Je m'' en tiens à ces deux points ; bientôt, vous aurez en main notre plan, monsieur le"
"568","PA719504,2018-11-07,Lagleize, Jean-Luc","européenne et internationale. Depuis le début de la XVe législature , le groupe du Mouvement démocrate et apparentés","est pleinement engagé","aux côtés du Gouvernement pour remédier aux faiblesses structurelles que connaît notre économie et redresser nos"
"569",",2018-04-10,",", que nous soutenons. Quel est l'' avis du Gouvernement ? Je vous confirme, madame Obono , que le Gouvernement","est résolument engagé","dans la lutte contre le changement climatique. C '' est mal parti ! C '' est bien pour cela que nous vous présentons la"
"570","PA719640,2018-11-13,Mette, Sophie","de ce programme augmentent de 1,23 % pour tenir compte de l'' évolution de la démographie étudiante. La ministre s'' y","est engagée","et 25 000 places ont été créées à la rentrée 2018. Au moins 7 000 le seront pour la rentrée 2019. Par ailleurs, la rentrée"
"571","PA605991,2019-10-23,Genevard, Annie","premier parce qu'' il complète le I de l'' article L. 241-13 du code de la sécurité sociale. Les deux amendements suivants","sont examinés","ensuite parce qu'' ils complètent le II et le III du même article du code de la sécurité sociale. Quel est l'' avis de la"
"572","PA345619,2020-01-14,Philippe, Édouard","accordera des droits supplémentaires à des Français qui n'' en disposent pas aujourd''hui et qui nous paraissent devoir","être pris","en compte, au vu de la réalité telle qu'' elle est. C '' est l'' objectif du minimum contributif, c''est-à-dire la garantie d''"
"573","PA643210,2018-05-15,Lecornu, Sébastien",", l'' ours étant une espèce strictement protégée. Afin d'' apporter des solutions concrètes, un dialogue a","été engagé","par la préfète de l'' Ariège sur la question des dommages : il s'' appuiera sur le travail d'' audit mené par les services d''"
"574","PA267336,2019-10-17,Giraud, Joël","nous avons signées ? Quel est l'' avis de la commission ? Les conventions fiscales, en tant que norme supérieure, doivent","être respectées","par les dispositifs français. Toutefois, si on le précisait par écrit, cela voudrait dire qu'' il y a des cas où elles ne"
"575","PA724827,2018-07-26,Ali, Ramlati","Anjouan et Mayotte constitue une catastrophe humanitaire – dont on ne parle nulle part. Tous ces chiffres doivent","être rapportés","à un territoire de 374 kilomètres carrés, qui connaît la densité la plus forte hors Île-de-France . Mayotte , c'' est une"
"576",",2019-06-26,","aussi, plus globalement, des enjeux environnementaux et économiques liés à ce canal. J'' y insiste : toute décision","sera prise","en concertation avec les élus, en fonction des projets concernés et des partenariats proposés. La situation de ce"
