"","Reference","Left","KWIC","Right"
"486","PA608416,2019-10-29,Hetzel, Patrick","eux-mêmes de leur logistique quotidienne. Quel est l'' avis de la commission sur cette série d'' amendements ? Même s'' ils","ont été examinés de façon groupée",", je les évoquerai un par un. Il est nécessaire d'' argumenter sur chacun d'' eux car tous ne procèdent pas du même esprit. L''"
"487","PA719608,2018-02-13,Ménard, Emmanuelle","comme vous. Après avoir verrouillé l'' Assemblée nationale , vous voulez empêcher ceux qui ne pensent pas comme vous d","'' être élus","au niveau européen. Vous vous arrangez une circonscription nationale afin de pérenniser vos avantages électoraux."
"488","PA759834,2019-11-19,Nuñez, Laurent","du mouvement des gilets jaunes, que de nombreux appels à manifester ont été lancés à travers tout le pays, qui","ont été suivis",". Les manifestations ont réuni beaucoup moins de monde qu'' il y a un an, vous l'' avez souligné, et elles se sont souvent"
"489","PA335612,2019-05-16,Lecoq, Jean-Paul","afin de protéger le fonctionnaire des pressions des pouvoirs politiques. Par l'' intermédiaire de cette instance, les","décisions sont discutées puis acceptées",", ce qui est à l'' opposé de la démarche qui vous anime. Je souligne à cette occasion que l'' ensemble des organisations"
"490","PA748954,2018-11-22,Savignat, Antoine","le président de la CAF se prononcera, une décision de contribution à l'' entretien et à l'' éducation des enfants aura","déjà été prise",". Il n'' y aura donc pas de vide juridique. Si la décision sur la contribution à l'' entretien et à l'' éducation de l'' enfant"
"491","PA266797,2018-07-13,Gosselin, Philippe",". Je suis père de plusieurs filles, et je ne vois pas pourquoi, lorsqu'' elles arriveront sur le marché du travail,","elles seraient moins payées","que leurs frères. Le débat me paraît clos : avec l'' article 1er de la Déclaration des droits de l'' homme et du citoyen , le"
"492","PA759834,2019-02-05,Nuñez, Laurent","des heures supplémentaires. J '' ai d'' ailleurs omis de préciser, en réponse à certains de vos collègues, que les heures","supplémentaires étaient déjà payées","pour certaines catégories de fonctionnaires, notamment aux agents des compagnies républicaines de sécurité. Nous"
"493","PA605036,2018-10-17,Abad, Damien","'' aurait pas censuré une partie de cette disposition. Il n'' a rien censuré ! Aujourd''hui, le Président de la République s","'' est engagé","à supprimer la taxe d'' habitation pour tout le monde. Nous vous demandons simplement d'' aller jusqu'' au bout : au nom du"
"494","PA720422,2019-03-14,Quatennens, Adrien","par l'' État . Quelle gabegie ! Au-delà de la question purement économique et financière, Aéroports de Paris , cela","a été rappelé",", y compris par mes collègues Les Républicains , est la première frontière de France . La recherche exclusive de profits"
"495","PA722178,2018-06-05,Maire, Jacques","le règne du rapport de forces, qui permet à l'' administration américaine d'' imposer ses volontés. C '' est pourquoi","il est sorti","du partenariat transpacifique ; il remet en cause l'' ALENA – Accord de libre-échange nord-américain – et bloque les"
"496","PA609726,2017-11-09,Aubert, Julien","satisfaisant. Il faut donc arrêter de prétendre que nous aurions des problèmes dans ce domaine. La filière n'' a","jamais été autant contrôlée","qu'' aujourd''hui. Et lorsqu'' il y a des risques, l'' ASN prend immédiatement des mesures, même si elles sont parfois"
"497","PA720900,2020-06-24,Rilhac, Cécile","à 100 %. Je savais que vous chercheriez à noircir le tableau, mais convenez qu'' il y a quand même un progrès : ces","principes sont inscrits","dans la loi. Il faut des engagements ! Quel est l'' avis du Gouvernement ? Je n'' ajouterai que quelques mots à ce que la"
"498","PA721690,2018-12-04,Tan, Buon","quelqu''un potentiellement en possession d'' argent liquide, donc un Asiatique . Il y a deux ans, M. Zhao , couturier,","a été agressé et dépouillé","de sa sacoche ; il est décédé quelques jours plus tard de ses blessures. Dans son sac, il avait des bonbons, des tickets de"
"499","PA719456,2019-11-08,Mörch, Sandrine","versés, ne correspondent qu'' à 20 % du montant total des demandes. Si 53 % des associations qui ont présenté une demande","ont été accompagnées","au titre du FDVA , que répondons - nous aux petites associations qui crient à l'' aide car elles ne peuvent plus assumer les"
"500","PA719072,2019-03-22,Mesnier, Thomas","plutôt la bonne identification des documents de santé de ces personnes. Je crois que ces problèmes sont en train d","'' être traités","par les services techniques du ministère. Avis défavorable. Quel est l'' avis du Gouvernement ? Les bénéficiaires de l''"
"501",",2018-05-15,","accompagné des enfants victimes de violences sexuelles. Elle sait donc ce que les magistrats opposent et dans quel cas","on est condamné","ou pas. Je vous invite à respecter la dignité de nos débats, madame la députée. Quelle est la situation actuelle ? Le code"
"502","PA721792,2018-05-29,Guerel, Émilie","différenciaient la redevance en fonction du mode de prélèvement sont modifiées pour que l'' activité et la finalité du","captage soient prises","en compte. Cette nouvelle orientation devrait permettre de fixer des redevances aux barèmes plus élevés afin de"
"503","PA719914,2018-09-26,Darrieussecq, Geneviève",", j'' ai eu l'' honneur de présider hier la cérémonie nationale en hommage aux harkis et autres combattants supplétifs s","'' étant engagés et ayant combattu","pour la France . J '' ai pu rappeler à cette occasion que la France avait manqué à son devoir et à ses obligations envers ses"
"504","PA722252,2018-05-14,Rixain, Marie-Pierre","sont destructrices pour les victimes, elles le sont également pour notre société. Quand un homme, une femme ou un","enfant est violenté , blessé","physiquement ou psychiquement, atteint dans son être même, ce sont en réalité tous nos principes républicains qui"
"505","PA719930,2020-03-21,Vallaud, Boris","actes réglementaires qui, comme cela vient d'' être dit, sont publiés ; ce sont tous les actes, notamment individuels,","qui sont pris","par les autorités administratives, en particulier par les préfets. Vous changez substantiellement l'' esprit de la"
"506","PA609590,2018-09-14,Rabault, Valérie","souhaitent que la création de ce fonds soit votée ce soir et permette aux 10 000 agriculteurs victimes et malades d","'' être indemnisés",". Très bien ! La parole est à M. Nicolas Turquois . Je souhaite réagir aux propos de Mme Rabault , qui a adressé au ministre"
"507","PA721960,2018-12-03,Obono, Danièle","main de justice. À ce niveau, le but des TIG n'' est plus la réinsertion ! Enfin, le Gouvernement a souhaité que les mineurs","puissent être condamnés","à une telle peine qui devient l'' alpha et l'' oméga des mesures de justice. Ce faisant, il s'' assied sur le principe de l''"
"508","PA719798,2018-09-18,Labaronne, Daniel",". Notre démarche a donc du sens. Elle ne vise pas à faciliter le traitement des affaires en catimini puisqu'' il y a – cela","a été rappelé","– une audience publique, donc une publicité. C '' est le Sénat qui a introduit ce dispositif par amendement, mais ayant"
"509","PA-103769,2018-07-09,Macron, Emmanuel","que vous avez votées en matière d'' assurance chômage ont ainsi supprimé toutes les cotisations salariales, qui","ont été remplacées","par la contribution sociale généralisée, la CSG . Mais il faut envisager la réforme dans son ensemble et ne pas"
"510","PA721960,2018-05-16,Obono, Danièle","la Cour de cassation a admis que le harcèlement pouvait procéder d'' un acte unique. D '' autre part, la proportionnalité","peut être appréciée","par le juge qui aura à définir l'' infraction et prononcer une sanction adaptée. Le problème avec cette nouvelle"
"511","PA720430,2018-11-22,Bernalicis, Ugo","de la jeunesse. Vu le débat et le contexte, j'' invite le Gouvernement ou la commission des lois à demander que cet","amendement soit examiné","en priorité. Qu '' on en discute tout de suite ! Afin que tout le monde soit représenté dans cet hémicycle, la parole est à"
"512",",2019-02-11,","opinions politiques de mon directeur général de l'' enseignement scolaire. Je n'' ai pas à rendre compte de décisions qui","ont été prises",". J'' étais fier d'' exercer ma fonction... Ce n'' est pas le sujet ! ...avec loyauté vis-à-vis du gouvernement en place,"
"513","PA721210,2018-04-20,Corbière, Alexis",", que vous aviez alors cautionné, monsieur le ministre d'' État , et sur lequel vous voulez revenir à présent",", est traité","dans cet article : il s'' agit de réinstaurer un délai de recours de quinze jours pour le demandeur d'' asile qui conteste la"
"514","PA721094,2017-11-09,Dunoyer, Philippe","fait l'' objet d'' un soutien, notamment sur Ouvéa qui est la plus petite des Îles Loyauté . Enfin, la Nouvelle-Calédonie s","'' est résolument engagée","dans son domaine de compétence l'' année dernière dans un schéma de transition énergétique qui devrait nous conduire,"
"515","PA719798,2020-06-04,Labaronne, Daniel","; le Gouvernement et la majorité privilégient cette méthode rapide, efficace et fructueuse. Des engagements","ont été pris","en septembre et en décembre 2018 ; ils portaient sur la limitation des frais bancaires à 20 euros par mois et 200 euros par"
"516","PA722038,2018-10-11,Adam, Damien","par le juge d'' un commandement de quitter les lieux sont -elles assorties de délais qui repoussent le moment où le","squatteur est effectivement délogé",". Cependant, ces délais peuvent être raccourcis : le juge des référés peut très bien les réduire ou les supprimer"
"517","PA330684,2018-04-21,Boyer, Valérie","en situation irrégulière soient pris en charge à 100 %, alors que les personnes qui cotisent à la Sécurité sociale","ne sont prises en charge qu","'' à 70 % pour les consultations et entre 15 % et 65 % pour les médicaments, et qu'' elles doivent, en plus, s'' acquitter de"
"518",",2020-04-14,","organisent sur le terrain grâce au dialogue social – c'' est le maître mot – et négocient pour que, pendant le confinement",", soient pris des congés payés",", des jours de RTT ou de compte épargne-temps, afin de pouvoir, le moment venu, s'' il le faut, repartir plus fort. Cela ne"
"519","PA721600,2020-02-05,Rossi, Laurianne","'' actions majeures de ce plan. Les résultats sont déjà visibles : comme vous l'' avez souligné, en deux ans, plus de 150 000","personnes sont sorties","de la rue ou d'' un centre d'' hébergement et ont pu accéder à un logement grâce au plan que nous promouvons. Je le constate"
"520","PA606712,2018-05-17,Lurton, Gilles","au 1er novembre 2019, en dessous du seuil de pauvreté, représente un effort important. Le Président de la République s","'' était engagé","à l'' augmenter de 100 euros, elle augmentera de 90 euros : je ne vais pas mégoter sur cet écart. Je tiens en revanche,"
"521",",2018-06-15,","de produits. La conduite des machines est automatisée. Si l'' on n'' anticipe pas et qu'' on ne forme pas massivement, ces","opératrices seront licenciées",", et l'' on embauchera et l'' on formera d'' autres personnes. Ce matin, une grande entreprise automobile française a"
"522","PA2150,2019-09-25,Mélenchon, Jean-Luc","ne le croyons pas. Nous avons beaucoup réfléchi avant de prendre notre décision et il ne faudrait pas faire croire que c","'' est une décision prise","au débotté. Cette mesure n'' est même pas partidaire : elle se trouvait dans le programme que j'' ai eu l'' honneur de"
"523","PA331481,2018-09-27,Le Maire, Bruno","ottoman : on serre un peu plus chaque année, jusqu'' à ce que les CCI disparaissent. C '' est vrai ! Voilà le processus","qui était engagé",": vous voyez que notre politique n'' a pas grand-chose à voir avec cela. Si ! Nous, nous opérons une transformation en"
"524","PA721976,2019-06-07,Millienne, Bruno","afin qu'' il soit d'' une efficacité redoutable. Et, honnêtement, je n'' imagine pas un instant que le Gouvernement , qui s","'' est engagé","à examiner la question, ne s'' y prête pas. Je ne donnerai pas de consigne de vote. Je vous livre simplement mon avis : je ne"
"525",",2018-01-16,",", mais seuls 1 000 sont pourvus, ce qui est insuffisant et renvoie à des enjeux d'' attractivité. Certaines initiatives","ont été prises",", notamment l'' inscription de la médecine scolaire comme spécialité susceptible d'' être apprise à l'' issue des études"
"526","PA605131,2018-11-06,Castaner, Christophe",", parce qu'' il était nécessaire de redresser le nombre des recrutements. Cette dynamique doit se poursuivre. C","'' est pourquoi nous avons engagé","un plan de recrutement de 10 000 personnes supplémentaires dans les forces de police et de gendarmerie, sur lequel nous"
"527","PA720002,2017-07-18,El Haïry, Sarah","3 % du PIB. Ce n'' est qu'' en assumant un sérieux budgétaire que nous parviendrons à réformer notre pays, comme nous nous","y sommes engagés",". Oui, c'' est notre engagement ! Aujourd''hui, ce n'' est pas l'' idéal, ce n'' est pas le plus confortable. Comme tous, j'' aime"
"528","PA721202,2019-05-07,Coquerel, Éric","! Sans le courage du personnel de l'' hôpital, qui a dit la vérité, trente-deux innocents, alors en garde à vue, auraient","pu être condamnés","à de la prison. Il y a un an, le 1er mai 2018 se déclenchait une affaire d'' État , avec Alexandre Benalla . Cette année, c'' est"
"529","PA1874,2019-10-17,Le Fur, Marc","vont jusqu'' à des agressions. Je parle sous le contrôle de Véronique Louwagie : une exploitation agricole de l'' Orne","a été attaquée","récemment. Ce fut aussi le cas d'' abattoirs, dans l'' Ain en particulier. Certaines des associations impliquées dans"
"530","PA606171,2018-07-12,Ferrand, Richard",", jusqu'' à l'' inscription de nouveaux droits et libertés dans la Constitution . La préoccupation que vous avez","exprimée est déjà largement prise","en compte dans le bloc de constitutionnalité. Dois - je vous rappeler les termes de l'' alinéa 3 du préambule de la"
"531","PA336175,2019-11-20,Pinel, Sylvia","son avis sur les révisions du schéma départemental de coopération intercommunale. Étant donné que les EPCI de l''","île sont représentés","au sein de cette enceinte et compte tenu de la configuration du territoire ainsi que de la fusion de la région et des"
"532","PA722374,2019-09-25,Isaac-Sibille, Cyrille","ont évolué : les femmes seules ont pu adopter des enfants, mais dans l'' intérêt de ce dernier ; aujourd''hui, le mariage","homosexuel est reconnu","et le couple homosexuel peut avoir des enfants. Pour ma part, je pose la question de la famille que j'' appelle"
"533","PA720468,2017-10-10,Chenu, Sébastien","dire que tous les amendements seront rejetés. Vous avez indiqué, dès l'' ouverture des débats, qu'' aucun amendement","ne serait accepté",". Vous rendez - vous compte de votre conception du débat ? Vous êtes en train de mépriser une parlementaire qui vous"
"534","PA330357,2018-12-18,Dussopt, Olivier","visant à rendre l'' usine de Blanquefort plus compétitive dans le cadre de la reprise. En contrepartie, le groupe Punch s","'' est engagé","auprès d'' elle à ne pas demander d'' efforts supplémentaires aux salariés pendant toute la durée de l'' accord et à ne"
"535","PA721474,2019-05-06,Viry, Stéphane","pas de raison de douter de votre parole. Toutefois, nous sommes des législateurs : quelle garantie avons -nous que ces","sommes seront bien inscrites",", de manière pérenne, dans le projet de loi de finances ? Quelle garantie avons -nous qu'' il n'' y ait pas à terme une érosion"
"536","PA227076,2019-04-29,Gourault, Jacqueline","confirmer que le Président de la République s'' est engagé à ce qu'' aucune décision de fermeture d'' école ou d'' hôpital","ne soit prise","sans l'' accord du maire. Il n'' y en aura donc aucune ! Nous verrons bien, monsieur Viala . Pour ce qui concerne le"
"537",",2018-06-15,","à des jeunes décrocheurs, âgés de quatorze, quinze ou seize ans, et développent une approche innovante dont les","résultats sont reconnus",". Elles sont tellement innovantes qu'' il n'' a jamais été possible, jusqu'' à présent, de trouver un cadre permettant leur"
"538","PA331582,2019-11-21,Vigier, Philippe",", que vous êtes attaché à l'' équilibre du texte, mais Pascal Brindeau soulève un argument important : le maire finit","par être pris","pour cible par une partie de la population, qui ne supporte plus les nuisances causées par ces établissements aux"
"539","PA267336,2019-11-15,Giraud, Joël",". J '' en demande le retrait, au profit des explications que nous apportera la secrétaire d'' État sur les actions qui","peuvent être engagées","en la matière. À défaut, j'' émettrai un avis défavorable. Quel est l'' avis du Gouvernement ? Comme vous l'' expliquez,"
"540","PA722110,2019-01-29,Wulfranc, Hubert","par l'' éviction de la Commission nationale du débat public – CNDP – pour qu'' aucune des revendications sociales","ne soit prise","en compte. Manipulation ! S '' il vous plaît, mes chers collègues, laissez M. Wulfranc s'' exprimer. Les quelques mesures"
"541","PA1874,2017-12-20,Le Fur, Marc","à prendre en considération la dimension territoriale de l'' événement, je retire mon amendement. Plusieurs","orateurs sont inscrits","sur l'' article 6. La parole est à M. Bertrand Sorre . Le projet de loi vise à donner tous les outils nécessaires aux"
"542","PA712014,2018-11-27,Ledoux, Vincent","milieu naturel. Cette démarche, dont je ne sous-estime pas l'' incidence pour un secteur d'' activité traditionnel,","devra être accompagnée",", tout comme devra l'' être le transfert des animaux vers des structures adaptées pour qu'' il se passe dans les meilleures"
"543","PA720746,2020-07-28,Waserman, Sylvain","est essentielle pour notre République et pour nos quartiers prioritaires, notamment dans la ville de Strasbourg , où","je suis élu",". En début de mandat, nous avons créé un dispositif, promis par le Président de la République : limiter à douze le nombre d"
"544",",2018-05-30,","du travail. Il a alors fait l'' objet de l'' accompagnement qui s'' impose et il n'' a pas jugé immédiatement nécessaire d","'' être accompagné","à l'' hôpital. En toute hypothèse, il s'' agit bien de drames individuels, qui évidemment nous interpellent"
"545","PA335532,2017-12-19,Pau-Langevin, George",". Cette règle, réaffirmée dans le code de l'' éducation, est remplacée ici par celle selon laquelle les bacheliers","ne sont admis","à l'' université où ils postulent que dans la mesure des places disponibles. Par ailleurs, si le profil du candidat"
"546","PA331481,2019-02-06,Le Maire, Bruno","des contribuables ayant de hauts revenus et l'' évolution de l'' investissement dans les entreprises. Ces éléments","microéconomiques seront notamment pris","en compte dans l'' évaluation globale de la nouvelle fiscalité du capital qui sera conduite d'' ici la fin de l'' année 2019."
"547","PA721608,2018-11-16,Bourlanges, Jean-Louis","notre groupe soutient à fond une politique impopulaire, et que nous croyons juste, sur le gazole. Mais nous ne voulons","pas être pris","en flagrant délit d'' incohérence. Nous défendons, sur cette question, contre une grande partie de l'' opinion, une"
"548","PA703535,2019-01-16,Lemoyne, Jean-Baptiste","millions d'' euros, dont 390 millions annoncés par des partenaires extérieurs aux pays sahéliens. Des équipements ont","déjà été livrés","pour 50 millions d'' euros et les autres seront dans le courant de l'' année, la France faisant partie des États qui"
"549","PA720854,2019-07-16,Testé, Stéphane","en précisant qu'' elle les exerce en s'' inscrivant dans le cadre d'' une convention d'' objectifs conclue avec l'' État",". Est également inscrit","dans la loi le fait que l'' Agence prend la forme d'' un GIP . Ce statut est apparu comme le plus adapté, car il permet une"
"550","PA330357,2019-05-17,Dussopt, Olivier","de contractuel pour un emploi de direction – lorsque celui-ci présente un risque en matière de déontologie –","doit être précédée","et accompagnée d'' un examen de la situation déontologique des personnes. Le deuxième progrès porte sur la publicité"
"551","PA2960,2018-10-22,Woerth, Éric","les rapporteurs, je souligne tout d'' abord que la contribution de la France est en hausse puisqu'' elle s'' élèvera, cela","a été rappelé",", à 21,5 milliards d'' euros pour 2019, soit 900 millions d'' euros de plus par rapport à la prévision actualisée pour 2018,"
"552","PA712014,2019-10-31,Ledoux, Vincent","deux objectifs du Gouvernement de renforcer le canal bilatéral de notre aide et la part du don. Néanmoins, la France s","'' est engagée","à participer à la reconstitution des ressources d'' organisations multilatérales importantes, à commencer par le"
"553","PA719570,2018-07-24,Fabre, Catherine","l'' avis de la commission ? Le projet de loi vise à rapprocher le régime des deux grands outils de formation, lorsque cette","dernière est suivie","en dehors du temps de travail : le compte personnel de formation, qui est à la main du salarié, et le plan de développement"
"554","PA722194,2019-05-21,Provendier, Florence","ainsi à un besoin de proximité. Dans le cadre de la future réforme de l'' audiovisuel public, M. le ministre de la culture s","'' est engagé","à faire de l'' actualité régionale un vecteur de renouveau. La précédente ministre de la culture avait par ailleurs"
"555","PA718926,2019-07-08,Dharréville, Pierre","transports sera porté de 9 000 à 13 000 en 2022-2024 et de 20 000 à 22 000 en 2028-2030. Les voies des autoroutes A31 et A31","bis seront doublées","et comprendront des voies réservées aux transports en commun et au covoiturage. Les investissements dans le"
"556","PA606712,2019-06-13,Lurton, Gilles","des financements dans le cadre du contrat de plan État-région . Je suis bien incapable de dire si ces financements","pourront être inscrits",". Je pense à l'' élargissement à deux fois deux voies des deux derniers kilomètres de la route nationale 176 qui n'' y sont"
"557","PA721600,2019-06-07,Rossi, Laurianne","engins de rouler à 6 kilomètres à l'' heure ne va pas dans ce sens. Qui d'' ailleurs pourra vérifier que cette limitation de","vitesse est respectée","? Personne. Il faut donc tout simplement interdire la circulation de ces engins sur nos trottoirs et avancer vite sur"
"558","PA588884,2018-04-19,Autain, Clémentine","les consciences au sein de cette assemblée. Par cet amendement, nous proposons d'' interdire que les mineurs non","accompagnés soient soumis à une procédure accélérée","dans le cadre de l'' examen de leur demande d'' asile, la procédure accélérée étant une nette dégradation de la procédure"
"559","PA721418,2017-11-03,Mignola, Patrick","et du contrôle budgétaire. Monsieur le président, monsieur le ministre d'' État , le budget de la sécurité civile","doit être examiné","à la lumière des événements de la période récente, qui nous ont confrontés à de redoutables défis : les attentats"
"560","PA719640,2018-11-13,Mette, Sophie",", l'' Espagne ou l'' Italie , voire de deuxième si l'' on tient compte de l'' investissement dans la recherche publique. Nos","chercheurs sont reconnus","dans le monde entier pour leur excellence et il est important que leurs résultats puissent être connus de tous et"
"561","PA721336,2018-06-05,Brocard, Blandine","raisons principales, de nombreux retraités de notre pays renoncent donc à une couverture santé qui, l'' âge avançant",", est pourtant reconnue","comme essentielle. Face à ce constat, des communes et des intercommunalités de plus en plus nombreuses ont décidé d''"
"562","PA719866,2018-11-19,Abadie, Caroline",". Nous vous donnons les moyens, madame la garde des sceaux, de lancer des chantiers pour 15 000 places de prison, dont 7","000 seront livrées","d'' ici à 2022. À quoi cela sert -il ? C '' est une promesse pour l'' avenir ! Il est essentiel de renforcer la sécurité d''"
"563","PA605518,2019-12-11,Lambert, François-Michel","des mises à jour de confort, afin de lutter contre l'' obsolescence logicielle. L'' amendement défendu en commission","a été rectifié","pour être conforme à la directive européenne du 20 mai 2019. Il en complète d'' autres. Il s'' inscrit dans la continuité de"
"564","PA2150,2020-01-07,Mélenchon, Jean-Luc","? En pension auprès des banques centrales, nécessairement. Or les taux d'' intérêt sont négatifs. Par conséquent, ces","fonds sont condamnés","à fondre chaque année, pour des raisons sur lesquelles nous n'' avons aucune prise et auxquelles nous ne pouvons rien."
"565","PA721916,2018-06-14,Pouzyreff, Natalia","de contrats depuis 2012, notamment pour les premiers niveaux de formation – niveaux IV et V. Pour y remédier, un double","objectif est poursuivi",": celui de faire converger plus rapidement l'' offre de formation avec la demande des entreprises en termes de métiers,"
"566","PA721960,2019-10-03,Obono, Danièle","civil. Ces opérations et traitements sont irréversibles, lourds et traumatisants. Selon les témoignages qui nous","ont été rapportés",", ils ont souvent lieu sans le consentement de la personne concernée, si bien qu'' il y a des erreurs d'' assignation de"
