"","Reference","Left","KWIC","Right"
"485","PA729332,2018-02-20,Denormandie, Julien","des obligations. Le gendarme des télécoms, l'' ARCEP , sera là pour veiller à ce que tous les engagements pris par les","opérateurs soient bien respectés",". Très bien ! Nous en venons maintenant aux questions. Nous commençons par les deux questions du groupe La République en"
"486","PA610775,2017-12-18,Gomès, Philippe","adaptée à des recouvrements dont la majeure partie s'' effectue auprès d'' assurances privées. Toutefois, si cet","usage était appelé","à se généraliser, il convient de tout faire pour éviter l'' avènement d'' un système médical à deux vitesses, susceptible"
"487","PA266797,2017-07-28,Gosselin, Philippe","la préfecture, selon la règle du service fait. Ce n'' est qu'' à ce moment, en accord avec les services préfectoraux, que la","subvention est virée",". Il faut aller jusqu'' au bout ! Il y a là un fantasme, une méconnaissance incroyable ! La parole est à M. Jean-Louis"
"488","PA1874,2019-07-03,Le Fur, Marc","par des individus se réclamant de diverses associations, comme Direct Action Everywhere ou L214 , dans la mesure où","ils sont accompagnés","d'' intrusions dans les propriétés, ne puissent plus, à l'' avenir, être diffusés par les géants du numérique. Dès lors"
"489","PA605131,2019-11-05,Castaner, Christophe","les départements, afin d'' intégrer votre idée dans l'' ensemble des nombreuses actions qui existent déjà. Les enfants","devront être accompagnés","et sensibilisés pour éviter les chocs que Mme la rapporteure vient d'' évoquer. Je suis saisi de trois amendements, n°"
"490","PA266797,2020-05-07,Gosselin, Philippe","de la faute caractérisée. En réalité, les ministres, les préfets et les directeurs d'' ARS et d'' administrations","centrales sont exclus du dispositif adopté","par le Sénat , ce qui est logique car ils sont les détenteurs du pouvoir de réglementer, de concevoir le déconfinement."
"491","PA606171,2018-10-30,Ferrand, Richard","de carburant encore plus maîtrisée. Nous avons terminé les questions au Gouvernement . La séance est suspendue. La","séance est reprise",". L'' ordre du jour appelle les explications de vote au nom des groupes et le vote par scrutin public sur l'' ensemble du"
"492","PA267233,2018-04-17,Bouillon, Christophe","de fait la question de l'' aménagement du territoire comme celle de l'' égalité entre les territoires. Derechef , rendez -","vous est pris","pour plus tard – 2019 ou 2020, nous dit -on. J'' évoquerai enfin le prétexte. Je suis de ceux qui pensent qu'' on aurait pu"
"493","PA607553,2017-07-28,Potier, Dominique",", malheureusement à géométrie variable, des députés dans la marche et la dynamique des projets où l'' argent de l''","État est engagé","sur les territoires. Nous pourrions avoir un nouveau pacte de présence et de contribution à la vie publique du député"
"494","PA720386,2018-01-24,Di Filippo, Fabien","de la commission ? Défavorable. Quel est l'' avis du Gouvernement ? Défavorable. La parole est à M. Fabien Di Filippo . J ''","ai été pris","par surprise, étant donné la rapidité de la réaction du rapporteur et du ministre sur l'' amendement n° 541. Je m''"
"495","PA720746,2018-10-03,Waserman, Sylvain","Hier soir, l'' Assemblée a poursuivi la discussion des articles du projet de loi, s'' arrêtant à l'' article 44. De nombreux","orateurs sont inscrits","sur l'' article. La parole est à M. Robin Reda . Monsieur le président, monsieur le ministre de l'' économie et des finances"
"496","PA1498,2019-07-04,Goasguen, Claude","laquelle vous entrez ? On connaît en effet celle qui s'' applique pour la loi de 1881 ; si vous y ajoutez celle - là, vous n","'' êtes pas sortie","de l'' auberge... Je vous appelle tout de même à un peu plus de tempérance, d'' autant plus que je ne suis pas sûr qu'' une telle"
"497","PA267289,2019-03-21,Door, Jean-Pierre","politique vaccinale, il faudrait donc que certains vaccins soumis à une prescription médicale obligatoire, dont la","liste serait fixée par arrêté",", puissent être, non pas déclassés, mais prescrits par les pharmaciens. Quel est l'' avis de la commission sur cette"
"498","PA2150,2019-07-02,Mélenchon, Jean-Luc","que s'' applique le secret de l'' instruction. Non ! Ça n'' existe pas dans ce pays ! Il a raison ! Mais si, monsieur Mélenchon !","Il est constamment violé","! En revanche, bien évidemment, comme il l'' a déjà fait récemment, M. le procureur aura l'' occasion de s'' exprimer très"
"499","PA720806,2018-03-07,Gayte, Laurence","Union européenne et Israël entretiennent de longue date des relations bilatérales, puisque un accord de coopération","a été signé dès 1975, suivi","en 1995 par le Processus de Barcelone qui visait à faire de l'' espace méditerranéen un espace de paix. Ce dernier s'' est"
"500","PA721278,2018-06-21,Anato, Patrice","2015. Selon les chiffres communiqués par le ministère de l'' économie, au 1er décembre 2017, 3,5 millions de personnes s","'' étaient inscrites","sur cette liste et 700 entreprises avaient adhéré au système. Mais les différentes enquêtes menées par les"
"501",",2020-01-28,","d'' une interdiction de paraître, qui vient en sus du 17 ° de ce même article, précisant l'' ensemble des mesures qui","peuvent être prises","en cas de violences conjugales. Il me semble dans ces conditions que votre amendement n'' ajouterait pas d'' élément"
"502","PA759830,2018-12-18,Wargon, Emmanuelle","ans. Tel est le sens de ce projet de loi, que vous-même et vos collègues examinerez prochainement. Le Gouvernement s","'' est engagé","à demeurer aux côtés des collectivités territoriales, afin d'' entretenir les lignes ferroviaires où la circulation"
"503","PA721118,2018-07-18,Brotherson, Moetai","des parlementaires hydroponiques, comme les salades, totalement hors-sol. Très juste ! Avant d'' être député, il","faut être élu",", et nous l'' avons tous été sur le fondement d'' une profession de foi, valant promesse aux habitants de notre"
"504","PA722142,2020-03-03,Ruffin, François","rejetés. Dehors , vous cachez votre étiquette, votre parti, comme une honte. C '' est un fossé, un gouffre, qui s","'' est creusé entre représentants et représentés",". Votre légitimité s'' est amenuisée, elle a disparu. Votre mandat n'' a plus de base, plus d'' appui dans le pays. Et malgré"
"505","PA608695,2018-12-11,Untermaier, Cécile","sur la méthode : non seulement l'' agenda a été bouleversé et le rythme a été bousculé, mais l'' opposition comme le Sénat","ont été exclus","du débat. Au bout du compte, ce texte d'' administration, dépourvu d'' âme, creuse le sillon de ce que nous avions fait en"
"506","PA717153,2019-10-04,Buzyn, Agnès",". L'' Agence de la biomédecine rend compte du nombre grandissant d'' ovocytes congelés. Le mouvement de la congélation","ovocytaire est donc engagé",", sans, je le répète, que nous puissions affirmer qu'' elle pourra un jour remplacer totalement la pratique de la"
"507","PA719472,2019-04-04,Cazeneuve, Jean-René","de loi, qui nous paraît à la fois injuste, démagogique et irresponsable. Injuste , tout d'' abord, car les mesures qui","y sont inscrites",", contrairement à ce vous répétez en boucle, ne ciblent pas les classes moyennes : les grands gagnants sont bel et bien"
"508","PA607553,2018-05-28,Potier, Dominique",", sur de tels sujets, une certaine prudence s'' impose, mais je crois vous avoir montré que toutes les règles de prudence","avaient été respectées",". Nous disposons d'' un rapport parlementaire incontesté, qui a été adopté à l'' unanimité, et d'' un rapport commun de l''"
"509","PA720728,2018-10-15,Mattei, Jean-Paul",". C '' est une évidence ! Arrêtons de tourner en boucle : cette réforme permettra de moderniser l'' impôt sur le revenu,","qui sera payé","au moment où les revenus sont perçus. Enfin une réforme positive pour l'' ensemble des contribuables ! La parole est à M."
"510",",2018-11-13,",", l'' efficacité des traitements a augmenté au fur et à mesure que nous avons maîtrisé la chimiothérapie. Tout ce qui","peut être traité","par la chimiothérapie ou la radiothérapie l'' est aujourd''hui : on peut encore améliorer les traitements ou diminuer"
"511","PA906,2018-04-21,Collomb, Gérard","pas n'' importe quoi : il existe des milliers de fiches et nous surveillons aux frontières l'' ensemble des personnes","qui sont inscrites","dessus. En fonction de ce que nous voulons rechercher, nous donnons un certain nombre de directives et la personne"
"512","PA722150,2017-12-11,Houlié, Sacha","de la commission des lois, mes chers collègues, ainsi que cela vient d'' être dit, l'' ordonnance qu'' il vous est proposé de","ratifier est prise","sur le fondement de l'' habilitation issue de l'' article 8 de la loi du 16 février 2015, elle est entrée en vigueur le 1er"
"513","PA720430,2020-02-11,Bernalicis, Ugo","parqués dans des fourgons au lycée Arago . Maintenant , les garde à vue se multiplient dans le pays : plus de vingt-cinq","enfants sont enfermés pour avoir bloqué","leur lycée. Nous sommes donc en dictature ! Je vous parle en tant que député du peuple, mais aussi en tant que père de"
"514",",2017-11-21,","pour attirer les jeunes générations vers les mandats syndicaux. Ce pragmatisme, c'' est aussi, comme nous nous","y étions engagés",", la nécessaire prise en compte de la spécificité des très petites, petites et moyennes entreprises, les TPE-PME , qui"
"515","PA608083,2019-05-07,Bourguignon, Brigitte","emploi – EPIDE – ou les écoles de la deuxième chance. Le présent amendement a simplement pour objet de préciser que cette","mesure est prise","à titre expérimental, pour une durée de deux ans. L'' expérimentation doit en effet permettre d'' examiner les modalités"
"516","PA330240,2018-07-26,Ciotti, Éric","du principe d'' accueil et de générosité de la part de notre pays. C '' est du bon sens que d'' affirmer que ces personnes, qui","ont été condamnées pour avoir violé","les lois de la République , n'' ont plus rien à faire sur le territoire français. Le Sénat avait introduit cette peine à"
"517","PA608016,2017-11-13,Louwagie, Véronique","conformément qui droit commun. Il s'' agit ici de faciliter le parcours judiciaire de ces victimes, afin qu'' elles","puissent être indemnisées",". Comme dans le cas de la Dépakine , plus ancien, le coût d'' une telle indemnisation peut être extrêmement élevé. Il est"
"518","PA721824,2018-05-24,Renson, Hugues",", monsieur le président ! ...mais celle-ci est accordée pour une durée de trois minutes. La séance est suspendue. La","séance est reprise",". La commission a supprimé l'' article 37. La parole est à M. Sylvain Waserman , rapporteur, pour soutenir l'' amendement"
"519","PA609520,2019-01-23,Pompili, Barbara","l'' eau. Évidemment, la gestion de l'' eau concerne la qualité des eaux marines, la protection des milieux marins – qui a d''","ailleurs été inscrite","en tant que telle –, mais il est ici question des zones couvertes par le champ de compétences de l'' OFB , à savoir notre zone"
"520","PA721226,2017-11-10,Rubin, Sabine","même pas daigné s'' y intéresser et que ces rapports aient tous été refusés en commission. Je m'' indigne à présent qu''","ils soient purement et simplement retoqués","pour la plupart, privant la représentation nationale d'' un débat de fond. Madame la ministre , je vous fais crédit de"
"521","PA610654,2019-01-17,Nilor, Jean-Philippe","sur l'' hypothèse extravagante selon laquelle le gardé à vue est parfaitement au fait de ses droits. Si de surcroît il n","'' est pas assisté","d'' un conseil, comment voulez - vous qu'' il sache qu'' il peut demander à être présenté à un juge ? On sait que, dans la"
"522","PA719608,2018-06-26,Ménard, Emmanuelle","ne permettent la représentation que de deux listes ; dès lors, la variété des sensibilités des agriculteurs","ne sera plus représentée",". Pour un projet de loi qui vise à instaurer une relation de confiance, tout cela m'' étonne. Cette mesure n'' est pas"
"523","PA722150,2017-07-27,Houlié, Sacha","M. Petit , qui avait demandé la parole, ne souhaitant plus intervenir, je vais mettre aux voix l'' amendement n° 492. Deux","orateurs sont inscrits","sur l'' article 5. La parole est à Mme Isabelle Florennes . Monsieur le président, madame la ministre, madame la"
"524","PA330357,2019-05-17,Dussopt, Olivier","application duquel nous devons veiller. Aujourd''hui , des sanctions disciplinaires peuvent être prises : elles","peuvent être accompagnées","d'' une retenue sur pension de 20 % lorsque le fonctionnaire concerné est retraité, de l'' impossibilité de recruter"
"525","PA721202,2020-04-07,Coquerel, Éric","autre que celles strictement nécessaires. Nous ne devons pas nous mentir : nous allons nous aussi continuer d","'' être durement frappés","– votre ministre de la santé l'' a d'' ailleurs souligné ce matin. Hier, le ministre de l'' intérieur déclarait qu'' il était"
"526","PA-103679,2019-02-06,Migaud, Didier","sont insuffisamment exploitées. C '' est d'' ailleurs à cet exercice de ré-interrogation des moyens publics que vous","vous êtes livrés","l'' année passée, mesdames, messieurs les députés, dans le cadre du "" printemps de l'' évaluation "". La Cour a eu l'' honneur"
"527","PA720746,2020-02-28,Waserman, Sylvain","nous répondre à ce qui vient d'' être dit, monsieur le président ? Vous ne pouvez pas vous exprimer sur des amendements qui","ont été repris",". Ah , nous ne pouvons pas éclairer le vote de nos collègues ? Dans ce cas j'' interviendrai plus tard, quitte à être hors"
"528","PA607395,2018-05-26,Travert, Stéphane","donc défavorable aux deux amendements et au sous-amendement. Quel est l'' avis du Gouvernement ? Des initiatives ont","déjà été prises","en la matière – Mme Panot a évoqué Les Sables -d''Olonne et Strasbourg , et c'' est aussi le cas à Bordeaux ou à Montrouge . L''"
"529","PA722110,2018-09-26,Wulfranc, Hubert",", qui disent tranquillement certaines choses. J '' ai d'' ailleurs remarqué, monsieur le rapporteur général, que vous","aviez été piqué","au vif. Ce n'' est pas faux ! D '' où le fait que votre réponse ait été un brin idéologique. C '' est un expert qui parle ! C '' est l''"
"530","PA720286,2018-02-01,Fiat, Caroline","et de sanctions pénales prévue à l'' article 5. Cette absence d'' incrimination ne vaut toutefois que pour autant qu'' aura","également été respectée","la procédure collégiale, extrêmement précise, prévue à l'' article 3. Cet article encadre de façon très stricte le"
"531","PA721872,2019-12-18,Poirson, Brune","de certains emballages – je pense par exemple à tout le travail réalisé par l'' entreprise Samson , sur le territoire dont","vous êtes élu",". Vous nous avez souvent alertés et nous avons déjà mis en œuvre certaine mesures. Il reste du travail à faire pour rendre"
"532","PA345619,2017-10-17,Philippe, Édouard","rapidité avec laquelle nous avons mis en œuvre la réforme du code du travail, à laquelle le Président de la République s","'' était engagé","– réforme que bien d'' autres, peut-être, auraient aimé faire, mais que nous avons décidé de mettre en œuvre,"
"533","PA345722,2018-04-19,Le Grip, Constance","loin en permettant à l'' OFPRA de refuser d'' accorder le statut de réfugié ou d'' y mettre fin lorsque la personne concernée","a été condamnée","à deux ans d'' emprisonnement. Il s'' agit de renforcer la sécurité, comme nous le devons à nos concitoyens. La parole est à"
"534",",2018-11-22,","des mesures conservatoires sur le plan patrimonial, telle que l'' apposition des scellés sur les biens communs,","et sont rarement prises","pour des questions comme la résidence des enfants. Le texte du projet de loi offre des réponses parfaitement"
"535","PA722142,2018-09-13,Ruffin, François","distribution,... Exactement ! ... en espérant que de tout cela sortira une harmonie qui permettra aux agriculteurs d","'' être mieux rémunérés","? Si ça marche au pays des Bisounours , tant mieux, mais le problème, c'' est que dans la réalité, ça ne marche pas – et cela"
"536","PA764388,2020-05-27,O, Cédric",", un peu trop longtemps d'' une personne malade, jamais personne ne pourra vous prévenir. Ensuite, entre le moment où une","personne est testée","positive et celui où ces contacts sont prévenus, il peut se passer plusieurs heures voire plusieurs jours ; or, ces"
"537","PA2792,2018-05-27,Taugourdeau, Jean-Charles","je dis qu'' il ne faut pas stigmatiser les agriculteurs, j'' aimerais que l'' on soit d'' accord avec moi. Nous le sommes ! Les","agriculteurs sont contrôlés","en permanence. Si vous voulez développer la vidéosurveillance, équipez donc de caméras les personnes qui viennent"
"538","PA721624,2018-11-22,Avia, Laetitia","est l'' hôpital qui se moque de l'' infirmerie ! Mes chers collègues, comment pensez - vous qu'' une requête en injonction de","payer est traitée","à l'' heure actuelle ? C '' est un acte unilatéral ! Depuis tout à l'' heure, vous n'' avez que les mots "" local "" et "" territoires """
"539","PA721608,2018-09-17,Bourlanges, Jean-Louis","mesure Othello ne serait pas possédé et ne serait pas privé de son libre-arbitre, auquel cas la responsabilité de Iago","pourrait être engagée",". Quoi qu'' il en soit, cette question ne se pose pas dans le cas des officines où l'' on travaille à imaginer le mal. Ces gens,"
"540","PA266774,2017-12-18,Furst, Laurent","entre nos deux pays. Bien évidemment, l'' activité programmée pour ce type de soins concerne des personnes qui doivent","impérativement être soignées","dans d'' excellentes conditions, mais par ailleurs des dizaines de milliers d'' actes sont dispensés de façon non"
"541","PA720560,2017-11-02,Goulet, Perrine","de l'' amendement relatif au CNDS , nous avons vu tout à l'' heure qu'' une dépense comprise entre 20 et 30 millions d''","euros serait engagée","via un amendement au projet de loi de finances rectificative pour 2017. Pour ces différentes raisons, l'' avis est"
"542","PA1206,2017-07-28,Dupont-Aignan, Nicolas","ou de nos communes rurales. Vous allez encore creuser le fossé qui sépare nos concitoyens, qui n'' en peuvent plus d","'' être oubliés",", abandonnés, notamment dans ces territoires, du monde politique. Vous croyez vous en tirer en accusant les élus, les"
"543","PA721584,2018-11-19,Terlier, Jean",", tel est le fil rouge du projet de loi dont nous allons débattre cette semaine. Madame la garde des sceaux, je veux qu''","il soit rappelé ici que vous avez préféré","une réforme construite à partir des recommandations des acteurs du terrain et sur la base des conclusions des"
"544","PA721286,2019-10-25,Ramadier, Alain","du PLFSS pour 2019, un amendement similaire avait été déposé mais repoussé par le Gouvernement au motif que ce sujet","devait être traité","dans le cadre de la concertation "" grand âge et autonomie "" pilotée par Dominique Libault . Or le rapport du 28 mars 2019 n''"
"545","PA268019,2018-11-23,Lagarde, Jean-Christophe","pour du trafic, de la distraction, de la consommation – peu importe : ils sont chez eux, ils ont du mal à rentrer chez eux,","ils sont intimidés","quand ils rentrent et perturbés quand ils sont à la maison, parce qu'' il y a des gens qui mettent le bordel en bas ! Oh ! Ça"
"546","PA719138,2020-02-11,Castellani, Michel","fond, certains aspects sont positifs, mais la méthode soulève plusieurs interrogations importantes. Le Parlement","a été invité","à tirer les conséquences de trois ordonnances qui n'' ont pas encore été ratifiées, sur des sujets aussi importants que"
"547","PA267901,2019-06-20,Kamardine, Mansour","quand on ne dispose pour aéroport que d'' une piste que la plupart des appareils venus d'' Europe ne peuvent emprunter.","On est condamné","à la relégation quand, en dépit d'' un port naturel remarquable et d'' une situation géographique privilégiée, le"
"548","PA2150,2018-05-27,Mélenchon, Jean-Luc","à juste titre, marquer la solennité, l'' importance du moment et des débats que nous aurons, dont je suis certain qu''","ils seront suivis , scrutés","par les Français , non seulement parce que ces derniers ont un attachement à leurs animaux domestiques, mais aussi"
"549","PA722202,2020-05-08,Jumel, Sébastien","notre droit, comme l'' anonymat, le secret médical, – puisque, selon la composition de la brigade sanitaire, celui-ci","pourrait être bousculé","– ; élaborer un fichier national, dont l'' efficacité et la durée posent des questions fondamentales ; élargir les"
"550","PA722202,2018-09-14,Jumel, Sébastien","solidaire, qui va de la gratuité à un tarif prenant réellement en compte les revenus des familles. Ces communes -","là seront -elles accompagnées","ou leur appliquera -t - on la double peine en les privant de tout accompagnement financier au motif qu'' elles ont pris de l"
"551","PA2960,2017-10-19,Woerth, Éric","de bois. En l'' occurrence, il n'' existe aucun sabre de bois mais de nombreux sujets distincts. Certains ne peuvent en","effet être traités qu","'' à l'' échelle européenne, voire mondiale, mais il en existe d'' autres sur lesquels nous pouvons avancer. Le Président"
"552","PA720520,2019-06-14,Cattelot, Anne-Laure",", mais montre que ce projet est arrivé à maturité. Cette marque de respect pour la représentation nationale","a été très appréciée","de mes collègues. Le 3 octobre 2017, vous et Gérald Darmanin nous avez informés de la validation par le Premier ministre"
"553","PA266797,2018-05-23,Gosselin, Philippe","maire bien connue, "" quand c'' est flou, c'' est qu'' il y a un loup "". Pour notre part, nous voulons éviter aux agriculteurs d","'' être dévorés","par ce loup. Le contexte international est suffisamment difficile pour qu'' on leur assure de pouvoir compter sur l''"
"554","PA721960,2018-05-16,Obono, Danièle","que le harcèlement dit de rue et les atteintes sexuelles affectent la vie de 3 millions de femmes par an. Ce chiffre","a été repris","dans de nombreuses discussions. Le constat que nous partageons est le suivant : le harcèlement dans les espaces"
"555","PA718944,2018-06-07,Racon-Bouzon, Cathy","ne sont pas pénalement responsables des infractions pénales commises par leurs enfants mineurs. Ils ne peuvent","pas être sanctionnés","à leur place, car la responsabilité pénale est personnelle. L'' amendement tend à remettre fondamentalement en cause"
"556","PA340357,2018-04-17,Victory, Michèle","tout ce qui peut aider chaque être humain à trouver la force de suivre sa trajectoire. En l'' espèce, chacun a besoin d","'' être accompagné","par la personne qu'' il a choisie. Nous demandons donc de donner le droit au séjour aux conjoints en supprimant le délai d''"
"557","PA759832,2020-02-06,Pannier-Runacher, Agnès",", choisi de le répartir entre les cotisations sociales et l'' impôt. Mais le niveau de cotisations en France s","'' est progressivement détaché","de celui de la moyenne des autres pays européens qui ont choisi à peu près le même modèle – on ne peut pas se comparer à la"
"558","PA719060,2019-11-08,Jerretie, Christophe","aurions moins souvent le sentiment de nous réunir pour peu de chose. Quel est l'' avis de la commission ? L'' amendement n'' a","pas été examiné","en commission. À vrai dire, il me semble que le seuil actuel est de 100 000 euros. Je dois vérifier – preuve que même un"
"559","PA722086,2019-06-17,Taquet, Adrien","d'' engagement et de cohésion. Ces 2 000 jeunes volontaires d'' horizons différents et représentatifs de la jeunesse","française sont appelés","à vivre deux semaines dans un centre d'' hébergement collectif, dans l'' un des treize départements pilotes, qui vont des"
"560","PA721924,2018-01-23,de Vaucouleurs, Michèle",", et contribue à ce titre à l'' égal accès aux soins pour un public rencontrant des difficultés de mobilité. L'' hôpital s","'' est par ailleurs engagé","en faveur de pratiques ou de projets qui sont en parfaite adéquation avec les objectifs fixés par l'' article 51 de la loi"
"561","PA607846,2018-09-17,Darmanin, Gérald","contrôles fiscaux ? Elle interprète la loi et la jurisprudence, et, parfois, le contribuable n'' est pas d'' accord. Un","contentieux est alors engagé",", et ce n'' est pas très grave. Monsieur de Courson , comme une grande partie de l'' hémicycle, dans le cas d'' un contrôle"
"562","PA719608,2018-11-29,Ménard, Emmanuelle","article vise à insérer un nouvel alinéa après le deuxième alinéa de l'' article 371-1 du code civil, celui -là même, cela","a été rappelé , qui est lu","à chaque mariage. Vous l'' avez relu, je recommence : "" Les titulaires de l'' autorité parentale l'' exercent sans violence"
"563","PA720996,2020-06-04,El Guerrab, M''jid","et de voyageurs de ma circonscription rencontrent au Maghreb et en Afrique de l'' Ouest . Nombre de nos concitoyens","ont été bloqués","au Maghreb , non seulement au Maroc et en Algérie , mais aussi dans d'' autres pays africains. Ils se sont retrouvés dans"
"564","PA721872,2018-04-04,Poirson, Brune","millions d'' euros de déficit ? Et quand une délégation de service public est mise en œuvre, l'' entreprise à qui le service","public est délégué est contrôlée",", et éventuellement sanctionnée. La parole est à Mme Sabine Rubin . Il sera encore question de partenariat"
