"","Reference","Left","KWIC","Right"
"329","PA643089,2019-01-30,Thiériot, Jean-Louis","'' annuler, ce qui ouvre droit à indemnisation dans le cadre du plein contentieux. Oui, le contrôle existe et l'' État peut","être sanctionné","si son représentant – le préfet – a commis une erreur. Je souhaitais souligner ce point. J '' ai entendu parler d'' une"
"330",",2018-07-18,","de la Constitution , sur lesquels s'' appuie cette jurisprudence du Conseil constitutionnel : "" si [les] députés [...]","sont élus","au suffrage universel, [...] chacun d'' eux représente au Parlement la nation tout entière et non la population de sa"
"331","PA719138,2018-07-26,Castellani, Michel",", les personnes les plus fragiles, les moins informées, celles qui ont le plus besoin de protection. Si cette mesure","est prise",", et nous pensons qu'' elle le sera, nous souhaiterions que l'' administration s'' adapte pour que ces personnes soient"
"332","PA719558,2018-06-07,Balanant, Erwan","sociaux, qui assoient leur légitimité sur la massification de la diffusion de l'' information, sans que celle-ci ait pu","être traitée , éditorialisée",", voire simplement vérifiée. Plusieurs médias sont même aujourd''hui spécialisés dans la diffusion d'' une"
"333","PA642788,2018-12-20,Véran, Olivier","pas, qui sont dans une très grande détresse. J '' ai bien entendu la réponse de la ministre des affaires sociales, qui s''","est engagée","à ce que dans le cadre du rapport nous ayons des éléments qui puissent concerner ces populations. Je crois que c'' est"
"334","PA942,2018-11-15,de Courson, Charles","? J '' avais pour ma part proposé un système de proratisation : une activité rapportant 40 % du rendement du bâtiment","serait taxée","à 60 % de la base. En revanche, aux termes de l'' amendement de la commission, si le revenu dépasse 10 % du rendement du"
"335","PA719858,2018-10-30,Limon, Monique",". Il faut bien admettre que le critère d'' éco-conditionnalité qui devait présider à la sélection des projets n''","est pas pris","en compte à sa juste valeur. La mission d'' évaluation et de contrôle sur le PIA et la transition énergétique, créée en"
"336","PA720622,2018-06-11,Bureau-Bonnard, Carole","tous. J'' appelle maintenant, dans le texte de la commission, les articles du projet de loi. Plusieurs orateurs","sont inscrits","sur l'' article 1 er. La parole est d'' abord à Mme Fadila Khattabi . L'' article 1erconstitue l'' une des avancées majeures du"
"337","PA721182,2017-11-02,Petit, Frédéric","bien. De grands partenaires en matière de démocratie, de contrôle des subventions de l'' État ou des départements ont","été oubliés","dans notre discussion : les fédérations d'' associations. Ainsi, la petite association sportive qui a besoin d'' un jeu"
"338","PA267780,2020-06-15,Firmin Le Bodo, Agnès","fiers d'' y avoir contribué. Tout le monde parle depuis si longtemps de ce projet important. Eh bien, nous y sommes ! Il","est inscrit","dans la loi. Il nous revient à présent, chers collègues, à travers le PLFSS et la future loi sur le grand âge et l''"
"339","PA718838,2019-11-04,Brun, Fabrice","une grande lenteur, madame la secrétaire d'' État . La parole est à M. Fabrice Brun . Cet amendement d'' appel n'' avait pas","été examiné","par la commission des finances, puisqu'' il avait été jugé irrecevable en raison d'' un problème de rédaction. L'' enjeu"
"340","PA267801,2018-04-10,Jégo, Yves","le président ! La séance est suspendue. La séance est reprise. Je mets aux voix l'' amendement n° 221. Plusieurs orateurs","sont inscrits","sur l'' article 1e r bis. La parole est d'' abord à Mme Marie-Christine Verdier-Jouclas . Ah , les truands ! Je suis fille de"
"341","PA721824,2017-12-05,Renson, Hugues","nous venons d'' adopter. À la demande du ministre, la séance est suspendue. La séance est reprise. Plusieurs orateurs","sont inscrits","sur l'' article 10. La parole est à Mme Marie-Christine Verdier-Jouclas . L'' objectif poursuivi par la modification du"
"342","PA719396,2019-07-17,Larsonneur, Jean-Charles","et protecteurs avec des pays amis, car, comme l'' a dit le Président de la République , les échanges, lorsqu'' ils","sont bien encadrés et bien contrôlés",", profitent au plus grand nombre. Si l'' Union européenne ne peut pas négocier de traité avec un pays comme le Canada , avec"
"343","PA405480,2017-10-21,Pupponi, François",". Quand j'' écoute certains orateurs comme M. Fesneau , je me demande s'' ils ont lu le projet de loi de finances. L'' État s''","était engagé","à ce que les FDTP – fonds départementaux de la taxe professionnelle – et les dotations de compensation de la réforme de la"
"344","PA405480,2019-11-21,Pupponi, François","le sous-amendement n° 1658 vise à préciser que l'' arrêté de carence qui s'' impose lorsque les sommes ne sont pas payées n''","est pas nécessairement pris","par la commune. Les sous-amendements n° 1654 et 1653 visent à allonger le délai au-delà duquel la parcelle sans titre de"
"345","PA721036,2019-05-09,Adam, Lénaïck",". Sage décision ! La parole est à M. Lénaïck Adam , pour soutenir l'' amendement n° 15. Les lois dites "" Grenelle "" ont","été appréciées","par beaucoup pour leur ambition de rendre à l'' environnement et au mieux-vivre une place renouvelée dans notre arsenal"
"346","PA721270,2017-11-03,Peu, Stéphane","proposition d'' Éric Coquerel est légitime. Il y a la politique de la ville, et il y a les politiques de droit commun. Cela a","été rappelé","lors des états généraux de la politique de la ville à Grigny : souvent, dans les quartiers prioritaires de la politique"
"347","PA608011,2019-05-09,Pueyo, Joaquim",", et j'' aimerais savoir où nous en sommes. La parole est à M. Joaquim Pueyo . Nous sommes nombreux à reconnaître – cela a","été rappelé","à plusieurs reprises – que la présence de trop nombreux panneaux publicitaires détériorerait les paysages et"
"348","PA332747,2019-02-07,de Rugy, François",", préalable et informé de tous les peuples indigènes affectés par le projet Montagne d'' or . Le droit à l'' information a","été respecté","et pour ce qui est de la consultation, je souhaite rencontrer le grand conseil coutumier. Au-delà, j'' aimerais que la"
"349","PA267336,2017-12-05,Giraud, Joël","définis par l'' article, mais je crains qu'' il y ait un risque en la matière. En tout état de cause, le ministre s''","est engagé","devant la représentation nationale à réunir l'' ensemble des acteurs publics du bassin minier où avait été pris le"
"350","PA717153,2017-11-13,Buzyn, Agnès","d'' euros. À cet égard, le dispositif d'' emploi accompagné, lancé à titre expérimental en 2017 dans douze régions,","sera poursuivi","en 2018. Son objectif est de faciliter l'' emploi des personnes handicapées dans le milieu ordinaire par le biais d'' un"
"351","PA266776,2019-05-15,Reiss, Frédéric","afin que les demandes d'' accompagnement émanant des collectivités territoriales et de leurs groupements","soient traitées","de la meilleure manière possible par l'' ANCT , surtout dans les zones de montagne ou les zones frontalières des"
"352","PA721976,2018-11-16,Millienne, Bruno","pas lié à l'' abattement fiscal, qui n'' a pas de logique, puisqu'' il est destiné à couvrir les frais journalistiques, qui","sont remboursés","dans la plupart des entreprises de presse. Si les journalistes avaient une grille salariale décente, ils"
"353","PA720622,2018-07-04,Bureau-Bonnard, Carole","sur la portée réelle de ce texte. Vous n'' avez pas, madame la ministre, la volonté de changer les choses. La parole","est à M. Stéphane Testé",". Madame la présidente, madame la ministre, madame la rapporteure, mes chers collègues, nous rencontrons très"
"354","PA335758,2019-05-10,Riester, Franck","incitant les jeunes à s'' engager dans les formations aux métiers d'' art et du patrimoine. C '' est tout l'' enjeu qui a","été rappelé","par l'' une de vos collègues concernant les Chantiers de France , lancé par Murielle Pénicaud , Jean-Michel Blanquer et"
"355","PA759834,2019-02-19,Nuñez, Laurent","dès l'' école primaire, et la formation des élèves de troisième aux gestes de premiers secours. Le Gouvernement s''","est engagé","sur ce point et la montée en puissance continue : 70 % des élèves de troisième seront formés au PSC1 – prévention et"
"356","PA719138,2018-11-13,Castellani, Michel","des syndicats étudiants. Mais nous prenons aussi acte des efforts accomplis, tout en sachant que ces derniers devront","être poursuivis","et amplifiés dans le futur. Je vous souhaite une bonne et agréable nuit. La parole est à Mme Danièle Hérin , pour le groupe"
"357",",2018-02-20,","une consultation. Ils comportent des propositions, rien d'' autre. Ils n'' en sont pas moins inquiétants ! Les décisions","seront prises","dans quelque temps, à l'' issue de la première phase de concertation, qui sera suivie d'' une deuxième phase relative à l''"
"358","PA335532,2019-02-05,Pau-Langevin, George","politiques spécifiques aux quartiers prioritaires cachent trop souvent le fait que les politiques de droit commun ne","sont pas respectées","et que la Seine-Saint-Denis n'' est pas traitée de la même façon que le reste du pays. Le rapport du Conseil national d''"
"359","PA722086,2019-11-26,Taquet, Adrien",", notamment au tabac et à l'' alcool, seront lancées sur l'' ensemble de l'' agglomération. De même, des initiatives","seront prises","pour améliorer le dépistage, le repérage, le diagnostic et la prise en charge des principales pathologies, tout"
"360","PA720386,2018-04-10,Di Filippo, Fabien","dans le sens de nos collègues en considérant que cette pratique n'' est pas acceptable. Mais même si la question doit","être traitée","dans le cadre du code de la consommation, elle soulève un point du débat sur le passage d'' une entreprise publique à une"
"361","PA1872,2019-07-02,Le Drian, Jean-Yves","de la France à défendre, y compris devant la Cour de justice européenne , si nécessaire, cette réalité, dont le principe","est inscrit","dans les traités. Croyez en cette détermination, mais aussi en la volonté du Gouvernement de faire en sorte que le"
"362","PA721608,2017-12-04,Bourlanges, Jean-Louis","déposés à la dernière minute... Trente-six ! ...vont créer au moins trente articles nouveaux qui n'' auront pas","été examinés","en commission, et dont nous débattrons dans la plus grande improvisation. Ce n'' est pas satisfaisant. Ce n'' est pas"
"363","PA607846,2020-07-21,Darmanin, Gérald","dis mosquée faute de mieux. Une visite domiciliaire a eu lieu le 15 janvier 2019 et l'' arrêté ministériel d'' expulsion a","été pris","le 12 juillet 2019. On observe une parfaite complémentarité entre les services dans le cadre de la loi que vous avez"
"364","PA606171,2017-08-09,Ferrand, Richard","le Premier ministre , depuis plus de quarante-cinq jours maintenant, les députés du groupe La République en marche ont","été élus","par les Français... Les autres aussi ! ...pour que se concrétisent les engagements pris par le Président de la"
"365","PA720614,2018-06-07,Le Pen, Marine","! C '' est malheureux, parce que je crois que vous avez pourtant fréquenté la 17e chambre. Or des journalistes y","sont condamnés","presque chaque jour, pour diffamation. Ce n'' est pas la même chose ! Cela signifie que, tous les jours, des magistrats"
"366","PA267336,2017-10-18,Giraud, Joël","ne l'' aurais pas toléré ! Par-delà cette plaisanterie, il importe que le FCTVA et la fraction de TVA affectée aux régions","soient exclus","de cette enveloppe normée. Je précise à Mme Louwagie que l'' amendement qu'' elle a déposé concerne uniquement la"
"367","PA643205,2018-11-13,Lang, Anne-Christine","l'' accès à l'' université : nous ne nous contentons pas de quelques mesures cosmétiques ; nous refusons l'' immobilisme et","sommes engagés","pour une transformation profonde de notre système éducatif et pour l'' égalité des chances, qui reste la première des"
"368","PA267440,2020-05-20,Diard, Éric",", et je vous demande de ne pas vous retrancher derrière la commission d'' enquête, d'' autant que votre responsabilité n''","est nullement engagée",". Reprenons l'' historique. En 2011, il y avait 800 millions de masques chirurgicaux et 600 millions masques FFP2 en"
"369","PA717153,2017-11-28,Buzyn, Agnès","à celui qui a été présenté par M. Taquet . Quel est l'' avis du Gouvernement ? Monsieur Lurton , vous avez raison : nous nous","étions engagés","et nous avons travaillé. Votre amendement propose une nouvelle modification de la fiscalité applicable aux"
"370","PA721270,2018-10-03,Peu, Stéphane","et de vivre dignement, est aujourd''hui au premier rang des préoccupations de nos concitoyens. Il suffit d'' avoir","été élu","local ou d'' être un député ancré localement pour savoir que, sur dix demandes de rendez - vous adressées par les"
"371","PA719930,2018-06-14,Vallaud, Boris","cet article 7, et c'' est pour cela que nous en demandons la suppression. Tout d'' abord, comparaison n'' est pas raison. Il a","été rappelé","ce matin que l'' on compte 1,5 million d'' apprentis en Allemagne . En France , on ne compte certes que 400 000 apprentis,"
"372","PA672,2018-03-21,Bridey, Jean-Jacques",", de variations, de primes. Il faut simplifier tout cela : c'' est très difficile mais le ministère des armées s'' y","est engagé",". Je laisserai Mme la ministre nous préciser ces objectifs mais je pense que ce volet est très important. Nous élaborons"
"373","PA1874,2017-12-20,Le Fur, Marc","évolution, mais c'' est ainsi qu'' on prévoit d'' utiliser, plus tard, le village olympique et le village médias. La parole","est à M. Stéphane Testé",". L'' organisation des Jeux olympiques et paralympiques de 2024 et les travaux nécessaires à la rénovation ou à la"
"374","PA721872,2019-12-18,Poirson, Brune","raison de l'' aspect limitatif de ces amendements. Quel est l'' avis du Gouvernement ? Avis défavorable. Lorsque ce texte","est sorti","du Sénat , il y était effectivement prévu un fonds de réemploi, de réutilisation, de réparation. C'' était un point"
"375",",2018-03-22,","nous faut admettre que nous ne sommes pas encore arrivés à cette échéance, rien n'' empêche dans ce texte, si la décision","était prise",", d'' en construire deux. La parole est à M. Bastien Lachaud . La question du deuxième porte-avions est importante pour"
"376","PA588884,2020-02-18,Autain, Clémentine",", étant identiques. Je vous renouvelle ma question : quelles seront les règles du débat ? Nous souhaitons en effet que","soit respectée","une égalité de traitement entre les différents groupes d'' opposition. Toute rupture d'' égalité entre ces groupes"
"377","PA720512,2017-07-11,Pietraszewski, Laurent","des dispositions d'' ordre légal. Dès lors que l'' élargissement de cette méthode est le nouveau champ ayant vocation à","être traité","dans le cadre de la concertation actuellement menée avec les partenaires sociaux, cette commission n'' a plus lieu d''"
"378","PA266808,2018-06-12,Rolland, Vincent","particulière du compte personnel de formation destinée à la transition professionnelle. Dans ce cadre, la personne","est accompagnée","dans son projet professionnel, et une prise en charge de la rémunération, au-delà des frais pédagogiques, est"
"379","PA267233,2019-12-12,Bouillon, Christophe","en temps de guerre, définition inscrite dans le statut de Rome qui régit la Cour pénale internationale . Si ce crime","est reconnu","en temps de guerre, pourquoi ne l'' est - il pas en temps de paix ? C '' est ici que se justifie la reconnaissance du crime d''"
"380","PA342415,2017-10-03,Battistel, Marie-Noëlle","primaire des énergies fossiles à l'' horizon 2040. À ce jour, seule une diminution de 30 % de la consommation en 2030","est inscrite",". Cela va dans le même sens que la réduction de la dépendance aux importations. Quel est l'' avis de la commission ? Cet"
"381","PA719608,2019-03-14,Ménard, Emmanuelle","le ministre, vous avez annoncé que toutes les options sont sur la table, que rien n'' est encore tranché et que la décision","sera prise","dans les prochains mois. Comment peut -on demander à la représentation nationale de voter un principe sans qu'' elle en"
"382","PA643134,2019-03-21,Valentin, Isabelle","médical. Plusieurs projets d'' expérimentation, parfois souhaités par des ARS dans des zones sous-denses,","sont aujourd''hui bloqués","car l'' opticien ne peut utiliser ces matériels. La parole est à M. Francis Vercamer , pour soutenir l'' amendement n° 633."
"383","PA942,2018-11-16,de Courson, Charles","de François Pupponi relève du bon sens. Il ne faut pas donner le sentiment à certains de nos concitoyens qu'' ils ont","été trompés",": ils se sont engagés dans un processus d'' accession à la propriété et, brutalement, on change la règle du jeu. Qu'' on la"
"384","PA267336,2017-10-21,Giraud, Joël","important de la construction du Charles de Gaulle Express . Quel est l'' avis de la commission ? Cet amendement n'' a pas pu","être examiné","en commission car il a été déposé un peu tardivement. Je donnerai donc un avis de sagesse. Il serait intéressant que le"
"385","PA695100,2017-07-06,Habib, Meyer","quelques jours le triste anniversaire de l'' attentat du 14 juillet dernier à Nice . Quatre-vingt-quatre personnes ont","été tuées, massacrées",". La première des libertés publiques, monsieur Tourret , c'' est de vivre ! Aujourd''hui, des gens se servent de nos lois et"
"386","PA266797,2019-05-27,Gosselin, Philippe",", et à juste titre. Cependant, il convient de distinguer la situation des groupes politiques, dont l'' existence","est reconnue","par la Constitution , et celle des non inscrits. J'' entends bien que certains députés non inscrits ne le sont pas"
"387","PA672,2018-03-21,Bridey, Jean-Jacques","je voulais dire, mes chers collègues, est que nous avons procédé à de nombreuses auditions – car les vingt-six qui ont","été évoquées ont été précédées","et suivies d'' autres. Je me souviens en particulier de celle du directeur des applications militaires du Commissariat"
"388","PA345619,2018-10-16,Philippe, Édouard","et des engagements ont été pris devant les Français . Ils ont été pris au moment de l'' élection présidentielle et ils ont","été rappelés","au moment de l'' élection législative. Les Français ont voté et ils ont donné une majorité à ce gouvernement."
"389","PA335612,2020-04-21,Lecoq, Jean-Paul","la constitution de chaînes de transmission du virus. Outre la garantie que les gestes barrières pourront bien","être respectés","aux abords et à l'' intérieur des écoles, nos collègues interrogent le Gouvernement sur l'' accès de tous aux masques de"
"390","PA718944,2020-01-07,Racon-Bouzon, Cathy","fléau ? Ne pensez -vous pas que cette infestation constitue un véritable problème de santé publique et qu'' elle devrait","être traitée","en tant que telle ? La parole est à M. le ministre. Madame la députée, je salue votre investissement sur cette question"
"391","PA721210,2020-06-09,Corbière, Alexis","hier, montre que cette attitude était fausse. En votre qualité de donneur d'' ordre numéro un, votre responsabilité","est directement engagée","et vous devez des explications à la représentation nationale. Pourquoi l'' IGPN , l'' Inspection générale de la police"
"392","PA719242,2018-05-26,Moreau, Jean-Baptiste","systématique avant le débat, cette stigmatisation a radicalisé une partie de la population. Ces questions doivent","être traitées","avec prudence. Je sais que Stéphane Le Foll , en son temps, et Stéphane Travert aujourd''hui discutent avec les"
"393","PA759830,2019-06-18,Wargon, Emmanuelle","ce cadre, nous avons choisi de porter la part du nucléaire à 50 % de notre production électrique en 2050 : cet objectif a","été inscrit","dans la loi relative à la transition énergétique pour la croissance verte. Parallèlement, nous avons choisi de fermer"
"394","PA720692,2017-07-26,Roussel, Fabien",", depuis 1983 et cette époque - là, la porosité entre les milieux d'' affaires financiers et la haute fonction publique","est reconnue",". Je dirais même que depuis lors, les vannes sont ouvertes. Je ne donnerai pas de nouvel exemple, car nous en avons cité à"
"395","PA405480,2019-12-17,Pupponi, François","du Gouvernement , pour rendre possibles les régularisations a posteriori jusqu'' en 2020. La seule conséquence, c''","est que les intercommunalités attaquées","en justice pourront pénaliser leurs communes les plus pauvres. La version adoptée en première lecture à l'' Assemblée"
"396","PA609245,2018-04-03,Lacroute, Valérie","pour la sécurité. Nous constatons également un échec de la prévention. Concernant le tabac et l'' alcool, le message","est compris","par le plus grand nombre. La consommation chez les mineurs est en recul, ce qui n'' est pas le cas pour le cannabis. On"
"397","PA720468,2019-11-07,Chenu, Sébastien","le décret de 1996 interdisant l'' utilisation de l'' amiante contiennent ce matériau, et seuls 2 % des déchets amiantés","sont traités","chaque année. Les risques sont toujours aussi présents : un rapport de l'' Institut de veille sanitaire prévoit d''"
"398","PA721564,2018-04-19,Fajgeles, Élise","sera jamais placé en procédure accélérée faute d'' avoir été inscrit suffisamment tôt en préfecture. Ce motif légitime","est bien entendu accepté",", rien de plus normal : comment imaginer qu'' une préfecture puisse décider de la procédure accélérée du fait de l''"
"399","PA642935,2017-10-18,Becht, Olivier","ont été acceptées démocratiquement par le peuple français. Je rappelle que le plafonnement à 3 % du déficit public a","été fixé par le traité","de Maastricht , validé démocratiquement par référendum. Il y a vingt-cinq ans ! Quant au TSCG signé en 2012, il a été"
"400","PA721960,2019-02-14,Obono, Danièle","à fait comparable à l'' enceinte de l'' Assemblée nationale . Les élèves doivent s'' y sentir en sécurité, non parce qu'' ils","sont fouillés","ou contrôlés par des caméras, mais parce qu'' ils y trouvent une présence humaine qui les rassure et leur garantit un"
"401",",2018-08-01,","le chiffre que certains de nos opposants ont donné à tous les médias –, il répond que c'' est faux : le premier euro n'' a pas","été engagé",". Ça a baissé à cause de l'' austérité ! Il s'' agit d'' une déclaration d'' intention des partis politiques et non du"
"402","PA721824,2017-10-21,Renson, Hugues","du projet de loi logement avec le ministre et le secrétaire d'' Etat compétents, monsieur le député. Plusieurs orateurs","sont inscrits","sur l'' article. La parole est à M. Vincent Descoeur . Alors que la transition énergétique est une priorité"
"403","PA719608,2020-03-21,Ménard, Emmanuelle","contre le Covid-19 . Elles ont besoin du civisme de tous ; aidons - les à faire appliquer les règles. Si cet amendement","était accepté",", nous ferions un pas dans la bonne direction, même si j'' aurais préféré une mesure nationale contraignante plus"
"404","PA718850,2018-06-21,Cordier, Pierre","courrier ou en porte-à-porte. Ah bon ? Nous en avons parlé en commission. Ce parallèle me paraît vraiment hasardeux : je","suis élu","comme vous d'' un département mi-rural mi-urbain, et personne ne s'' est jamais plaint à moi de cela. Pas étonnant ! Voilà"
"405",",2017-07-27,","au législateur que nous sommes de voter cet article. La parole est à Mme la garde des sceaux. C '' est exactement ce qui","est inscrit","dans l'' article du projet de loi, qui précise bien qu'' il s'' agit d'' une défaillance avérée du marché et que c'' est après l''"
"406","PA415452,2020-02-11,Guillaume, Didier","et des relations avec les collectivités territoriales, et que vous soutenez, madame la députée. La situation a déjà","été prise","en compte, et le ministère a mis en place des stages tutorés de dix-huit semaines en cinquième année d'' école"
"407","PA720422,2018-07-25,Quatennens, Adrien","de santé publique, et il paraît important que cette promesse de campagne, figurant dans le programme présidentiel,","soit respectée",". Très bien ! Quel est l'' avis de la commission ? Vous dénoncez le caractère trop restrictif des conditions d''"
"408","PA906,2018-06-13,Collomb, Gérard","un cadre de rigueur, ... Bravo ! ...la féminisation du cadre des sapeurs-pompiers volontaires – trop peu de femmes","sont engagées","actuellement – et le développement de la formation, qui est un point essentiel. Par ailleurs, nous travaillons avec"
"409","PA720298,2017-10-26,Cariou, Émilie","sens de M. le secrétaire d'' État : en loi de finances, nous avons réintégré dans les ZRR les communes qui, à notre sens, en","étaient sorties","à tort à la suite de l'' élaboration de nouvelles modalités de calcul. Voilà qui nous laisse le temps de mieux réfléchir à"
"410","PA721410,2019-06-13,Bonnivard, Émilie","confirmé les engagements de la France s'' agissant de la réalisation de la partie transfrontalière du tunnel et de vous","être aussi engagée","sur la réalisation et le phasage des accès. Nous sommes satisfaits que la Commission européenne ait confirmé la hausse"
"411","PA721426,2020-05-26,Riotton, Véronique","de handicap d'' accéder à l'' emploi et d'' être accompagnées dans leur projet professionnel. Ces établissements se","sont remarquablement engagés","dans la gestion de la crise et ont été largement mobilisés, par exemple dans la production de masques, comme l'' atelier"
