"","Reference","Left","KWIC","Right"
"1","PA720746,2019-09-24,Waserman, Sylvain","très important de laisser tout le monde s'' exprimer. Toutefois, chaque minute des interventions des orateurs non","inscrits est prise","sur le temps des autres. C '' est pourquoi, je suis contraint de faire appliquer la règle très stricte qui limite votre"
"2","PA609332,2018-07-17,Faure, Olivier","députés auront été nommés par leur parti, d'' autres par leur président. Quel est l'' intérêt d'' un Parlement où tous ceux","qui seront élus","seront soumis ? C '' est la raison pour laquelle les amendements de François Ruffin ont toute leur pertinence. Je voterai"
"3","PA748954,2018-12-11,Savignat, Antoine","l'' écoute. S '' ils ont été écoutés, ils n'' ont pas été entendus. Surtout, comme Mme Untermaier l'' a souligné avant moi, si","nous sommes ravis que vous ayez écouté","le CNB et la Conférence des bâtonniers , il est en revanche dommage que vous n'' ayez pas écouté les députés de l''"
"4","PA720138,2020-06-02,Saint-Paul, Laetitia","débattions ensemble ultérieurement. Nous avons terminé les questions au Gouvernement . La séance est suspendue. La","séance est reprise",". En application des articles LO 176 et LO 179 du code électoral, le président a reçu une communication du ministre de l''"
"5","PA605991,2020-05-15,Genevard, Annie","seront prises pour plus tard. Si un délai expirant le 16 juin, ce n'' est pas une urgence... La séance est suspendue. La","séance est reprise",". Je suis saisie de quatre amendements identiques, n° 60, 250, 305 et 306. La parole est à M. Antoine Savignat , pour"
"6","PA342601,2019-02-18,Brindeau, Pascal","l'' année 2018. Même si ce bilan est provisoire, il est encourageant. Mais, à ce propos, monsieur le ministre, comme cela","a été rappelé","tout à l'' heure, la question qui nous est posée aujourd''hui est celle de la ratification du CETA , prévue pour l'' automne"
"7","PA2960,2018-06-05,Woerth, Éric","pour contacter la personne qui se porte caution et pour discuter avec elle. Aujourd''hui , si le délai de quinze jours n","'' est pas respecté",", la responsabilité du garant est annulée, à la fois pour les pénalités et pour les intérêts. Il semblerait donc logique"
"8","PA719830,2018-12-06,Démoulin, Nicolas","être salué. La majorité y est extrêmement attachée. Le rôle des plateformes doit être encadré et les appels frauduleux","doivent être bloqués et pénalisés",", mais nous devons aussi préserver nos emplois. C '' est le double objectif qu'' il faut viser à travers nos débats."
"9","PA720746,2017-10-25,Waserman, Sylvain","2050. Nous devons réviser notre modèle. Nous avons terminé les questions au Gouvernement . La séance est suspendue. La","séance est reprise",". L'' ordre du jour appelle la suite de la discussion du projet de loi de financement de la Sécurité sociale pour 2018 (n°"
"10","PA722038,2018-11-07,Adam, Damien","temps plein, dont huit instructeurs, ce qui est considérable au regard des sommes en jeu. Les territoires les plus","fragiles seront désormais accompagnés","par l'' État , par l'' intermédiaire de l'' Agence nationale de la cohésion des territoires , qui aura pour mission de"
"11","PA642847,2017-11-29,Bazin, Thibault","? Les programmes spécifiques de prévention sanitaire et sociale, particulièrement importants dans ces métiers",", seront - ils poursuivis","? Qu'' adviendra -t - il des réserves des régimes de retraite complémentaire des indépendants, qui s'' élèvent à 17"
"12","PA719882,2019-06-27,Meynier-Millefert, Marjolaine","peu la situation. Un parlementaire représente déjà tous les citoyens de sa circonscription : sa parole a un poids et ses","arguments seront donc écoutés",". En conséquence, il est intéressant que cette instance puisse être saisie d'' une manière automatique pour porter des"
"13","PA677483,2019-06-20,Mazars, Stéphane","de 41,3 millions d'' euros. Sur le plan de l'' éducation, un rectorat de plein exercice existera d'' ici à deux ans et 500","personnels seront recrutés","sur cinq ans. La liste de ces mesures n'' est bien évidemment pas exhaustive. À ce bilan quantitatif, on peut d'' ores et"
"14","PA720468,2019-03-26,Chenu, Sébastien",", que vous avez majoritairement soutenus, nous trouvons dans nos assiettes des aliments produits dans des conditions","qui seraient interdites","à nos agriculteurs car elles ne respectent pas les normes qui s'' appliquent chez nous. Les traités de libre-échange –"
"15","PA332747,2019-01-24,de Rugy, François","'' amendement n° 272. Il s'' agit de remplacer l'' article d'' habilitation par des mesures qui, si cet amendement est adopté",", seront directement inscrites","dans le projet de loi. Ces dispositions ont pour objet de faciliter l'' exercice de la police administrative. Quel est l''"
"16","PA608695,2018-07-13,Untermaier, Cécile","Vous êtes en effet confrontés à une obligation de compromis et le Sénat vous attend : il ne souhaite évidemment pas que le","texte soit trop engagé",". J'' aborde cette question avec beaucoup d'' humilité. J '' ai écouté les intellectuels, les constitutionnalistes et les"
"17","PA2529,2017-07-24,Reitzer, Jean-Luc",", mais de la nation tout entière ! Un député de la nation est ancré dans son territoire ! Chers collègues , comment pensez -","vous être réélus","dans cinq ans ? Le peuple, c'' est le peuple ! Pas le peuple d'' une circonscription ! Mme la garde des sceaux seule a la parole"
"18","PA267780,2019-11-07,Firmin Le Bodo, Agnès","HAS a émis un avis favorable, que comptez - vous faire pour permettre, le plus rapidement possible, aux jeunes garçons d","'' être vaccinés","? J '' ai une deuxième question, qui concerne la Dépakine . Vous menez une action volontariste pour accompagner les"
"19","PA720386,2018-04-18,Di Filippo, Fabien","ni par un chef de groupe, et cela fonctionne très bien. Quel est le rapport avec l'' amendement ? Nous ne craignons pas d","'' être sanctionnés","ou exclus, de nous retrouver autoentrepreneurs ou non inscrits. J'' apprécie beaucoup le fonctionnement de ce groupe,"
"20","PA345722,2018-06-07,Le Grip, Constance","et concret, comprenant un plan d'' action avec des engagements très précis, qui serait trop long à détailler ici.","Il est prévu un suivi","des progrès accomplis d'' ici à fin juillet 2018, pour des effets mesurables dès octobre 2018, la Commission européenne"
"21","PA345619,2018-10-16,Philippe, Édouard",", madame la députée, nous ne changeons pas de cap. Le cap a été tracé par le Président de la République et des engagements","ont été pris","devant les Français . Ils ont été pris au moment de l'' élection présidentielle et ils ont été rappelés au moment de l''"
"22","PA719072,2019-03-22,Mesnier, Thomas","de soins de suite et de rééducation. A également été évoquée la possibilité qui sera offerte au patient, après qu'' il","a été opéré","dans un hôpital plus spécialisé, de finir sa convalescence dans l'' hôpital de proximité le plus proche de chez lui, ce"
"23","PA721678,2019-11-21,Reda, Robin",". Ce serait en outre un symbole fort pour les maires, leurs administrés et les auteurs de ce genre de délits, qui","doivent être désormais sérieusement poursuivis et punis",", que de renforcer de manière significative dès l'' examen du projet de loi relatif à l'' engagement dans la vie locale et à"
"24","PA722390,2019-06-20,Corneloup, Josiane","familiaux ne sont pas couverts par le droit à l'' assurance chômage. Cela signifie que, si la personne accueillie décède","ou est hospitalisée","pour une longue durée, l'' accueillant perd, du jour au lendemain, toute rémunération s'' il ne retrouve pas"
"25","PA721418,2019-02-12,Mignola, Patrick",", ce sont les Français exaspérés qui voient bien que cela ne leur ressemble plus. Monsieur le Premier ministre , comment","ont été et comment seront sanctionnées","les exactions ? Comment pouvons - nous rendre aux Français l'' ordre républicain pour travailler enfin à la"
"26","PA331481,2017-11-28,Le Maire, Bruno","pas les informations demandées par l'' Union européenne sur l'' évasion fiscale et sur les moyens de lutter contre elle",", seront inscrits",", le 5 décembre prochain, à l'' occasion du conseil des ministres des finances, sur la liste européenne des États qui"
"27","PA1008,2018-06-05,David, Alain",", puisque cette infraction continuera d'' être punie de six mois d'' emprisonnement et de 7 500 euros d'' amende lorsqu''","elle est accompagnée","de voie de fait ou de menaces. Il s'' agit également d'' apporter une sanction rapide, par une procédure plus simple à"
"28","PA719608,2018-10-09,Ménard, Emmanuelle","'' il essuie de nombreuses critiques et que son utilité comme sa neutralité sont remises en cause, le CSA sera heureux que","lui soit servie","sur un plateau d'' argent une nouvelle raison d'' exister. On ne voit pourtant pas ce qui justifie encore l'' existence de"
"29","PA332747,2018-07-09,de Rugy, François",", en application de l'' article 18, alinéa 2, de la Constitution , la déclaration du Président de la République . Cette","déclaration sera suivie","d'' un débat. En ce 9 juillet, date anniversaire du jour où ici même, à Versailles , en 1789, l'' Assemblée nationale issue"
"30","PA721314,2019-11-18,Schellenberger, Raphaël","commissions : il ne peut se faire représenter que dans celles-ci. En revanche, chaque commune n'' a pas l'' assurance d","'' être représentée","dans chaque commission. Il s'' agit donc non pas d'' un mécanisme totalement libre, mais d'' un mécanisme de remplacement"
"31","PA718884,2018-05-15,Bazin-Malgras, Valérie","prévues pour une atteinte sexuelle sur un mineur de 15 ans sont trop faibles, en l'' état, face aux atrocités qui nous","ont été rappelées","par les effroyables tout autant que sordides faits divers concernant des fillettes de 11 ans. Pour aller au bout de la"
"32","PA267527,2018-11-27,Saddier, Martial","à 2,5 SMIC. Avis défavorable. La parole est à M. Martial Saddier . Monsieur le rapporteur général, la synthèse est","censée être comprise","par le plus grand nombre ; permettez - moi de vous signaler que cela semble être de moins en moins le cas. Monsieur le"
"33","PA331582,2019-10-09,Vigier, Philippe",", madame la rapporteure. Prenons un autre exemple : lorsqu'' on fixe le numerus clausus des études médicales, c","'' est bien par un arrêté conjoint","du ministre des solidarités et de la santé d'' une part, et du ministre de l'' enseignement supérieur, de la recherche et de"
"34","PA1874,2018-10-17,Le Fur, Marc","le ministre, et en particulier celui des emplois à domicile. Les familles, qui ne savent pas très bien à quelle sauce","elles seront mangées","dès le mois de janvier, attendent des réponses. Veuillez conclure. J '' aurai l'' occasion de revenir sur ce point très"
"35","PA720242,2019-06-13,Abba, Bérangère","développer avec leur réseau de canaux. Je tiens donc à me faire l'' écho de ceux qui m'' ont garanti qu'' aucune décision n","'' était prise","et que rien ne se ferait sans concertation. Quel est l'' avis du Gouvernement ? Bien que M. Potier semble perplexe, je"
"36","PA721984,2020-05-18,Latombe, Philippe",", nous savons désormais que les mécanismes d'' action du covid-19 sont similaires à ceux de ces virus. Si les recherches","avaient été poursuivies",", gageons que nous serions déjà en possession d'' antiviraux, voire du vaccin si attendu aujourd''hui. Madame la"
"37","PA642788,2019-10-25,Véran, Olivier","de 0,3 à 3,5 %, ce qui constitue déjà une avancée importante. Par ailleurs, il est prévu que les taux applicables chaque","année seront précisés par arrêté et calibrés","de manière à couvrir les besoins du fonds. Si l'' on se rend compte qu'' il y a des besoins croissants ou supérieurs, on"
"38","PA227076,2018-04-17,Gourault, Jacqueline","qui sont aujourd''hui trop disparates sur le territoire, y compris en ce qui concerne les délais d'' évaluation. L'' État s","'' est engagé","à soutenir les départements dans cette phase. Il faudra aussi faire en sorte que les aspects sanitaires de l''"
"39","PA266797,2017-07-28,Gosselin, Philippe","qui serait sur le compte du parlementaire, ni des espèces que l'' on distribuerait, des enveloppes ou je ne sais quoi. C","'' est parfaitement contrôlé , et publié","et chacun sait exactement à quoi cela sert. C '' est là un élément peut-être plus palpable du lien direct avec le"
"40","PA1874,2019-02-14,Le Fur, Marc","prévaloir pour éviter toute systématisation, voire tout abus dans l'' usage du portique. La séance est suspendue. La","séance est reprise",". La parole est à M. Stéphane Testé , premier orateur inscrit sur l'' article. L'' article 6 crée une nouvelle catégorie d''"
"41","PA267233,2019-06-14,Bouillon, Christophe","inquiétudes se sont aussi exprimées de longue date – vous en avez parlé – concernant le canal Seine-Nord Europe . Bref, c","'' est grâce aux décisions prises","auparavant que nous parvenons aujourd''hui à ce qui n'' est pas un aboutissement, mais une nouvelle étape. La parole est à"
"42","PA609590,2017-11-03,Rabault, Valérie",": pourquoi une telle exception en faveur des associations cultuelles ? Alors que certaines – pas toutes, certes","– sont suivies","de près par le ministère de l'' intérieur, comment se fait - il que le Gouvernement accepte qu'' elles ne tiennent aucune"
"43","PA721314,2019-11-13,Schellenberger, Raphaël","lancera une procédure. C '' est une forme d'' autosaisine, et c'' est bien cela le problème : l'' initiative de la procédure n","'' est plus prise","par une personne, par l'' État ou par l'' administration qui identifieraient une fraude ; elle est lancée par un"
"44","PA1012,2019-02-12,de la Verpillière, Charles","nous parlons, le harcèlement à l'' école, est à mon sens suffisamment grave pour que le législateur fixe une règle et dise","comment est sanctionnée","sa méconnaissance. C '' est pour cette raison que je vous invite à voter l'' amendement de Bernard Perrut . La parole est"
"45","PA720430,2018-12-11,Bernalicis, Ugo","ce risque ; j'' espère bien qu'' on l'' est, puisque plusieurs dizaines de suicides sont déplorés chaque année – la centaine","a été dépassée","en 2017. Il faut donc redoubler d'' efforts, madame la ministre : on ne saurait se contenter de dire qu'' au quartier"
"46","PA719210,2020-02-18,Joncour, Bruno","initiatives la France va -t - elle prendre, notamment auprès de ses partenaires européens et des Nations unies , pour","que soit engagée","une réelle et nouvelle phase de négociations entre les deux parties, afin qu'' une solution juste puisse enfin être"
"47","PA719272,2018-06-07,Meunier, Frédérique","sera désormais interdite, sauf là où elle était autorisée, alors que jusqu'' à présent elle était autorisée sauf là où","elle était interdite",". J '' en perdrais presque mon latin, tant cela devient compliqué. Le groupe Les Républicains reste sceptique sur cette"
"48","PA721270,2019-05-16,Peu, Stéphane","à œuvrer à l'' intérêt général : c'' est radicalement différent. En outre, le statut de fonctionnaire – donc le fait de ne","pas être recruté","par contrat – est aussi le moyen de protéger notre fonction publique – et la preuve est faite qu'' elle est mieux protégée,"
"49","PA906,2017-11-14,Collomb, Gérard","accompagner les mairies dans la réforme de la délivrance des cartes nationales d'' identité, la dotation pour titres","sécurisés sera doublée","et portée à 40 millions d'' euros. Le régime d'' incitation financière aux fusions de communes est reconduit jusqu'' en"
"50","PA608016,2018-09-18,Louwagie, Véronique",", mais plus particulièrement encore les frontaliers : nous avions eu l'' occasion d'' en discuter avec les députés qui","en sont élus",". Le commerce illicite de tabac représente un manque à gagner considérable, en termes de recettes, pour l'' État , les"
"51","PA335612,2019-10-30,Lecoq, Jean-Paul","sous les bombes. Cette opération turque est d'' autant plus insupportable que les forces démocratiques syriennes","qui sont attaquées sont composées","en majorité des Kurdes formant les Unités de protection du peuple – les YPG . Ces femmes et ces hommes sont nos alliés : ils"
"52",",2019-04-29,",", pour toutes les femmes. Je ne connais personne dans cet hémicycle qui considérerait que certains ou plutôt certaines","devraient être exclues","de l'' application du droit commun. Vous savez très bien, madame la députée, qu'' il s'' agit du sens profond de mon"
"53","PA405480,2018-06-05,Pupponi, François","bien peur qu'' une majorité s'' y trouve pour détricoter largement la loi SRU et diminuer le quota de logements sociaux. Le","texte étant examiné en procédure accélérée",", il n'' y aura pas de deuxième lecture en cas de commission mixte paritaire conclusive. Pouvez - vous donc prendre l''"
"54","PA608172,2020-02-05,Pires Beaune, Christine","juillet dernier. Au cours de cette rencontre, jugée constructive par l'' ensemble des participants, des engagements","ont été pris","par l'' État et la SNCF . Je les cite : améliorer de 10 points la régularité sur la ligne ; améliorer d'' ores et déjà le confort"
"55","PA720892,2019-05-27,Panot, Mathilde","une nouvelle déclaration des droits prendrait en compte la question écologique et où, enfin, le Parlement cesserait d","'' être piétiné","par un exécutif en roue libre. Plus tôt que vous ne le pensez, le temps viendra de ce grand moment constituant, où les"
"56",",2017-10-03,","pour cheminer dans les espaces vides des mines ; on aura évidemment la possibilité de le stocker. Le gaz de","houille est définitivement interdit",". Je ne crois pas que vous ayez déposé un amendement en ce sens, mais on reviendra à cette question dans les amendements"
"57","PA718706,2019-10-03,Fontaine-Domeizel, Emmanuelle","'' une a accouché d'' un enfant, puis est décédée dans un accident de moto. Celle qui s'' est également occupée de l'' enfant en","a été dépossédée",", alors même qu'' elle l'' avait élevé et qu'' elle s'' en était occupée. Il s'' agit d'' exemples simples, que l'' on rencontre"
"58","PA606098,2019-04-29,Marleix, Olivier","micro-connectique pour les cartes à puces, a été rachetée récemment par une entreprise chinoise, Tsinghua Unigroup ,","qui est contrôlée","à 51 % par des fonds publics américains. Jamais une telle opération n'' aurait été acceptée aux États-Unis , même sous l''"
"59","PA227076,2018-02-15,Gourault, Jacqueline",""" – c'' est l'' article 12 ; à défaut, si son parcours migratoire l'' a conduit dans des pays dans lesquels ses empreintes","ont été prises",", ce que caractérise le terme de "" parcours migratoire "". En clair, les éléments en cause sont précis, et d'' ailleurs"
"60","PA721506,2019-11-12,Kuster, Brigitte",", régional, etc. – dans lequel ils assuraient l'' enseignement artistique. Vos explications signifient - elles qu''","ils seront tous payés","de la même façon, quel que soit l'' établissement artistique dans lequel ils enseignent ? Sur l'' amendement n° 2319, je"
"61","PA605518,2019-12-19,Lambert, François-Michel","de l'' ambition ; c'' est faire ce qu'' on nous demande de faire. Une décision ambitieuse aurait consisté à conserver ce","qui était inscrit","dans la loi. S '' agissant de l'' amendement dont nous discutons à présent, je constate que vous pouvez avoir de l'' ambition"
"62","PA720644,2017-11-02,Nury, Jérôme","le travail et l'' investissement ? Entre le marteau de la grande distribution et l'' enclume de la transformation,","ils sont écrasés","et broyés. Leur redonner de l'' oxygène en rééquilibrant les rapports de force dans les filières est donc une priorité."
"63","PA720386,2018-06-04,Di Filippo, Fabien",". Une fois que des critères auront été établis, ils auront force de loi et, comme beaucoup de gens les attaqueront, ils","devront être respectés","scrupuleusement, à la lettre – même si les résultats précis ne sont pas publiés, comme le veut notre chère collègue."
"64","PA268019,2018-07-10,Lagarde, Jean-Christophe","quoi des députés appartenant à certains groupes ne pourront pas suivre l'' examen des textes, mission pour laquelle ils","ont été élus",", ni émettre les propositions ou les objections ou déposer les amendements qu'' ils souhaitent. Il ne faudra pas qu'' on"
"65","PA721742,2017-11-27,Florennes, Isabelle","dans les dix ans qui viennent. Il s'' agit bien d'' un minimum, car les attentes sont fortes et les engagements pris","doivent être respectés",". En effet, une part de cette somme sera déjà apportée par le rendement de la gestion du site et son aménagement. Nous"
"66","PA722162,2020-06-18,Turquois, Nicolas","et de demain pour payer les retraites de demain. Par ailleurs, je suis très en colère au sujet des chiffres évoqués, qui","ont été repris","de nombreuses fois. Aujourd''hui, la pension minimale de référence, s'' établissant à 75 % du SMIC, est versée à 230 000"
"67","PA605036,2018-10-11,Abad, Damien","'' arrêté du 5 avril 2016 est contra legem, dans la mesure où il contredit l'' esprit de la loi. Alors que, selon la loi, nul ne","peut être exclu","du don du sang sur le fondement de son orientation sexuelle, l'' arrêté dit quasiment l'' inverse, en tout cas son objectif"
"68","PA335532,2019-02-14,Pau-Langevin, George","à comprendre l'' ordre de discussion des amendements – il aurait été plus logique que tous les amendements portant sur ce","sujet soient examinés","en même temps –, mais cela nous permet de rouvrir le débat. Lors de nos travaux, nous nous sommes rendu compte que"
"69","PA2960,2020-02-22,Woerth, Éric","pension de retraite est déjà proportionnelle à la rémunération ; le nombre de trimestres, en revanche, ne l'' est pas, et","chacun est donc traité","de la même manière. Pas du tout ! Il y a toujours eu deux critères : l'' âge et la durée de cotisation. Tout à fait ! Vous tuez la"
"70","PA719024,2019-10-25,Blanchet, Christophe","des "" mijeurs "" – ceux qui se déclarent éternellement mineurs, très nombreux notamment dans la circonscription dont","je suis élu",", à Ouistreham . Comment éviter que ce système soit dévoyé tout en assurant la protection de ceux qui sont réellement"
"71","PA267585,2018-06-11,Vercamer, Francis","de la formation professionnelle continue afin d'' établir un droit efficace à la formation des salariés. Elle","a été suivie","de bien d'' autres qui, en 2004, en 2009, en 2014, ont transformé le paysage de la formation professionnelle, à chaque"
"72",",2019-10-08,","travail des directeurs d'' école, mais le problème ne se pose pas depuis deux ans, il remonte à plusieurs décennies ! Oui,","nous sommes engagés","pour trouver une solution collectivement ! La parole est à Mme Sabine Rubin . Monsieur le ministre , je suis heureuse de"
"73","PA267801,2018-02-13,Jégo, Yves","162 amendements, dont 41 ont été adoptés. Je mets aux voix l'' ensemble du projet de loi. La séance est suspendue. La","séance est reprise",". La conférence des présidents, réunie ce matin, a proposé d'' inscrire à l'' ordre du jour du mardi 6 mars après-midi la"
"74","PA267527,2018-01-30,Saddier, Martial","et qui est le renouvellement des réseaux d'' eau, notamment dans les zones urbaines. Nous savons tous, du moins ceux","qui sont engagés","sur la question savent, et c'' est le président du comité de bassin Rhône-Méditerranée qui parle, que ce renouvellement"
"75","PA721816,2019-03-14,Boucard, Ian",", il a été inscrit dans la loi que ceux qui vendraient des jeux de hasard à des mineurs ou leur en donneraient à titre","gracieux seraient sanctionnés","par une amende. Cela résulte notamment du travail de notre collègue Christophe Blanchet . Il reste à fixer le montant de"
"76","PA719608,2020-02-22,Ménard, Emmanuelle","précédents, il vise à souligner le rôle des aidants familiaux dans la société et à affirmer la nécessité que ce","rôle soit pris","en considération par le système de retraite. Selon le collectif interassociatif des aidants familiaux, il y a dans"
"77","PA721960,2018-10-19,Obono, Danièle","à la clé. Toutefois, nous ne sommes pas contre les entreprises et nous tenons à différencier celles qui ont besoin d","'' être aidées","de celles qui auraient les moyens de contribuer à l'' effort national, mais qui ne le font pas. Les multinationales sont"
"78","PA1695,2018-07-22,Jacob, Christian","c'' est une affaire qui concerne la rive droite, c''est-à-dire Beauvau et l'' Élysée . Quant au ministre de l'' intérieur,","il est complètement bloqué , tétanisé",", car il va être examiné par une commission d'' enquête. Que le ministre de l'' intérieur soit obligé de comparaître devant"
"79","PA722236,2019-12-17,Djebbari, Jean-Baptiste","de circuler. Le Gouvernement prendra toutes les mesures nécessaires. Pourtant, vous êtes contre la réquisition !","Cela étant, vous avez compris",", monsieur le député, que le Gouvernement privilégie la voie du dialogue et du compromis, conformément aux propos de M."
"80","PA689,2019-07-02,Buffet, Marie-George","et précise que tout ajout doit être réalisé dans l'' harmonie du monument. Son article 9 prévoit que la restauration doit","impérativement être "" accompagnée","d'' une étude archéologique et historique du monument "". Cela sera -t - il prévu ? Toutes ces règles seront - elles"
