Name,Reference,Left,KWIC,Right,variant,potential_passive,verb_transitivity,complement,lemma
"PA721984,Latombe, Philippe","PA721984,2019-07-03","votre texte, vous avez dit que ce qui est interdit dans la sphère publique réelle doit aussi l'' être sur internet. Quand",vous vous faites insulter,"dans un bus, vous n'' êtes pas traité différemment selon que le bus est plus ou moins plein ! La personne victime de propos",se faire,1,transitive,0,insulter
"PA332228,Benoit, Thierry","PA332228,2019-07-03",". Alors que ceux qui pratiquent l'' élevage et ceux qui le soutiennent, comme Marc Le Fur le fait depuis tant d'' années,",se font agresser,"sur les réseaux sociaux, sans que le législateur ne puisse rien réglementer, entendre la garde des sceaux dire, dans",se faire,1,transitive,0,agresser
"PA720202,Krimi, Sonia","PA720202,2019-07-03","de jeter un petit coup d'' œil au dossier que je lui donne. Ce n'' est vraiment pas tolérable. Aucun rapport ! Moi aussi,",je me fais traiter,"de "" sale Arabe "" ! La parole est à M. Sylvain Maillard . Tout d'' abord, je veux dire à Mme la rapporteure que je connais son",se faire,1,transitive,0,traiter
"PA721210,Corbière, Alexis","PA721210,2019-07-03","que, parce qu'' on n'' est pas d'' accord avec vous, on serait insensible au fait que des Français de confession juive",se font assassiner,sur le territoire national ? C '' est indigne ! Merah et Coulibaly ont évoqué Israël ! S '' il vous plaît ! Cette manière,se faire,1,transitive,0,assassiner
"PA719608,Ménard, Emmanuelle","PA719608,2019-07-03",ou moins aisée à prendre. Le délai de vingt-quatre heures est manifestement trop court pour permettre à l'' opérateur de,se faire conseiller,"juridiquement lorsque le contenu fait partie de cette zone grise. Si ce délai était maintenu, il inciterait",se faire,1,transitive,0,conseiller
"PA719952,Mis, Jean-Michel","PA719952,2019-07-04",saisie pourrait s'' effectuer sans autorisation parentale afin de permettre aux enfants victimes de haine en ligne de,se faire aider,même si leurs parents n'' en sont pas informés. Cette proposition s'' inscrit dans la continuité logique des,se faire,1,transitive,0,aider
"PA643210,Lecornu, Sébastien","PA643210,2019-07-10","aussi des coûts dans l'' immédiat. Les communes, qui ont alors besoin d'' un accompagnement financier et juridique,",se font assister,"en ingénierie, laquelle peut faire défaut à celles qui sont rurales et de petite taille. Les services de l'' État font le",se faire,1,transitive,0,assister
"PA721202,Coquerel, Éric","PA721202,2019-07-11","' est donc de son rôle éternel de Robin des Bois inversé, qui prend aux pauvres pour donner aux riches, et aimerait en plus",se faire applaudir,pour cela. D '' autant qu'' à l'' austérité qu'' il fait subir aux plus pauvres s'' ajoute celle qu'' il impose aux collectivités,se faire,1,transitive,0,applaudir
"PA720746,Waserman, Sylvain","PA720746,2019-07-17",que nous sommes seraient incompétents ou ne sauraient pas lire des textes. C '' est l'' hôpital qui se moque de la charité !,Nous venons de nous faire insulter,"pendant deux heures ! J '' ai ici le document qui vient d'' être évoqué. Madame Batho , vous ne faites pas un rappel au",se faire,1,transitive,0,insulter
"PA720846,Lachaud, Bastien","PA720846,2019-07-18",de technologies étrangères pour le développement des nouveaux outils : parce que nous avons laissé le géant Alcatel,se faire dépecer,", par pure idéologie libérale, de sorte que nous n'' avons plus d'' entreprise française capable de construire ces",se faire,1,transitive,0,dépecer
"PA722142,Ruffin, François","PA722142,2019-09-12",la France a laissé se crasher son transport international. Elle a laissé les transporteurs internationaux français,se faire écraser,"par la concurrence. Pourquoi ? Parce qu'' au niveau européen, pour faire du transport international, un chauffeur",se faire,1,transitive,par,écraser
"PA722126,Chiche, Guillaume","PA722126,2019-09-24","accéder aux soins de suite. Des risques juridiques enfin, qui pèsent aussi sur leurs enfants, du fait de la difficulté à",se faire reconnaître,"pleinement comme mères d'' enfants nés après un recours à une PMA à l'' étranger. Ignorer tout cela, c'' est les laisser dans",se faire,1,transitive,0,reconnaître
"PA330684,Boyer, Valérie","PA330684,2019-09-27",malade ? Ce serait particulièrement choquant. J'' aimerais bien que vous discutiez par exemple avec les médecins qui,se font contrôler,et réprimander quand ils inscrivent un médicament du mauvais côté de l'' ordonnancier bizone. Comment leur,se faire,1,transitive,0,contrôler
"PA330684,Boyer, Valérie","PA330684,2019-09-27",malade ? Ce serait particulièrement choquant. J'' aimerais bien que vous discutiez par exemple avec les médecins qui,se font contrôler et réprimander,quand ils inscrivent un médicament du mauvais côté de l'' ordonnancier bizone. Comment leur expliquerez - vous que vous,se faire,1,transitive,0,réprimander
",",",2019-10-01",". Est - ce là votre vision de la démocratie ? Est - ce ainsi qu'' on porte, dans ce lieu, la voix des Français . Il ne fallait pas",se faire exclure,! Ces éléments seront communiqués à la conférence des présidents. L'' amendement n° 1468 de Mme Emmanuelle Ménard est,se faire,1,transitive,0,exclure
"PA721600,Rossi, Laurianne","PA721600,2019-10-03","en France un organe obtenu contre paiement à l'' étranger. En revanche, on ne peut pas sanctionner un Français qui",se ferait greffer,contre paiement à l'' étranger. L'' amendement vise donc à instituer une application extraterritoriale de notre code,se faire,1,transitive,0,greffer
"PA340343,Saulignac, Hervé","PA340343,2019-10-03","tous : chaque citoyen français est présumé consentant au don d'' organes, sauf à faire expressément valoir son refus en",se faisant inscrire,sur le registre national des refus ou en le couchant par écrit. Vouloir multiplier les supports comprenant cette,se faire,1,transitive,0,inscrire
"PA721600,Rossi, Laurianne","PA721600,2019-10-04",de se prémunir. Afin de protéger nos concitoyens de l'' exposition aux risques sanitaires qu'' ils encourraient en,se faisant transplanter,"à l'' étranger puis en revenant en France sans forcément recourir aux soins nécessaires, il importe de permettre à l''",se faire,1,transitive,0,transplanter
"PA268019,Lagarde, Jean-Christophe","PA268019,2019-10-07","que nos compatriotes soient contaminés par la tuberculose, transmise par des sans-papiers qui n'' auraient pas pu",se faire soigner,. C '' est d'' une telle évidence que tout le monde devrait s'' y rendre ! Il a raison sur ce point ! N '' en faites pas un totem non,se faire,1,transitive,0,soigner
"PA508,Biémouret, Gisèle","PA508,2019-10-07","de la prétendue attractivité de la France , puisque seulement 10 % des mineurs non accompagnés savent qu'' ils peuvent",se faire soigner,", alors même que 36 % d'' entre eux nécessitent des soins urgents. À l'' image des terribles témoignages de situations",se faire,1,transitive,0,soigner
"PA333421,Pancher, Bertrand","PA333421,2019-10-07","conflit mondial, ces hommes que l'' on avait tant de difficulté à intégrer furent mobilisés pour aller combattre et",se faire tuer,"au nom de notre pays. "" Alors que sa situation de famille pouvait le faire maintenir à l'' arrière, il a demandé à repartir",se faire,1,transitive,0,tuer
"PA342601,Brindeau, Pascal","PA342601,2019-10-07","il n'' est pas seulement une charge, un problème et des souffrances, mais qu'' il est aussi la vie telle qu'' elle s'' exprime.",Nous nous faisons alpaguer,"en séance, on nous reproche d'' être agressifs ou insultants, on nous dit obscurantistes, parce que nous refusons de",se faire,1,transitive,0,alpaguer
"PA345619,Philippe, Édouard","PA345619,2019-10-08",– qui s'' étaient rendus sur place à l'' invitation des organisateurs de l'' événement pour participer à une discussion,se font sortir,"manu militari, alors même qu'' ils ont engagé la discussion, sans que personne ne trouve véritablement à y redire. Je ne",se faire,1,transitive,0,sortir
"PA345619,Philippe, Édouard","PA345619,2019-10-15","dialogue et de l'' apaisement. En juin 2017, après son élection à l'' Assemblée nationale , elle réussit le tour de force de",se faire apprécier,"en quelques semaines par tous ses interlocuteurs, notamment par ses adversaires politiques. Inlassablement, elle",se faire,1,transitive,par,apprécier
"PA720590,Potterie, Benoit","PA720590,2019-10-16","consommateurs résidant en zone rurale ne seraient pas concernés, non plus que le consommateur urbain, qui pourrait",se faire livrer,dans un bureau de poste ou dans un point relais. J'' adosse à la mesure un abattement de 5 % sur la base d'' imposition de la,se faire,1,transitive,0,livrer
"PA720520,Cattelot, Anne-Laure","PA720520,2019-10-16","alerter, mes chers collègues, sur la question du suremballage, parce qu'' il ne faut pas oublier qu'' il y en a un quand on",se fait livrer,"à domicile et que la gestion de ces déchets est financée par la fiscalité, payée par des personnes physiques qui",se faire,1,transitive,0,livrer
"PA720590,Potterie, Benoit","PA720590,2019-10-16",", que ces amendements créeraient une taxe nouvelle pour le consommateur. En réalité, on lui laisse le choix : soit il",se fait livrer,"à domicile, et il est alors assujetti à la taxe sur la livraison ; soit il va chercher son colis dans un point relais. C '' est",se faire,1,transitive,0,livrer
"PA942,de Courson, Charles","PA942,2019-10-17","tardivement autorisés, coûtent, pour les moins onéreux, environ 150 euros. Non, c'' est plutôt 800 euros ! À ce tarif,",vous vous faites escroquer,", permettez - moi de vous le dire ! Il y a donc déjà des aides des régions ; et vous voulez en rajouter ? Ce n'' est pas",se faire,1,transitive,0,escroquer
"PA721158,Anglade, Pieyre-Alexandre","PA721158,2019-10-21",de projets du quotidien qui changent le visage de nos territoires. Nous pouvons d'' ailleurs regretter que la France,se fasse remarquer,"parfois par une sous-consommation des crédits européens qui lui sont alloués. Il sera donc nécessaire, à l'' avenir, de",se faire,1,transitive,0,remarquer
"PA720422,Quatennens, Adrien","PA720422,2019-10-22",leurs promesses ; mais leurs dirigeants restent les principaux bénéficiaires de la politique du Gouvernement .,Vous vous faites encore appeler,"La République en marche, mais avec vous, la République rampe . Pas mal ! En définitive, votre politique, c'' est moins de",se faire,1,transitive,0,appeler
"PA720286,Fiat, Caroline","PA720286,2019-10-22",et ont participé à certaines restructurations. Ils sont au contraire très au courant et entendent ne plus,se faire avoir,". Sur la boucle e-mail des médecins, l'' une de vos consœurs, professeur à l'' Assistance publique - Hôpitaux de Paris , l''",se faire,1,transitive,0,avoir
"PA720286,Fiat, Caroline","PA720286,2019-10-23",", mais tant pis ! Je veux bien entendre que tout le monde aime tout le monde, mais je suis désolée : quand les pompiers",se font matraquer,"dehors, si on les aime, on va les soutenir ! La parole est à M. Laurent Furst . À propos des amendements de M. Viala et de M.",se faire,1,transitive,0,matraquer
"PA719806,Auconie, Sophie","PA719806,2019-10-24",". L'' amendement n° 191 rectifié vise à compléter l'' alinéa 9 par les mots : "" ainsi que la possibilité pour le cotisant de",se faire assister,"d'' un conseil et les modalités de contestation de ladite correction "". Dès lors que l'' URSSAF procède à une correction",se faire,1,transitive,de,assister
"PA719806,Auconie, Sophie","PA719806,2019-10-24","à une correction des déclarations, il convient d'' informer le cotisant qu'' il a la possibilité de la contester et de",se faire assister,d'' un conseil. Quel est l'' avis de la commission ? Les deux amendements sont satisfaits. Demande de retrait ou avis,se faire,1,transitive,de,assister
"PA642788,Véran, Olivier","PA642788,2019-10-24","élevés de la population, c''est-à-dire que les gens préfèrent couvrir des distances importantes plutôt que d'' aller",se faire soigner,"à l'' hôpital. L'' augmentation de l'' activité étant prévue, il est normal que, pour ne pas pénaliser l'' établissement,",se faire,1,transitive,0,soigner
"PA610681,Bareigts, Ericka","PA610681,2019-10-24","en considération cet isolement qui, on le voit bien dans la réalité, amenuise les chances ou les possibilités de",se faire soigner,". Quel est l'' avis de la commission ? Nous avons eu ce débat en commission. Votre amendement est satisfait, madame",se faire,1,transitive,0,soigner
"PA642788,Véran, Olivier","PA642788,2019-10-24","et en séance publique, un amendement qui a été retoqué par l'' article 45 – comme quoi on peut être rapporteur général et",se faire piéger,! Il visait à permettre à un usager du médicament de participer aux négociations entre le CEPS et l'' industrie,se faire,1,transitive,0,piéger
"PA334768,Touraine, Jean-Louis","PA334768,2019-10-25",dans la lutte contre le tabac alors que nous l'' acceptons dans la vaccination ? Nous venons d'' étendre la possibilité de,se faire vacciner,"en pharmacie, simplification bénéfique que nous pourrions étendre à la lutte contre le tabac. Si une personne qui veut",se faire,1,transitive,0,vacciner
"PA717153,Buzyn, Agnès","PA717153,2019-10-25",avez avancé la raison précise pour laquelle je ne suis pas favorable à cette extension. Il faut une prescription pour,se faire vacciner,"contre la grippe en pharmacie ; certes, elle n'' est pas individuelle, mais concerne des groupes cibles, auxquels l''",se faire,1,transitive,0,vacciner
"PA508,Biémouret, Gisèle","PA508,2019-10-25","17 octobre, lors de son audition par la commission d'' enquête sur l'' utilisation du chlordécone, ils auront du mal à",se faire indemniser,". En effet, le lien de causalité entre l'' exposition au chlordécone et la pathologie n'' est pas formellement établi par",se faire,1,transitive,0,indemniser
"PA720286,Fiat, Caroline","PA720286,2019-10-25",de l'' Assemblée nationale . Très bien ! C '' est une bonne décision ! On est seulement trente dans l'' hémicycle ! On va,se faire laminer,! La parole est à Mme Gisèle Biémouret . Nous saluons bien entendu la continuation et l'' amélioration du dispositif qui,se faire,1,transitive,0,laminer
"PA721860,Cesarini, Jean-François","PA721860,2019-10-28","certains territoires des règles pour pouvoir expérimenter. Dans ma circonscription, des viticulteurs nature et bio",se font attaquer,par les voisins qui leur reprochent d'' être hors la loi parce qu'' ils ne sulfatent pas assez ! C '' est dans de tels cas qu'' il,se faire,1,transitive,par,attaquer
"PA720430,Bernalicis, Ugo","PA720430,2019-11-05",on a fait en sorte qu'' il ne soit pas possible de retirer de l'' argent liquide avec cette carte. Je ne doute pas que certains,se fassent racketter,". Néanmoins, ne s'' agit - il pas d'' une fausse bonne idée que de contraindre à payer uniquement en carte bleue un demandeur",se faire,1,transitive,0,racketter
"PA610681,Bareigts, Ericka","PA610681,2019-11-06","aide versée aux familles pour le retour du corps d'' un défunt. Il arrive en effet qu'' un être cher, enfant ou parent, parte",se faire soigner,"dans l'' Hexagone et y décède. Dans ces situations douloureuses, personne ne prend le retour en charge, sinon, le cas",se faire,1,transitive,0,soigner
"PA642764,Aviragnet, Joël","PA642764,2019-11-07",quitté leur pays pour des raisons de santé. L'' idée selon laquelle l'' AME attire un flux important de migrants venant,se faire soigner,en France ne résiste pas à l'' épreuve des faits : toutes les enquêtes disponibles montrent que la santé est un motif de,se faire,1,transitive,0,soigner
"PA642764,Aviragnet, Joël","PA642764,2019-11-07",Europe en accueillant des centaines de milliers de réfugiés. Pensez - vous qu'' il faille sombrer dans l'' indignité pour,se faire réélire,en 2022 ? Où sont passées nos valeurs communes ? Le droit à la protection de la santé est un principe constitutionnel ;,se faire,1,transitive,0,réélire
"PA642764,Aviragnet, Joël","PA642764,2019-11-07",% en trois ans dans la population migrante. Est - ce souhaitable pour la France ? Pensez - vous que cela ait aidé M. Rajoy à,se faire réélire,"? Au contraire, l'' émergence de Vox , un parti néo-franquiste, en est le terrible résultat. L'' AME permet à des personnes",se faire,1,transitive,0,réélire
"PA717153,Buzyn, Agnès","PA717153,2019-11-07","la fraude et les abus, qui ne sont d'' ailleurs pas nécessairement le fait de personnes migrantes, certains venant",se faire soigner,"en France avant de repartir chez eux. En l'' espèce, nous parlons de l'' AME , dont les personnes en situation irrégulière",se faire,1,transitive,0,soigner
"PA717153,Buzyn, Agnès","PA717153,2019-11-07","retourneront ensuite dans leur pays. Ce n'' est donc pas des migrants que l'' on parle, mais bien de personnes qui viennent",se faire soigner,en France en dévoyant un système auquel nous sommes tous profondément attachés. Nous devons le refuser. Vous,se faire,1,transitive,0,soigner
"PA717153,Buzyn, Agnès","PA717153,2019-11-07","les personnes qui font des allers-retours entre le pays où ils vivent et la France , où ils viennent simplement",se faire soigner,". Il n'' y aura aucune différence avec la situation actuelle. Enfin, un aveu ! Votre amendement ne sert donc à rien ! Ça ne",se faire,1,transitive,0,soigner
"PA720286,Fiat, Caroline","PA720286,2019-11-07",", madame la ministre, il peut effectivement arriver que des princes du Qatar ou des chercheurs en Suisse viennent",se faire soigner,en France et profitent de l'' AME. Que font les consulats ? Pourquoi ne vont -ils pas chercher l'' argent dans les consulats,se faire,1,transitive,0,soigner
"PA717153,Buzyn, Agnès","PA717153,2019-11-07",à l'' expiration du visa. Il s'' agit de viser une population dont on sait qu'' elle vient sous couvert de tourisme pour,se faire soigner,". L'' objectif est clairement d'' éviter ces abus, ce dévoiement du dispositif actuel. Cela ne changera rien pour ceux qui",se faire,1,transitive,0,soigner
"PA719138,Castellani, Michel","PA719138,2019-11-07","doute des abus et des fraudes existent -ils, mais ce qui est certain, c'' est que les gens bien portants ne cherchent pas à",se faire soigner,. Je sais que tous les pays du Nord sont soumis à une pression migratoire considérable et que nous devons la gérer nolens,se faire,1,transitive,0,soigner
"PA608016,Louwagie, Véronique","PA608016,2019-11-07",soins pour les étrangers. Elle envoie un signal nécessaire à toutes les personnes qui souhaitent venir en France pour,se faire soigner,"gratuitement, ce qui, je l'' espère, contribuera à réduire le tourisme médical. La commission ne s'' étant pas prononcée",se faire,1,transitive,0,soigner
"PA720892,Panot, Mathilde","PA720892,2019-11-12",un processus démocratique qui recrée de la confiance dans cette démocratie qu'' il nous faut protéger. La population,se fait massacrer,! Nous voulons que de nouvelles élections se tiennent le plus rapidement possible. L'' Union européenne enverra bien,se faire,1,transitive,0,massacrer
"PA609590,Rabault, Valérie","PA609590,2019-11-13",du déficit de la France n'' intéresse plus grand monde. Les taux négatifs conduisent à une situation dans laquelle on,se fait payer,"pour emprunter ! Mais gouverner, monsieur le ministre, c'' est aussi prévoir. En cas de retournement des taux, ce qui",se faire,1,transitive,0,payer
"PA332523,Dalloz, Marie-Christine","PA332523,2019-11-13",". En outre, il est proposé de préciser que le président de la commission peut, à l'' occasion d'' une réunion, choisir de",se faire représenter,"soit par un adjoint – un autre membre élu de la collectivité –, soit par un agent de la collectivité qu'' il aura choisi pour",se faire,1,transitive,par,représenter
"PA607846,Darmanin, Gérald","PA607846,2019-11-13","de tabac "" à la papa "", si je puis dire – par exemple, ceux qui passent la frontière en possession de quinze cartouches et",se font arrêter,"par les douaniers. En revanche, elle ne voudrait pas nous donner les moyens juridiques de contrôler ceux qui vendent du",se faire,1,transitive,par,arrêter
"PA719608,Ménard, Emmanuelle","PA719608,2019-11-18","que le maire d'' une commune, élu au suffrage universel direct, voie son concurrent – ou adversaire – battu",se faire élire,à la tête de l'' EPCI uniquement par le biais du copinage. Je maintiens ce dernier terme car les maires peuvent constituer,se faire,1,transitive,0,élire
"PA266776,Reiss, Frédéric","PA266776,2019-11-18",". La parole est à M. Frédéric Reiss , pour soutenir l'' amendement n° 212. Il est en effet est naturel qu'' un maire puisse",se faire représenter,à la conférence des maires par l'' un de ses adjoints. Une remarque sur le caractère obligatoire de la conférence des,se faire,1,transitive,par,représenter
"PA643210,Lecornu, Sébastien","PA643210,2019-11-18",et ceux qui ont imaginé les conseils des maires. Nous devons être pragmatiques : si on souhaite que le maire puisse,se faire représenter,"par un adjoint ou un conseiller municipal, il suffit de ne rien inscrire dans la loi, car alors elle le permet. Le pacte de",se faire,1,transitive,par,représenter
"PA267429,Cinieri, Dino","PA267429,2019-11-18","! La parole est à M. Dino Cinieri , pour soutenir l'' amendement n° 90. Cet amendement vise à permettre au maire de",se faire représenter,par l'' un de ses adjoints lors des réunions de la conférence des maires de l'' intercommunalité. Quel est l'' avis de la,se faire,1,transitive,par,représenter
"PA721314,Schellenberger, Raphaël","PA721314,2019-11-18","adopter, nous parlons de la possibilité offerte au maire, notamment lorsqu'' il est seul conseiller communautaire, de",se faire remplacer,"dans la commission dans laquelle il siège, s'' il est empêché. Imaginons un conseil de communauté de 130 membres doté de",se faire,1,transitive,0,remplacer
"PA721314,Schellenberger, Raphaël","PA721314,2019-11-18",130 membres doté de plusieurs commissions. Un conseiller communautaire siège dans une ou deux commissions : il ne peut,se faire représenter,"que dans celles-ci. En revanche, chaque commune n'' a pas l'' assurance d'' être représentée dans chaque commission. Il s''",se faire,1,transitive,0,remplacer
"PA718850,Cordier, Pierre","PA718850,2019-11-19","considération les intempéries, permettre aux élus de discuter à distance ? Mais sur quelle planète vivez - vous ? On va",se faire lyncher,"! Et puis, monsieur Lecornu , je sais que vous assumez de représenter la droite décomplexée, mais vous comparez des",se faire,1,transitive,0,lyncher
"PA643210,Lecornu, Sébastien","PA643210,2019-11-20",même si nous passons notre temps à imaginer des correctifs à ce principe parce que nous avons peur qu'' une commune rurale,se fasse écraser,"par la commune centre... Ah non, pas vous ! Pas moi, madame Genevard , nous tous ! Ce n'' est pas un argument que je fais mien,",se faire,1,transitive,par,écraser
"PA608172,Pires Beaune, Christine","PA608172,2019-11-21","commune et étant devenu conseiller municipal – sans être maire, sa liste n'' étant pas majoritaire – pourrait en effet",se faire élire,au conseil communautaire et devenir président de l'' EPCI... Cela n'' a rien à voir ! Tel n'' est pas l'' objet de l'' article !,se faire,1,transitive,0,élire
"PA709315,Viala, Arnaud","PA709315,2019-11-21",", ils auront le réflexe de se tourner vers des structures privées qui facturent grassement des diagnostics en",se faisant payer,pour apprendre eux-mêmes pendant six mois ce que les élus savent depuis toujours et en formulant des préconisations,se faire,1,transitive,0,payer
"PA405480,Pupponi, François","PA405480,2019-11-21","le moins, que Mme la garde des sceaux adresse une note aux procureurs. C '' est ce qu'' elle a fait il y a dix jours. Les élus",se font très souvent insulter,"– cela m'' est arrivé. Quand j'' étais maire, un inspecteur de l'' éducation nationale s'' est fait caillasser dans ma",se faire,1,transitive,0,insulter
"PA721270,Peu, Stéphane","PA721270,2019-11-21","de maires qui déploraient leur impuissance, les pouvoirs étant ailleurs et dilués ; ils disaient : on a le droit de",se faire engueuler,", mais pas celui d'' agir. Afin d'' y remédier, le présent amendement tend à rétablir une disposition adoptée par le Sénat",se faire,1,transitive,0,engueuler
"PA721270,Peu, Stéphane","PA721270,2019-11-21","' agir tout de suite, sinon, face aux riverains qu'' il recevra dans son bureau, il ne pourra qu'' écouter, éventuellement",se faire engueuler,et écrire au préfet un courrier dont les conséquences ne se feront pas sentir avant plusieurs semaines ou plusieurs,se faire,1,transitive,0,engueuler
"PA608292,Dubié, Jeanine","PA608292,2019-11-25",", les nôtres comme ceux des personnels hospitaliers en souffrance et ceux des citoyens qui éprouvent des difficultés à",se faire soigner,", tous ces espoirs ont été déçus à l'' issue de nos débats en première lecture, sources d'' une grande frustration.",se faire,1,transitive,0,soigner
"PA720286,Fiat, Caroline","PA720286,2019-11-25","personnes qui nous ont expliqué que leur mutuelle ne prenant pas en compte leurs troubles mentaux, ils ne peuvent",se faire hospitaliser,"faute de place disponible dans le secteur public. Il me semble que, dans la région de Toulouse , c'' est quatre",se faire,1,transitive,0,hospitaliser
